body,communityName,createdAt,dataType,id,isVideo,numberOfComments,numberOfreplies,parentId,parsedCommunityName,parsedId,scrapedAt,thumbnailUrl,title,upVoteRatio,upVotes,url,userId,username,sentiment_score
The media loves Trump because he is a disaster that no one can look away from and he brings in the views,r/Liberal,2023-08-14T16:47:40.000Z,comment,t1_jw5t7hc,,,0.0,t1_jw5rkdb,,jw5t7hc,2024-03-31T20:37:57.438Z,,,,1,https://www.reddit.com/r/Liberal/comments/15q79ev/what_is_happening_to_america/jw5t7hc/,t2_576d419q,ethakidd,80.0
"&gt;Is it plain stupidity or cult following or ignorance on purpose?

A lot of them are Evangelical Christians. They believe a Tibetan monk, who is good and moral by pretty much any standard, is going to hell. But a serial killer or career criminal, who repents right before he dies, can go to heaven.

So when your god is a giant narcissist who cares more about being worshiped than how we treat each other, it's not a surprise that they fall in behind a giant narcissist. Who tells them that they are special, and he will take care of them. All they have to do is believe in him.",r/Liberal,2023-08-13T22:51:12.000Z,comment,t1_jw2d9fd,,,2.0,t3_15q79ev,,jw2d9fd,2024-03-31T20:37:57.438Z,,,,10,https://www.reddit.com/r/Liberal/comments/15q79ev/what_is_happening_to_america/jw2d9fd/,t2_lj1sz,raistlin65,85.0
"Yes because according to their beliefs, God and Jesus only care about Americans in America and they chose Trump as the guy to ""Save America""",r/Liberal,2023-08-13T23:42:35.000Z,comment,t1_jw2kh9k,,,0.0,t1_jw2d9fd,,jw2kh9k,2024-03-31T20:37:57.438Z,,,,6,https://www.reddit.com/r/Liberal/comments/15q79ev/what_is_happening_to_america/jw2kh9k/,t2_576d419q,ethakidd,10.0
"I overheard one of them saying  ""Oh, Trump will take care that when he gets back in."" I'm like... I will crawl over broken glass to prevent that happening (him getting back in the WH) .",r/Liberal,2023-08-14T10:45:02.000Z,comment,t1_jw4fkv1,,,0.0,t1_jw2d9fd,,jw4fkv1,2024-03-31T20:37:57.438Z,,,,3,https://www.reddit.com/r/Liberal/comments/15q79ev/what_is_happening_to_america/jw4fkv1/,t2_13r1zz,rowsella,85.0
The country is now 40-50% authoritarian true believers. These people have to live through a dictatorship era to actually be realistic about what it means.,r/Liberal,2023-08-14T12:20:58.000Z,comment,t1_jw4pitq,,,1.0,t3_15q79ev,,jw4pitq,2024-03-31T20:37:57.438Z,,,,3,https://www.reddit.com/r/Liberal/comments/15q79ev/what_is_happening_to_america/jw4pitq/,t2_13juzu,hammersandhammers,70.0
They think authoritarian rule is what they want until people they know start being rounded up and the ruling party's boot ends up on their neck. What's to stop the wannabe dictator from not leaving office after 4 yrs? What if he decides he wants to amend the constitution to allow him to run again as many times as he wants? President for life and then his children and their children take over after he dies..,r/Liberal,2023-08-14T13:06:10.000Z,comment,t1_jw4v40l,,,1.0,t1_jw4pitq,,jw4v40l,2024-03-31T20:37:57.438Z,,,,2,https://www.reddit.com/r/Liberal/comments/15q79ev/what_is_happening_to_america/jw4v40l/,t2_576d419q,ethakidd,85.0
"Attempting to persuade by reasoning, how passé",r/Liberal,2023-08-14T13:07:09.000Z,comment,t1_jw4v8m5,,,0.0,t1_jw4v40l,,jw4v8m5,2024-03-31T20:37:57.438Z,,,,2,https://www.reddit.com/r/Liberal/comments/15q79ev/what_is_happening_to_america/jw4v8m5/,t2_13juzu,hammersandhammers,20.0
No longer spending any time or energy figuring out what could possibly be on MAGA-types minds. Just working to make sure their candidates never hold power again.,r/Liberal,2023-08-13T23:06:00.000Z,comment,t1_jw2fdph,,,1.0,t3_15q79ev,,jw2fdph,2024-03-31T20:37:57.438Z,,,,5,https://www.reddit.com/r/Liberal/comments/15q79ev/what_is_happening_to_america/jw2fdph/,t2_jjdgf,rucb_alum,90.0
I agree with you! Who has anymore time or energy to try and understand why people vote for him. It’s a CULT! Vote for anyone but a Republican!,r/Liberal,2023-08-14T04:22:06.000Z,comment,t1_jw3jo6z,,,0.0,t1_jw2fdph,,jw3jo6z,2024-03-31T20:37:57.438Z,,,,2,https://www.reddit.com/r/Liberal/comments/15q79ev/what_is_happening_to_america/jw3jo6z/,t2_6a3ii3jn5,Powerful-Pick-8416,90.0
"Trump is the worse thing to happen to this country in this century and that will still be true on  December 31,2099",r/Liberal,2023-08-14T03:25:23.000Z,comment,t1_jw3dei4,,,0.0,t3_15q79ev,,jw3dei4,2024-03-31T20:37:57.438Z,,,,8,https://www.reddit.com/r/Liberal/comments/15q79ev/what_is_happening_to_america/jw3dei4/,t2_u0145cfx,leftofleft3115,95.0
"They are using the Nazi playbook to build up a ""strongman dictator"" to enforce their rules over ""the others"".",r/Liberal,2023-08-13T19:40:16.000Z,comment,t1_jw1k7b4,,,0.0,t3_15q79ev,,jw1k7b4,2024-03-31T20:37:57.438Z,,,,11,https://www.reddit.com/r/Liberal/comments/15q79ev/what_is_happening_to_america/jw1k7b4/,t2_40ziiih,AveryJuanZacritic,85.0
Trumpy MAGA Qanon Cult is worse than a zombie apocalypse destroying families everywhere and eating people’s souls.,r/Liberal,2023-08-14T04:28:23.000Z,comment,t1_jw3kbps,,,0.0,t3_15q79ev,,jw3kbps,2024-03-31T20:37:57.438Z,,,,6,https://www.reddit.com/r/Liberal/comments/15q79ev/what_is_happening_to_america/jw3kbps/,t2_ksljno7k,Confident_Diver_9042,5.0
"You know how birds and other wildlife flee before a natural disaster?

I imagine it’s much the same for Americans right now. They can sense that things aren’t right and are chancing. Faster than expected",r/Liberal,2023-08-13T20:06:32.000Z,comment,t1_jw1oc5w,,,0.0,t3_15q79ev,,jw1oc5w,2024-03-31T20:37:57.438Z,,,,3,https://www.reddit.com/r/Liberal/comments/15q79ev/what_is_happening_to_america/jw1oc5w/,t2_pal5j,here-i-am-now,70.0
"I blame a lot of it on television. It makes people see everything in terms of ""good guys"" and ""bad guys"", that violence has a redeeming effect,   that  there are simple solutions to complex problems and that everything can be resolved in 30 minutes. This makes them easy prey for a con artist, especially if said con artist presents himself as some kind of Messiah. Essentially, they lose contact with reality.",r/Liberal,2023-08-14T07:47:41.000Z,comment,t1_jw41hj0,,,0.0,t3_15q79ev,,jw41hj0,2024-03-31T20:37:57.438Z,,,,3,https://www.reddit.com/r/Liberal/comments/15q79ev/what_is_happening_to_america/jw41hj0/,t2_7tgct7wh,williamweinmann,30.0
Certain members of my family like to proclaim how much they love Trump and I just retort with “that’s some white trash shit.” They know and they don’t care ‍♂️,r/Liberal,2023-08-13T22:53:11.000Z,comment,t1_jw2djro,,,1.0,t3_15q79ev,,jw2djro,2024-03-31T20:37:57.438Z,,,,4,https://www.reddit.com/r/Liberal/comments/15q79ev/what_is_happening_to_america/jw2djro/,t2_b4lat,KidsRAlright,85.0
"It's definitely white trash shit. The Trump house down the street is a hillbilly shit hole, dirty broken down shit everywhere on the property. Directly across the street is a beautiful well kept home with BLM signs on the lawn with other signs about love and acceptance. Really shows what the divide is really like in this country",r/Liberal,2023-08-13T23:39:17.000Z,comment,t1_jw2k123,,,1.0,t1_jw2djro,,jw2k123,2024-03-31T20:37:57.438Z,,,,5,https://www.reddit.com/r/Liberal/comments/15q79ev/what_is_happening_to_america/jw2k123/,t2_576d419q,ethakidd,85.0
"It is weird. I live in a basic middle class suburban tract neighborhood and it is eclectic, racially blended. On on one block we have houses with rainbow signs, another has Jesus words on their windows and piles of bikes in front, another has a Trump flag... only one of those houses I am pretty sure that is where stupid white racists live.",r/Liberal,2023-08-14T10:50:22.000Z,comment,t1_jw4g2fq,,,0.0,t1_jw2k123,,jw4g2fq,2024-03-31T20:37:57.438Z,,,,2,https://www.reddit.com/r/Liberal/comments/15q79ev/what_is_happening_to_america/jw4g2fq/,t2_13r1zz,rowsella,70.0
People are stupid and mental illness is rampant ‍♂️,r/Liberal,2023-08-13T20:48:32.000Z,comment,t1_jw1uxmd,,,0.0,t3_15q79ev,,jw1uxmd,2024-03-31T20:37:57.438Z,,,,3,https://www.reddit.com/r/Liberal/comments/15q79ev/what_is_happening_to_america/jw1uxmd/,t2_5bl65qhc,Ok-Stress-3570,10.0
"I think it really does come down to social media and cable news. Off topic, but I do net meter testing on solar installed systems on home's. A guy last week was so anxious to get his going because all the dams will be gone by the end of next year. I didn't have the heart to tell him that wasn't true and that his system only works when his utility power is on.",r/Liberal,2023-08-13T21:57:03.000Z,comment,t1_jw25cjo,,,1.0,t3_15q79ev,,jw25cjo,2024-03-31T20:37:57.438Z,,,,4,https://www.reddit.com/r/Liberal/comments/15q79ev/what_is_happening_to_america/jw25cjo/,t2_brgqtrp7,No-Split-866,35.0
"I thought it was bad when all these idiots had was talk radio, now it is an idiot explosion.",r/Liberal,2023-08-14T10:46:13.000Z,comment,t1_jw4fooc,,,0.0,t1_jw25cjo,,jw4fooc,2024-03-31T20:37:57.438Z,,,,3,https://www.reddit.com/r/Liberal/comments/15q79ev/what_is_happening_to_america/jw4fooc/,t2_13r1zz,rowsella,85.0
"Kind of ironic how all the dwellings with Trump banners are usually run down shitholes.  Drive through any rural area.   The double wide trailers with broken toys and junk on the front lawns are always the Trumpers.   

It would be comical if it weren't so tragic if they finally realized a billionaire real estate developer from NY didn't actually have poor rural Americans best interest in mind.",r/Liberal,2023-08-13T23:00:40.000Z,comment,t1_jw2em61,,,1.0,t3_15q79ev,,jw2em61,2024-03-31T20:37:57.438Z,,,,5,https://www.reddit.com/r/Liberal/comments/15q79ev/what_is_happening_to_america/jw2em61/,t2_6n5xjiy6,Gandalftron,85.0
"That's exactly it. And the run down shit hole down the street from me has a beautiful house with gardens and nice landscaping directly across from it. And all throughout the front of the nice property are BLM lawn signs, pride rainbows and other signs about love and acceptance. Shit hole slum with Trump flags, beautiful home with love and acceptance",r/Liberal,2023-08-13T23:36:15.000Z,comment,t1_jw2jm4g,,,0.0,t1_jw2em61,,jw2jm4g,2024-03-31T20:37:57.438Z,,,,5,https://www.reddit.com/r/Liberal/comments/15q79ev/what_is_happening_to_america/jw2jm4g/,t2_576d419q,ethakidd,70.0
"He has made it clear that hates the same people they hate. The rest doesn't matter. They don't give a fuck about domestic policy, or any policy for that matter. It's just the hate.

They hate brown people. Not immigrants, you never hear these shit-for-brains MAGAts cry about immigrants from Europe. They don't have issues with Asians coming over from Japan, or even China.

It's just black people and Latinos.

I write off MAGAts as racist the minute I find out what they are. My mother is one of them. She started in with the Great Replacement stuff back in 2016, talking about how by 2040 (or whenever) white people would be a minority. 

Normal people are like ""so?"" 

But for her it was/is some kind of weird existential crisis about ""culture.""

Mom, you think black pepper is spicy, your favorite songs aren't even on FM radio, and you stay home all day, every day, letting nazi FB posts rot your brain. What the fuck kind of culture are you worried about preserving?",r/Liberal,2023-08-14T00:29:07.000Z,comment,t1_jw2qtnh,,,1.0,t3_15q79ev,,jw2qtnh,2024-03-31T20:37:57.438Z,,,,6,https://www.reddit.com/r/Liberal/comments/15q79ev/what_is_happening_to_america/jw2qtnh/,t2_14v6rj,MandatoryFunEscapee,90.0
"I work with mostly white Trump supporters. They snitch on each to me about how the other ones are secretly racist. One guy told me his grandparents raised him to be racist and Republican. Another person said the same about their parents raising them like that. A female in her forties is a known racist, her favorite thing to say is :  "" I'm not racist, I have black people in my family"". None of these people have ever had any migrant, or a person of color do anything to cause them to hate like they do. It's really the brain washing from their parents and the fact that they can look down at and blame someone else for their position and struggles in life. They are probably thinking:"" I might be poor and struggling, but at least I'm not one of Them"". The older ones I work with have advocated for violence against ""Democrats "". The 70 yr old retired driver is now on the child trafficking qanon bandwagon and the other retired part timer is a former cop. Both have said to me that they don't care what Trump does they will still vote for him no matter what. I believe it's just them being their absolute worst because they don't have anything else going for them but their hate.",r/Liberal,2023-08-14T13:34:41.000Z,comment,t1_jw4yxu4,,,1.0,t1_jw2qtnh,,jw4yxu4,2024-03-31T20:37:57.438Z,,,,3,https://www.reddit.com/r/Liberal/comments/15q79ev/what_is_happening_to_america/jw4yxu4/,t2_576d419q,ethakidd,80.0
"Jesus. I work in Texas and can clock racists pretty easily these days, but they are mostly circumspect enough to not talk about it explicitly in the workplace. I've never been in a place where people admit that shit.

I really hope you get a better group of coworkers before long, I wouldn't feel safe working in a place like that. I'd also write about that shit on Glassdoor or something. I don't know, that is insane.",r/Liberal,2023-08-14T18:01:10.000Z,comment,t1_jw65jjo,,,1.0,t1_jw4yxu4,,jw65jjo,2024-03-31T20:37:57.438Z,,,,1,https://www.reddit.com/r/Liberal/comments/15q79ev/what_is_happening_to_america/jw65jjo/,t2_14v6rj,MandatoryFunEscapee,90.0
"It's fine. I'm in the north east United States and like most of the racist people around here, these guys and girls are cowards. They are terrified of anything not white like them and would never actually say anything to me personally. It's never happened. I could easily catch any of them outside of work and these are trash people with no spine or fight in them. Talk behind your back? Absolutely. Hit women and children? Yes. Stand up to another man ? No. No way.",r/Liberal,2023-08-14T20:14:24.000Z,comment,t1_jw6rrp1,,,0.0,t1_jw65jjo,,jw6rrp1,2024-03-31T20:37:57.438Z,,,,1,https://www.reddit.com/r/Liberal/comments/15q79ev/what_is_happening_to_america/jw6rrp1/,t2_576d419q,ethakidd,90.0
It’s the messy middle,r/Liberal,2023-08-13T23:18:52.000Z,comment,t1_jw2h72l,,,0.0,t3_15q79ev,,jw2h72l,2024-03-31T20:37:57.438Z,,,,2,https://www.reddit.com/r/Liberal/comments/15q79ev/what_is_happening_to_america/jw2h72l/,t2_ddsqruqu,openmindedjournist,50.0
If your neighbors are drug addicts the last thing you need to be concerned with is their political opinions ,r/Liberal,2023-08-14T11:33:36.000Z,comment,t1_jw4kaqy,,,0.0,t3_15q79ev,,jw4kaqy,2024-03-31T20:37:57.438Z,,,,2,https://www.reddit.com/r/Liberal/comments/15q79ev/what_is_happening_to_america/jw4kaqy/,t2_c4labbc,NoAward8,10.0
"Americans are self absorbed idiots (yes, I'm from here)",r/Liberal,2023-08-14T17:50:40.000Z,comment,t1_jw63s7m,,,1.0,t3_15q79ev,,jw63s7m,2024-03-31T20:37:57.438Z,,,,2,https://www.reddit.com/r/Liberal/comments/15q79ev/what_is_happening_to_america/jw63s7m/,t2_qp2iw,phrygiantheory,10.0
"Very true(also from here)
 A lot of these people think they are a blessing upon the world, the chosen people. It's not hard to see why other countries hate American tourists with the self righteous attitudes they walk around with",r/Liberal,2023-08-14T20:18:18.000Z,comment,t1_jw6seyc,,,0.0,t1_jw63s7m,,jw6seyc,2024-03-31T20:37:57.438Z,,,,1,https://www.reddit.com/r/Liberal/comments/15q79ev/what_is_happening_to_america/jw6seyc/,t2_576d419q,ethakidd,85.0
"Also, remember that right wing radicals like Murdoch (Fox News), Newt Gingrich (politician), and Rush (right wing radio) have been planting seeds that Radical Dems/Minorities/Immigrants are taking over the America that your parents and grandparents built and changing it to become something that no longer reflects your values for years long before Trump. Trump being the savvy conman that he is seized the opportunity and showed people that they don’t have be sorry or shamed by their beliefs. He made it ok to say the quiet part out loud. He represents their anger and fear.",r/Liberal,2023-08-15T13:07:52.000Z,comment,t1_jwa3k7w,,,1.0,t3_15q79ev,,jwa3k7w,2024-03-31T20:37:57.438Z,,,,2,https://www.reddit.com/r/Liberal/comments/15q79ev/what_is_happening_to_america/jwa3k7w/,t2_odykq8j0,TalkofCircles,85.0
I wonder what they fear so much...is being a minority a bad thing in America? Times are a changing. You can't stop it. The new generation don't have the save beliefs and values their parents and grandparents do. They are more accepting of others. The MAGA people are dying off and outnumbered and they know it,r/Liberal,2023-08-15T13:32:07.000Z,comment,t1_jwa6yno,,,0.0,t1_jwa3k7w,,jwa6yno,2024-03-31T20:37:57.438Z,,,,1,https://www.reddit.com/r/Liberal/comments/15q79ev/what_is_happening_to_america/jwa6yno/,t2_576d419q,ethakidd,80.0
"I think that the overriding motivation, in addition to the options of stupidity, cult, or ignorance, is aspiration: your neighbors might see someone they consider ""better"" who appears to care about their plight and think (somehow) that perceived commonality raises their social standing. i know some who actually think as described, but figure it's just easier and safer to stay quiet and nod away.",r/Liberal,2023-08-19T13:03:48.000Z,comment,t1_jwuqx63,,,0.0,t3_15q79ev,,jwuqx63,2024-03-31T20:37:57.438Z,,,,2,https://www.reddit.com/r/Liberal/comments/15q79ev/what_is_happening_to_america/jwuqx63/,t2_2blcmos6,2tired2care2day,65.0
"People tend to need others be ""under"" them and these bottom of the barrel types need the right wing to keep poc beneath whites",r/Liberal,2023-08-13T20:12:22.000Z,comment,t1_jw1p9cz,,,0.0,t3_15q79ev,,jw1p9cz,2024-03-31T20:37:57.438Z,,,,3,https://www.reddit.com/r/Liberal/comments/15q79ev/what_is_happening_to_america/jw1p9cz/,t2_2ek8e8na,kerssem,10.0
Take pictures and make memes.,r/Liberal,2023-08-13T20:56:47.000Z,comment,t1_jw1w8hq,,,0.0,t3_15q79ev,,jw1w8hq,2024-03-31T20:37:57.438Z,,,,3,https://www.reddit.com/r/Liberal/comments/15q79ev/what_is_happening_to_america/jw1w8hq/,t2_48jy32ol,Rental_Car,50.0
Cult.,r/Liberal,2023-08-13T23:53:14.000Z,comment,t1_jw2lxu0,,,0.0,t3_15q79ev,,jw2lxu0,2024-03-31T20:37:57.438Z,,,,4,https://www.reddit.com/r/Liberal/comments/15q79ev/what_is_happening_to_america/jw2lxu0/,t2_hu5qwot,DoriCee,50.0
"Lack of education, controlled media, and work dress. My top 3 answers.",r/Liberal,2023-08-14T01:52:42.000Z,comment,t1_jw31vqk,,,0.0,t3_15q79ev,,jw31vqk,2024-03-31T20:37:57.438Z,,,,1,https://www.reddit.com/r/Liberal/comments/15q79ev/what_is_happening_to_america/jw31vqk/,t2_7nokdxwj,traveller-1-1,20.0
He gives them permission to be assholes.,r/Liberal,2023-08-14T14:48:39.000Z,comment,t1_jw59uiy,,,0.0,t3_15q79ev,,jw59uiy,2024-03-31T20:37:57.438Z,,,,2,https://www.reddit.com/r/Liberal/comments/15q79ev/what_is_happening_to_america/jw59uiy/,t2_a82138k4,DyslexicFcuker,20.0
Don’t judge all of the US based purely on your experiences with drug addicts living in poverty,r/Liberal,2023-08-13T20:49:59.000Z,comment,t1_jw1v5tg,,,1.0,t3_15q79ev,,jw1v5tg,2024-03-31T20:37:57.438Z,,,,2,https://www.reddit.com/r/Liberal/comments/15q79ev/what_is_happening_to_america/jw1v5tg/,t2_ihdrn,StewTrue,30.0
"I don't. My deceased brother was an addict, and in my 20s I was a heavy drinker/drug user myself and experienced homelessness and poverty.  It amazes me that people living in such conditions have the audacity to look down at other people",r/Liberal,2023-08-13T21:53:06.000Z,comment,t1_jw24rk3,,,1.0,t1_jw1v5tg,,jw24rk3,2024-03-31T20:37:57.438Z,,,,3,https://www.reddit.com/r/Liberal/comments/15q79ev/what_is_happening_to_america/jw24rk3/,t2_576d419q,ethakidd,85.0
"They've been doing it for centuries.  Most of the Antebellum South was poor but they felt ""better"" than African slaves so they didn't fight back against the rich of the time, and a lot even went to war so the rich could keep owning people.",r/Liberal,2023-08-13T22:11:00.000Z,comment,t1_jw27f46,,,0.0,t1_jw24rk3,,jw27f46,2024-03-31T20:37:57.438Z,,,,3,https://www.reddit.com/r/Liberal/comments/15q79ev/what_is_happening_to_america/jw27f46/,t2_w6f4h,tikifire1,95.0
"I like to play pool, and trump support makes me think of the times when you get a bad break and you don't have any makeable shots. So you just hit it real hard at the group of unbroken balls. You have no hope of success: sinking a ball or voting for a better life. So you vote for and support trump bc he's a wildcard, and who knows what will happen.",r/Liberal,2023-08-13T23:05:16.000Z,comment,t1_jw2f9wn,,,0.0,t3_15q79ev,,jw2f9wn,2024-03-31T20:37:57.438Z,,,,1,https://www.reddit.com/r/Liberal/comments/15q79ev/what_is_happening_to_america/jw2f9wn/,t2_q0aavdzd,ItisyouwhosaythatIam,90.0
Sounds like some qanon bullshit,r/Liberal,2023-08-14T12:59:37.000Z,comment,t1_jw4u9tn,,,0.0,t3_15q79ev,,jw4u9tn,2024-03-31T20:37:57.438Z,,,,1,https://www.reddit.com/r/Liberal/comments/15q79ev/what_is_happening_to_america/jw4u9tn/,t2_arm8u,jabroni156,90.0
"It's always funny to me how conservatives talk about Communist China as if it's the ultimate enemy while agreeing with so many of their policies.  The CCP also hates LGBT rights and minority groups, especially Muslims.",r/Liberal,2023-08-14T14:12:11.000Z,comment,t1_jw549xy,,,0.0,t3_15q79ev,,jw549xy,2024-03-31T20:37:57.438Z,,,,1,https://www.reddit.com/r/Liberal/comments/15q79ev/what_is_happening_to_america/jw549xy/,t2_hcnvy4,Newworldrevolution,90.0
"off topic: ""owns golf clubs""  


I know what you meant but I'm just going to believe only rich people can own golf clubs.",r/Liberal,2023-08-14T14:56:22.000Z,comment,t1_jw5b1z0,,,1.0,t3_15q79ev,,jw5b1z0,2024-03-31T20:37:57.438Z,,,,1,https://www.reddit.com/r/Liberal/comments/15q79ev/what_is_happening_to_america/jw5b1z0/,t2_5ccyc,sexi_squidward,60.0
