body,communityName,createdAt,dataType,id,isVideo,numberOfComments,numberOfreplies,parentId,parsedCommunityName,parsedId,scrapedAt,thumbnailUrl,title,upVoteRatio,upVotes,url,userId,username,sentiment_score
"&gt; Plus this will, unfortunately, only strengthen him with his base.

I don't consider this a bad thing.  We should know, precisely, how much of the electorate (most obviously the proportion of the electorate in key swing states) are ""ride or die"" for Trump specifically.  This should provide a decent baseline for how possible it will be for a GOP contender to upsert Trump, and also what the chances of a Biden or post-Biden Democrat running against this criminally charged Trump.",r/moderatepolitics,2023-06-07T21:25:59.000Z,comment,t1_jnb7eou,,,1.0,t1_jnazz5i,,jnb7eou,2024-03-31T20:27:59.302Z,,,,7,https://www.reddit.com/r/moderatepolitics/comments/143n58m/prosecutors_ready_to_ask_for_trump_indictment_on/jnb7eou/,t2_3i4ng,howlin,80.0
Any chance you're a back-end developer? :),r/moderatepolitics,2023-06-07T21:33:26.000Z,comment,t1_jnb8ku4,,,1.0,t1_jnb7eou,,jnb8ku4,2024-03-31T20:27:59.302Z,,,,4,https://www.reddit.com/r/moderatepolitics/comments/143n58m/prosecutors_ready_to_ask_for_trump_indictment_on/jnb8ku4/,t2_3988i,strixvarius,50.0
"yes, I dabble in back end software development.  Like, this is my primary day job sort of dabbling.",r/moderatepolitics,2023-06-07T21:36:24.000Z,comment,t1_jnb91jt,,,0.0,t1_jnb8ku4,,jnb91jt,2024-03-31T20:27:59.302Z,,,,6,https://www.reddit.com/r/moderatepolitics/comments/143n58m/prosecutors_ready_to_ask_for_trump_indictment_on/jnb91jt/,t2_3i4ng,howlin,50.0
Is it possible he'll be on some sort of gag order during the trial? Which should be during prime campaign season?,r/moderatepolitics,2023-06-07T23:27:53.000Z,comment,t1_jnbpac1,,,0.0,t1_jnazz5i,,jnbpac1,2024-03-31T20:27:59.302Z,,,,3,https://www.reddit.com/r/moderatepolitics/comments/143n58m/prosecutors_ready_to_ask_for_trump_indictment_on/jnbpac1/,t2_5fqzwu9p,bullcityblue312,20.0
"But Trump doesn't have enough base to win the general election, and anyone who isn't the base will never vote for him again.",r/moderatepolitics,2023-06-07T20:59:36.000Z,comment,t1_jnb353c,,,3.0,t1_jnazz5i,,jnb353c,2024-03-31T20:27:59.302Z,,,,15,https://www.reddit.com/r/moderatepolitics/comments/143n58m/prosecutors_ready_to_ask_for_trump_indictment_on/jnb353c/,t2_6igzlga7,Aert_is_Life,25.0
"Exactly, if Trump runs Biden wins, and I believe that what Biden/The DNC/and most of the media want to see happen.

Trump runs, they all get great ratings, and it helps seal a second term for Biden.",r/moderatepolitics,2023-06-07T22:53:50.000Z,comment,t1_jnbkit4,,,1.0,t1_jnb353c,,jnbkit4,2024-03-31T20:27:59.302Z,,,,9,https://www.reddit.com/r/moderatepolitics/comments/143n58m/prosecutors_ready_to_ask_for_trump_indictment_on/jnbkit4/,t2_9s5im,rwk81,90.0
I honestly think Biden beats DeSantis too. Support in his own state has dropped a ton and he’s proving to be just as big of a buffoon asTrump (if not moreso with his lame “anti-woke “ message - especially with it being all he talks about).,r/moderatepolitics,2023-06-07T23:28:56.000Z,comment,t1_jnbpfl2,,,1.0,t1_jnbkit4,,jnbpfl2,2024-03-31T20:27:59.302Z,,,,13,https://www.reddit.com/r/moderatepolitics/comments/143n58m/prosecutors_ready_to_ask_for_trump_indictment_on/jnbpfl2/,t2_kofd3kg,twolvesfan217,85.0
"DeSantis *before* he went all in on anti-woke and hard right wing agenda pushing was fairly competitive in a general election. Now, with both unpopular policies AND a lack of charisma, he has no case.

Anti-woke is about as shallow as you can get as far as the issues go. While the terminally online guys can talk about it forever, it's just not that engaging to voters that aren't super plugged in. Anti-Wokeness doesn't create any jobs, raise wages, build infrastructure, lower crime rates, or fix any real problems people have.",r/moderatepolitics,2023-06-08T04:02:13.000Z,comment,t1_jncpe8a,,,2.0,t1_jnbpfl2,,jncpe8a,2024-03-31T20:27:59.302Z,,,,5,https://www.reddit.com/r/moderatepolitics/comments/143n58m/prosecutors_ready_to_ask_for_trump_indictment_on/jncpe8a/,t2_y1dux,LaughingGaster666,75.0
"Plus he's now on the record as supporting a 6-week abortion ban. That's deeply unpopular nationally, although I've had conservatives (unsuccessfully IMO) arguing that he only wants that as a state law and not a federal one.",r/moderatepolitics,2023-06-08T15:17:36.000Z,comment,t1_jnekc2m,,,1.0,t1_jncpe8a,,jnekc2m,2024-03-31T20:27:59.302Z,,,,6,https://www.reddit.com/r/moderatepolitics/comments/143n58m/prosecutors_ready_to_ask_for_trump_indictment_on/jnekc2m/,t2_ih9v4,PM_ME_YOUR_DARKNESS,70.0
Yeah I’m sure everyone concerned with abortion rights is tooooootally going to believe any R that says they won’t go national with restrictions… even though Lindsay Graham basically said otherwise.,r/moderatepolitics,2023-06-08T15:45:08.000Z,comment,t1_jneonsq,,,1.0,t1_jnekc2m,,jneonsq,2024-03-31T20:27:59.302Z,,,,7,https://www.reddit.com/r/moderatepolitics/comments/143n58m/prosecutors_ready_to_ask_for_trump_indictment_on/jneonsq/,t2_y1dux,LaughingGaster666,85.0
"Oh, it's a laughable argument, but that's what they're (currently) going with.",r/moderatepolitics,2023-06-08T15:46:35.000Z,comment,t1_jneovzh,,,1.0,t1_jneonsq,,jneovzh,2024-03-31T20:27:59.302Z,,,,5,https://www.reddit.com/r/moderatepolitics/comments/143n58m/prosecutors_ready_to_ask_for_trump_indictment_on/jneovzh/,t2_ih9v4,PM_ME_YOUR_DARKNESS,50.0
"Good grief, politicians lying is hardly the most bold idea put there. Do they just think everyone else is stupid or somethimg?",r/moderatepolitics,2023-06-08T16:02:39.000Z,comment,t1_jnergar,,,0.0,t1_jneovzh,,jnergar,2024-03-31T20:27:59.302Z,,,,3,https://www.reddit.com/r/moderatepolitics/comments/143n58m/prosecutors_ready_to_ask_for_trump_indictment_on/jnergar/,t2_y1dux,LaughingGaster666,10.0
"&gt; But Trump doesn't have enough base to win the general election, and anyone who isn't the base will never vote for him again.

Anyone who posts to a reddit politics forum will agree. But this isn't the same as the American electorate.  They aren't as well informed in general.",r/moderatepolitics,2023-06-07T21:29:39.000Z,comment,t1_jnb7zg0,,,3.0,t1_jnb353c,,jnb7zg0,2024-03-31T20:27:59.302Z,,,,7,https://www.reddit.com/r/moderatepolitics/comments/143n58m/prosecutors_ready_to_ask_for_trump_indictment_on/jnb7zg0/,t2_3i4ng,howlin,20.0
I don't think anybody's going to have any trouble being informed of Trump's trials. They're likely to be just about all the media will talk about. Anybody with even the most basic level of awareness will know about it.,r/moderatepolitics,2023-06-07T21:35:20.000Z,comment,t1_jnb8vge,,,1.0,t1_jnb7zg0,,jnb8vge,2024-03-31T20:27:59.302Z,,,,3,https://www.reddit.com/r/moderatepolitics/comments/143n58m/prosecutors_ready_to_ask_for_trump_indictment_on/jnb8vge/,t2_8v960a8b,VoterFrog,30.0
