body,communityName,createdAt,dataType,id,isVideo,numberOfComments,numberOfreplies,parentId,parsedCommunityName,parsedId,scrapedAt,thumbnailUrl,title,upVoteRatio,upVotes,url,userId,username,sentiment_score
"URL: https://nypost.com/2023/04/26/the-blueprint-to-beat-biden-is-ron-desantis-not-another-4-years-of-trump/
Thumbnail: https://b.thumbs.redditmedia.com/ujBIvqqXN8mPdAiy8jecYdGB9BaXWY9Ix3rY3O0aW9Y.jpg
Images:
	https://external-preview.redd.it/D_N3eMo-thf1STtHifqAOSgFLu7YyNsJpO05lQ4Kv4U.jpg?auto=webp&amp;s=9b6ccde3784b4accf178c83a5139cf6e0ba5d15d
",r/Conservative,2023-04-27T13:53:59.000Z,post,t3_130mwr6,False,2675.0,,,Conservative,130mwr6,2024-03-31T20:21:31.696Z,https://b.thumbs.redditmedia.com/ujBIvqqXN8mPdAiy8jecYdGB9BaXWY9Ix3rY3O0aW9Y.jpg,"If the GOP can’t figure out how to beat old Joe, they’re useless",0.64,3684,https://www.reddit.com/r/Conservative/comments/130mwr6/if_the_gop_cant_figure_out_how_to_beat_old_joe/,t2_d2kiisbo,Vibranium2222,65.0
I agree. But before primary season polls are like 80% name recognition. I don't think he's got the lead it seems he does,r/Conservative,2023-04-27T17:31:56.000Z,comment,t1_jhy0ucb,,,2.0,t1_jhxe3dw,,jhy0ucb,2024-03-31T20:21:31.761Z,,,,138,https://www.reddit.com/r/Conservative/comments/130mwr6/if_the_gop_cant_figure_out_how_to_beat_old_joe/jhy0ucb/,t2_bth90ot1,_Diggus_Bickus_,50.0
"What's the best case scenario that doesn't involve Trump backing out of the primary? Even if DeSantis wins the nomination who can reasonably believe Trump is going to leave him intact for the general? He is such a narcissist and sore loser he will claim fraud and that the RiNoS!! stole the nomination from him. The same way there are X% of people who are willing to vote for Republicans/like America First policies but won't vote for Trump, there are X/1.5% of people who any Republican needs to show up in a general who won't vote for anyone but Trump if they think Trump got shafted. It seems like DeSantis is going to run and he's got the donors gassing him up to run. But, I wonder if he wouldn't be better off waiting just to not have a loss on his record going into 2028. No ideal scenario thanks to Trump.",r/Conservative,2023-04-27T21:02:36.000Z,comment,t1_jhyxoce,,,2.0,t1_jhy0ucb,,jhyxoce,2024-03-31T20:21:31.761Z,,,,91,https://www.reddit.com/r/Conservative/comments/130mwr6/if_the_gop_cant_figure_out_how_to_beat_old_joe/jhyxoce/,t2_13wnlp,jchon960,80.0
"Desantis doesn't lose anything by waiting for Trump to run his course. He's young and loved in Florida. Seems a smarter course would be to sidestep this election, then swoop in to save the day* in 2028.

*Not my day, though. He's too authoritarian for me.",r/Conservative,2023-04-28T02:46:48.000Z,comment,t1_ji08ryw,,,1.0,t1_jhyxoce,,ji08ryw,2024-03-31T20:21:31.761Z,,,,10,https://www.reddit.com/r/Conservative/comments/130mwr6/if_the_gop_cant_figure_out_how_to_beat_old_joe/ji08ryw/,t2_5ojqvquj,Whoatemydelitray,70.0
"Yeah we are toast, I fear. Then Joe will step down for Kamala.",r/Conservative,2023-04-27T16:30:57.000Z,comment,t1_jhxrf09,,,9.0,t1_jhxe3dw,,jhxrf09,2024-03-31T20:21:31.761Z,,,,99,https://www.reddit.com/r/Conservative/comments/130mwr6/if_the_gop_cant_figure_out_how_to_beat_old_joe/jhxrf09/,t2_im5ib,KennedyX8,90.0
"Liberal's opinion:  if Biden/Harris win again, I don't see him stepping down because of old age/health.  Politicians wait until they die to step down.  RBG and Feinstein come to mind on the dem side.",r/Conservative,2023-04-27T17:27:57.000Z,comment,t1_jhy08hn,,,2.0,t1_jhxrf09,,jhy08hn,2024-03-31T20:21:31.761Z,,,,262,https://www.reddit.com/r/Conservative/comments/130mwr6/if_the_gop_cant_figure_out_how_to_beat_old_joe/jhy08hn/,t2_3u21q,acreklaw,65.0
Yeah Dems don't retire they are forced out. It's the number 1 complaint progressives have. The DNC will support anyone who has already won on e.,r/Conservative,2023-04-27T17:51:38.000Z,comment,t1_jhy3tus,,,3.0,t1_jhy08hn,,jhy3tus,2024-03-31T20:21:31.761Z,,,,66,https://www.reddit.com/r/Conservative/comments/130mwr6/if_the_gop_cant_figure_out_how_to_beat_old_joe/jhy3tus/,,[deleted],80.0
Same thing for Republicans though. People want to hold onto power forever it seems.,r/Conservative,2023-04-27T18:16:19.000Z,comment,t1_jhy7ktp,,,3.0,t1_jhy3tus,,jhy7ktp,2024-03-31T20:21:31.761Z,,,,156,https://www.reddit.com/r/Conservative/comments/130mwr6/if_the_gop_cant_figure_out_how_to_beat_old_joe/jhy7ktp/,t2_w4l99isw,hellokitty3433,50.0
"Unfortunately very true. I’ve never met someone who like McConnell, Romney, or even really McCarthy, and yet they persist",r/Conservative,2023-04-27T20:00:32.000Z,comment,t1_jhynkwh,,,1.0,t1_jhy7ktp,,jhynkwh,2024-03-31T20:21:31.761Z,,,,54,https://www.reddit.com/r/Conservative/comments/130mwr6/if_the_gop_cant_figure_out_how_to_beat_old_joe/jhynkwh/,t2_z6nao,ReltivlyObjectv,80.0
That's just politicians in general though. Power is a strong drug.,r/Conservative,2023-04-27T18:18:31.000Z,comment,t1_jhy7x0y,,,1.0,t1_jhy3tus,,jhy7x0y,2024-03-31T20:21:31.761Z,,,,42,https://www.reddit.com/r/Conservative/comments/130mwr6/if_the_gop_cant_figure_out_how_to_beat_old_joe/jhy7x0y/,t2_813sypd0,UltraLowDef,50.0
Wasn't that the same story of what was going tochappen after last election? Do the goal posts keep moving on this?,r/Conservative,2023-04-27T16:47:52.000Z,comment,t1_jhxu29k,,,1.0,t1_jhxrf09,,jhxu29k,2024-03-31T20:21:31.761Z,,,,186,https://www.reddit.com/r/Conservative/comments/130mwr6/if_the_gop_cant_figure_out_how_to_beat_old_joe/jhxu29k/,t2_tmae0,RENNYandBRENNY,25.0
Nobody likes Kamala. Biden will rather step in shit than step aside for Kamala. She is his ethnic female alibi so people will feel better about voting for the whitest oldest man in the world even though they've spent a decade talking about how old white men should not be running things.,r/Conservative,2023-04-27T19:08:43.000Z,comment,t1_jhyfm2q,,,1.0,t1_jhxrf09,,jhyfm2q,2024-03-31T20:21:31.761Z,,,,63,https://www.reddit.com/r/Conservative/comments/130mwr6/if_the_gop_cant_figure_out_how_to_beat_old_joe/jhyfm2q/,t2_aqaiqm0z,DlphLndgrn,30.0
"Far left here, I don't think he'd do that. He spent way too long chasing the Oval to just give it up like that.",r/Conservative,2023-04-27T18:29:37.000Z,comment,t1_jhy9mk5,,,2.0,t1_jhxrf09,,jhy9mk5,2024-03-31T20:21:31.761Z,,,,47,https://www.reddit.com/r/Conservative/comments/130mwr6/if_the_gop_cant_figure_out_how_to_beat_old_joe/jhy9mk5/,t2_1yj6cn6f,archiotterpup,20.0
"Can certainly see that. But maybe it’s something that has to/should happen at some point. Maybe in a couple years he literally is a walking corpse and there is general concern around him. Wild times we live in. I mean, a literal game show host was president, so nothing is out of bounds!",r/Conservative,2023-04-27T18:32:09.000Z,comment,t1_jhya0pw,,,3.0,t1_jhy9mk5,,jhya0pw,2024-03-31T20:21:31.761Z,,,,6,https://www.reddit.com/r/Conservative/comments/130mwr6/if_the_gop_cant_figure_out_how_to_beat_old_joe/jhya0pw/,t2_im5ib,KennedyX8,70.0
"Eh, FDR and Regan both got to play Weekend at Bernie's. My money's on that. 

But yeah, once we (the collective we) started electing celebrities and game show hosts (people who will say anything for approval applause) we lost.",r/Conservative,2023-04-27T18:40:22.000Z,comment,t1_jhyba0l,,,0.0,t1_jhya0pw,,jhyba0l,2024-03-31T20:21:31.761Z,,,,22,https://www.reddit.com/r/Conservative/comments/130mwr6/if_the_gop_cant_figure_out_how_to_beat_old_joe/jhyba0l/,t2_1yj6cn6f,archiotterpup,20.0
"God, I feel like political parties are willing to go full weekend at Bernie’s once their candidate gets into office. Reagan had Alzheimer’s at the end and I find it hard to believe his inner circle didn’t know.",r/Conservative,2023-04-27T18:41:45.000Z,comment,t1_jhybhlt,,,2.0,t1_jhya0pw,,jhybhlt,2024-03-31T20:21:31.761Z,,,,16,https://www.reddit.com/r/Conservative/comments/130mwr6/if_the_gop_cant_figure_out_how_to_beat_old_joe/jhybhlt/,t2_3u21q,acreklaw,20.0
Politics and power. Yeesh.,r/Conservative,2023-04-27T18:43:35.000Z,comment,t1_jhybroq,,,0.0,t1_jhybhlt,,jhybroq,2024-03-31T20:21:31.761Z,,,,6,https://www.reddit.com/r/Conservative/comments/130mwr6/if_the_gop_cant_figure_out_how_to_beat_old_joe/jhybroq/,t2_im5ib,KennedyX8,50.0
"That's what people said with this term, he's still stumbling along.",r/Conservative,2023-04-27T17:11:23.000Z,comment,t1_jhxxpx3,,,1.0,t1_jhxrf09,,jhxxpx3,2024-03-31T20:21:31.761Z,,,,16,https://www.reddit.com/r/Conservative/comments/130mwr6/if_the_gop_cant_figure_out_how_to_beat_old_joe/jhxxpx3/,t2_ixgcr,kswitch5022,50.0
That won’t happen. That rumor went around last time,r/Conservative,2023-04-27T18:21:24.000Z,comment,t1_jhy8cxw,,,1.0,t1_jhxrf09,,jhy8cxw,2024-03-31T20:21:31.761Z,,,,11,https://www.reddit.com/r/Conservative/comments/130mwr6/if_the_gop_cant_figure_out_how_to_beat_old_joe/jhy8cxw/,t2_1keh0z5a,Ihatemunchies,10.0
Would you actually put that on a bet that Joe is gonna step down and let Kamala take his place? The amount of conservatives that pushed this the first time around is hilarious. The ones pushing it this time are just displaying insanity. Typical...,r/Conservative,2023-04-27T17:34:28.000Z,comment,t1_jhy17sh,,,2.0,t1_jhxrf09,,jhy17sh,2024-03-31T20:21:31.761Z,,,,24,https://www.reddit.com/r/Conservative/comments/130mwr6/if_the_gop_cant_figure_out_how_to_beat_old_joe/jhy17sh/,t2_tsr7t4cv,warriormango1,90.0
Imaginary scenarios get the most clicks.,r/Conservative,2023-04-27T17:53:08.000Z,comment,t1_jhy4274,,,1.0,t1_jhy17sh,,jhy4274,2024-03-31T20:21:31.761Z,,,,25,https://www.reddit.com/r/Conservative/comments/130mwr6/if_the_gop_cant_figure_out_how_to_beat_old_joe/jhy4274/,t2_bdmopxvd,corncob_subscriber,60.0
I don't think Jill Biden will permit that.  He will stay in office long after rigor mortis has come and gone.  I think Edith Wilson 2.0 is calling the shots here.,r/Conservative,2023-04-27T17:11:56.000Z,comment,t1_jhxxswg,,,2.0,t1_jhxrf09,,jhxxswg,2024-03-31T20:21:31.761Z,,,,18,https://www.reddit.com/r/Conservative/comments/130mwr6/if_the_gop_cant_figure_out_how_to_beat_old_joe/jhxxswg/,t2_8sex3,CPAeconLogic,20.0
"To be fair, if I was deciding what to do the last couple years of my life, that doesn’t sound too bad ‍♂️",r/Conservative,2023-04-27T17:28:42.000Z,comment,t1_jhy0cmu,,,1.0,t1_jhxxswg,,jhy0cmu,2024-03-31T20:21:31.761Z,,,,11,https://www.reddit.com/r/Conservative/comments/130mwr6/if_the_gop_cant_figure_out_how_to_beat_old_joe/jhy0cmu/,t2_3r66r47k,Tater72,50.0
"You know how many comments I’ve seen? I saw one that said “I don’t care if Biden is 120 years old I’m voting democrat” 

How do you fight that? Screaming about marijuana and abortion is not going to win over the MAJORITY of young voters. The cult like worship of trump isn’t either. Downvote me all you’d like, but it’s a shame. Like it or not, the media and democrats are winning over the youth.",r/Conservative,2023-04-27T15:37:11.000Z,comment,t1_jhxj0tu,,,13.0,t3_130mwr6,,jhxj0tu,2024-03-31T20:21:31.762Z,,,,1197,https://www.reddit.com/r/Conservative/comments/130mwr6/if_the_gop_cant_figure_out_how_to_beat_old_joe/jhxj0tu/,t2_5xgrdhtt,aybabyaybaby,90.0
"Republicans should just throw the libertarian wing a bone and legalise it.

I'd much rather people skeptical of legalisation are the people implementing it, than people so in favour of it they are blind to the possible negative effects.

Plus it would be a pretty solid optical win. Hardcore republicans aren't going to vote democrat because of it, but plenty of floating voters would see the willingness to compromise it shows and vote R.",r/Conservative,2023-04-27T16:49:11.000Z,comment,t1_jhxu9xy,,,3.0,t1_jhxqm1z,,jhxu9xy,2024-03-31T20:21:31.762Z,,,,150,https://www.reddit.com/r/Conservative/comments/130mwr6/if_the_gop_cant_figure_out_how_to_beat_old_joe/jhxu9xy/,t2_15p34b,useablelobster2,70.0
"The platform to win the Youth vote would probably be to the left of even where the mainstream Democratic Party platform is. 

The Youth voter is to the left of the median voter on pretty much every issue. 

What does a Republican Party platform that attracts youth voters look like?",r/Conservative,2023-04-27T18:00:48.000Z,comment,t1_jhy57qi,,,4.0,t1_jhxpes1,,jhy57qi,2024-03-31T20:21:31.762Z,,,,49,https://www.reddit.com/r/Conservative/comments/130mwr6/if_the_gop_cant_figure_out_how_to_beat_old_joe/jhy57qi/,t2_b15dbmb5,RickMoranisFanPage,80.0
"Maybe if they had a seat at the table, they'd feel like they had a place to be.",r/Conservative,2023-04-27T18:27:20.000Z,comment,t1_jhy99y8,,,1.0,t1_jhy57qi,,jhy99y8,2024-03-31T20:21:31.762Z,,,,8,https://www.reddit.com/r/Conservative/comments/130mwr6/if_the_gop_cant_figure_out_how_to_beat_old_joe/jhy99y8/,t2_h0qmm,ozarkcdn,60.0
"I don’t know about that. Democrats are old AF with Biden, Pelosi, Schumer, Feinstein, etc. and are still beating Republicans handily with the youth vote.",r/Conservative,2023-04-27T18:47:22.000Z,comment,t1_jhyccs4,,,0.0,t1_jhy99y8,,jhyccs4,2024-03-31T20:21:31.762Z,,,,8,https://www.reddit.com/r/Conservative/comments/130mwr6/if_the_gop_cant_figure_out_how_to_beat_old_joe/jhyccs4/,t2_b15dbmb5,RickMoranisFanPage,30.0
"As someone who is more liberal leaning, this is fucking it.  I would love for there to be 2 (preferably more) solid parties to choose from but the only thing consistent about the GOP is tax laws that benefit the ultra wealthy. When you guys have headlines like ""war on stoves"" you need to take a step back and reevaluate what's important. This may get downvoted on this sub but if it weren't for gerrymandering, the current GOP would be completely irrelevant politically because of this nonsense.",r/Conservative,2023-04-27T17:21:38.000Z,comment,t1_jhxz9ux,,,4.0,t1_jhxpes1,,jhxz9ux,2024-03-31T20:21:31.762Z,,,,252,https://www.reddit.com/r/Conservative/comments/130mwr6/if_the_gop_cant_figure_out_how_to_beat_old_joe/jhxz9ux/,t2_nrzyoq4,Xa_Is_Here,90.0
"This is exactly where I fall, and why ranked choice would REALLY allow legitimate third parties",r/Conservative,2023-04-27T18:32:46.000Z,comment,t1_jhya41s,,,2.0,t1_jhxz9ux,,jhya41s,2024-03-31T20:21:31.762Z,,,,60,https://www.reddit.com/r/Conservative/comments/130mwr6/if_the_gop_cant_figure_out_how_to_beat_old_joe/jhya41s/,t2_ezuh0,GlassOfLiquor,70.0
Which is why we'll never get ranked choice voting.,r/Conservative,2023-04-27T18:48:45.000Z,comment,t1_jhyckgz,,,0.0,t1_jhya41s,,jhyckgz,2024-03-31T20:21:31.762Z,,,,19,https://www.reddit.com/r/Conservative/comments/130mwr6/if_the_gop_cant_figure_out_how_to_beat_old_joe/jhyckgz/,t2_7kwx9,TattooOfBlood,10.0
Close this thread.  You nailed it!,r/Conservative,2023-04-27T18:32:41.000Z,comment,t1_jhya3ml,,,0.0,t1_jhxz9ux,,jhya3ml,2024-03-31T20:21:31.762Z,,,,19,https://www.reddit.com/r/Conservative/comments/130mwr6/if_the_gop_cant_figure_out_how_to_beat_old_joe/jhya3ml/,t2_1ateukrx,jzabkowicz,50.0
"A big problem is that, as with all things, the loudest people set the tone, and the opposition then typecasts everyone in that light. On any of the other left leaning subs right now, there are countless posts about how ""republicans"" or ""conservatives"" are &lt;insert derogatory label here&gt; or only think/do X because they are &lt;repeat label here&gt;. (of course, same is said for right-leaning subs talking about liberals.) And there are plenty of people that absolutely fit those labels, but it just creates the endless culture wars driven by the obnoxious extremists, and every sane person floating somewhere in the middle just gets dragged around because if we stand up against the garbage on ""our team"" we get exiled completely.

I'm deeply religious myself, but I am also aware that the interwoven nature of religion and this political party has made it difficult to be objective on a lot of things. My religion is about myself and my relationship with a diety. I am able to separate that from laws meant to keep some level of civilized society in check, but many people are not. In other words, I understand it's not my job to stop someone else from doing something that I might think is ""sin"" but is socially acceptable.",r/Conservative,2023-04-27T18:08:48.000Z,comment,t1_jhy6fe2,,,2.0,t1_jhxz9ux,,jhy6fe2,2024-03-31T20:21:31.762Z,,,,39,https://www.reddit.com/r/Conservative/comments/130mwr6/if_the_gop_cant_figure_out_how_to_beat_old_joe/jhy6fe2/,t2_813sypd0,UltraLowDef,40.0
If there is a dinner party and there are 16 people and a Nazi shows up and no one says anything or asks them to leave then you now have 17 Nazis. What's going on with Zooey Zephyr right now is not ok. She's 34 and maybe people need to take a long hard look at if the younger people in this country will go along with it,r/Conservative,2023-04-27T18:52:55.000Z,comment,t1_jhyd7gz,,,1.0,t1_jhy6fe2,,jhyd7gz,2024-03-31T20:21:31.762Z,,,,14,https://www.reddit.com/r/Conservative/comments/130mwr6/if_the_gop_cant_figure_out_how_to_beat_old_joe/jhyd7gz/,t2_4fj86fnh,BriRoxas,90.0
What are Republicans for? Because the only thing they promote is what they're against.,r/Conservative,2023-04-27T18:15:40.000Z,comment,t1_jhy7haf,,,1.0,t1_jhxpes1,,jhy7haf,2024-03-31T20:21:31.762Z,,,,17,https://www.reddit.com/r/Conservative/comments/130mwr6/if_the_gop_cant_figure_out_how_to_beat_old_joe/jhy7haf/,t2_gk3h03sl,JurassicParkFood,80.0
Pre-trump Nikki is where it was at.,r/Conservative,2023-04-27T18:14:51.000Z,comment,t1_jhy7coz,,,0.0,t1_jhxpes1,,jhy7coz,2024-03-31T20:21:31.762Z,,,,5,https://www.reddit.com/r/Conservative/comments/130mwr6/if_the_gop_cant_figure_out_how_to_beat_old_joe/jhy7coz/,,[deleted],70.0
Nailed it,r/Conservative,2023-04-27T18:09:37.000Z,comment,t1_jhy6k54,,,0.0,t1_jhxpes1,,jhy6k54,2024-03-31T20:21:31.762Z,,,,2,https://www.reddit.com/r/Conservative/comments/130mwr6/if_the_gop_cant_figure_out_how_to_beat_old_joe/jhy6k54/,t2_vgyeaah6,chickentootssoup,50.0
I’ve been blue all my life but at this point if you get rid of the above mentioned creatures I would vote red. I’m ready.,r/Conservative,2023-04-27T18:29:18.000Z,comment,t1_jhy9krt,,,0.0,t1_jhxpes1,,jhy9krt,2024-03-31T20:21:31.762Z,,,,4,https://www.reddit.com/r/Conservative/comments/130mwr6/if_the_gop_cant_figure_out_how_to_beat_old_joe/jhy9krt/,t2_9ymloete,bleachedbunghole_bob,70.0
Honestly I’m not sure there is a way. The overturning of Roe vs Wade literally killed any chance of the Republican Party to be successful in the short term. Abortion is that big of an issue to the majority of Americans and the GOP continues to make Abortion a key part of its platform.,r/Conservative,2023-04-27T23:02:04.000Z,comment,t1_jhze444,,,1.0,t1_jhxj0tu,,jhze444,2024-03-31T20:21:31.762Z,,,,66,https://www.reddit.com/r/Conservative/comments/130mwr6/if_the_gop_cant_figure_out_how_to_beat_old_joe/jhze444/,t2_72enn,Stained_Dagger,80.0
"you don't fight that, the same way they don't fight the "" I don't care if trump had private parties with epstein and miss teen america contestants"".  

you court the 15% of people who are independents with good policy. hard core partisans are gonna vote their party even if they run a moldy sandwich.",r/Conservative,2023-04-27T18:59:11.000Z,comment,t1_jhye6i4,,,1.0,t1_jhxj0tu,,jhye6i4,2024-03-31T20:21:31.762Z,,,,38,https://www.reddit.com/r/Conservative/comments/130mwr6/if_the_gop_cant_figure_out_how_to_beat_old_joe/jhye6i4/,t2_rd252wbf,Electronic-Disk6632,70.0
"""How do you fight that?"" Not with Trump.",r/Conservative,2023-04-27T18:38:15.000Z,comment,t1_jhyayjb,,,1.0,t1_jhxj0tu,,jhyayjb,2024-03-31T20:21:31.762Z,,,,50,https://www.reddit.com/r/Conservative/comments/130mwr6/if_the_gop_cant_figure_out_how_to_beat_old_joe/jhyayjb/,t2_2rcjqo24,that_guy124,85.0
"For real. The opposite idea of OP is also true: If the Dems can't figure out how to beat Trump they are useless. Why do all parties keep elevating the worst, and then wondering why it's not working out in their favor?",r/Conservative,2023-04-27T18:00:42.000Z,comment,t1_jhy577m,,,1.0,t1_jhxj0tu,,jhy577m,2024-03-31T20:21:31.762Z,,,,22,https://www.reddit.com/r/Conservative/comments/130mwr6/if_the_gop_cant_figure_out_how_to_beat_old_joe/jhy577m/,t2_813sypd0,UltraLowDef,70.0
So Dr. Oz then? With Herschel Walker as the VP?,r/Conservative,2023-04-27T16:26:34.000Z,comment,t1_jhxqqfj,,,1.0,t1_jhxd5e7,,jhxqqfj,2024-03-31T20:21:31.762Z,,,,120,https://www.reddit.com/r/Conservative/comments/130mwr6/if_the_gop_cant_figure_out_how_to_beat_old_joe/jhxqqfj/,t2_lg7m0,JSchneider85,50.0
Yes exactly. Real American patriots with great electability in a historically friendly election cycle for Republicans!,r/Conservative,2023-04-27T16:30:35.000Z,comment,t1_jhxrcy2,,,1.0,t1_jhxqqfj,,jhxrcy2,2024-03-31T20:21:31.762Z,,,,46,https://www.reddit.com/r/Conservative/comments/130mwr6/if_the_gop_cant_figure_out_how_to_beat_old_joe/jhxrcy2/,t2_uoaz6hpj,HomieMassager,40.0
"In all seriousness, who *would* make a good candidate. The publican party these days is infighting for the biggest knucklehead award. Republicans have some governors that would be decent, but none are looking to run, from what I see.",r/Conservative,2023-04-27T16:40:36.000Z,comment,t1_jhxswsc,,,3.0,t1_jhxrcy2,,jhxswsc,2024-03-31T20:21:31.762Z,,,,30,https://www.reddit.com/r/Conservative/comments/130mwr6/if_the_gop_cant_figure_out_how_to_beat_old_joe/jhxswsc/,t2_15q3ys,ChineWalkin,65.0
"Agreed. I hate how everything has to be about race, class, gender, and whatever other thing the make into an issue for the day. 

I want someone who has a solid forgin policy that's going to put the screws to whoever is against us. I want someone who is going to defend the constitution, *in its entirety.* I want someone the gun grabbing democrats fear. Basically, I want the Late Justice Scalia as president (assuming he would put it to our adversaries*).

*It goes without saying, you don't have to go to war to put it to our adversaries. ex. break the ball and chain that is China. Don't *align* ourselves with communist regimes.",r/Conservative,2023-04-27T18:42:49.000Z,comment,t1_jhybngn,,,0.0,t1_jhy804c,,jhybngn,2024-03-31T20:21:31.762Z,,,,3,https://www.reddit.com/r/Conservative/comments/130mwr6/if_the_gop_cant_figure_out_how_to_beat_old_joe/jhybngn/,t2_15q3ys,ChineWalkin,10.0
Who would make a good candidate? nobody.  Who would win? probably anyone other than Trump &amp; Christie.,r/Conservative,2023-04-27T17:54:22.000Z,comment,t1_jhy48x7,,,3.0,t1_jhxswsc,,jhy48x7,2024-03-31T20:21:31.762Z,,,,5,https://www.reddit.com/r/Conservative/comments/130mwr6/if_the_gop_cant_figure_out_how_to_beat_old_joe/jhy48x7/,t2_9xemw2um,RadiantArk,75.0
So you’re telling me that Jeb! Has a chance now?,r/Conservative,2023-04-27T18:40:32.000Z,comment,t1_jhybay7,,,1.0,t1_jhy48x7,,jhybay7,2024-03-31T20:21:31.762Z,,,,3,https://www.reddit.com/r/Conservative/comments/130mwr6/if_the_gop_cant_figure_out_how_to_beat_old_joe/jhybay7/,,[deleted],20.0
"Exactly this.  Any generic Republican would crush Biden.  Instead, the primary voters will nominate the only one in the field who will be almost certain to lose.  And don't think that will be the end.  In 2028, Trump will be 82, same age as Biden will be in 2024 and he will probably run again.",r/Conservative,2023-04-27T15:46:12.000Z,comment,t1_jhxkfhu,,,5.0,t1_jhxd5e7,,jhxkfhu,2024-03-31T20:21:31.762Z,,,,65,https://www.reddit.com/r/Conservative/comments/130mwr6/if_the_gop_cant_figure_out_how_to_beat_old_joe/jhxkfhu/,t2_5ihpdzh,Ericsplainning,10.0
"I like how everyone assumes that if Trump loses again in 2024 that he’ll just go away and the Republican Party will move on. The way things are looking, he’ll probably keep running until he dies",r/Conservative,2023-04-27T16:06:24.000Z,comment,t1_jhxnkk6,,,2.0,t1_jhxkfhu,,jhxnkk6,2024-03-31T20:21:31.762Z,,,,97,https://www.reddit.com/r/Conservative/comments/130mwr6/if_the_gop_cant_figure_out_how_to_beat_old_joe/jhxnkk6/,t2_icdco83i,Coleman013,80.0
"Yeah, but if he loses again that’s gonna take a lot of the wind out of his sails (and a portion of his voter base).

Also, at his age he could actually die.",r/Conservative,2023-04-27T16:27:38.000Z,comment,t1_jhxqwdk,,,4.0,t1_jhxnkk6,,jhxqwdk,2024-03-31T20:21:31.762Z,,,,19,https://www.reddit.com/r/Conservative/comments/130mwr6/if_the_gop_cant_figure_out_how_to_beat_old_joe/jhxqwdk/,t2_3iqjr27b,PieIsFairlyDelicious,35.0
Will it though. He’ll probably just have all his yes men say that he was cheated out of this election too and the cycle will repeat,r/Conservative,2023-04-27T17:17:00.000Z,comment,t1_jhxykbq,,,1.0,t1_jhxqwdk,,jhxykbq,2024-03-31T20:21:31.762Z,,,,39,https://www.reddit.com/r/Conservative/comments/130mwr6/if_the_gop_cant_figure_out_how_to_beat_old_joe/jhxykbq/,t2_icdco83i,Coleman013,70.0
"He’d definitely still have supporters, and I’m sure he’d make some noise in 2028.

But also, losing once to Biden—a candidate who many Democrats don’t even like—is bad enough. Lose twice and I guarantee you a significant number of people who think he has a shot in 2024 would switch to a younger, less polarizing candidate in 2028. Of course not the whole base, but enough to deny Trump the nomination in future elections.",r/Conservative,2023-04-27T17:34:35.000Z,comment,t1_jhy18dy,,,2.0,t1_jhxykbq,,jhy18dy,2024-03-31T20:21:31.762Z,,,,10,https://www.reddit.com/r/Conservative/comments/130mwr6/if_the_gop_cant_figure_out_how_to_beat_old_joe/jhy18dy/,t2_3iqjr27b,PieIsFairlyDelicious,35.0
"Your logic is sound, but that doesn't have much to do with Trump.  I could see him running 3rd party.",r/Conservative,2023-04-27T18:12:13.000Z,comment,t1_jhy6yby,,,1.0,t1_jhy18dy,,jhy6yby,2024-03-31T20:21:31.762Z,,,,6,https://www.reddit.com/r/Conservative/comments/130mwr6/if_the_gop_cant_figure_out_how_to_beat_old_joe/jhy6yby/,t2_5ihpdzh,Ericsplainning,50.0
