body,communityName,createdAt,dataType,id,isVideo,numberOfComments,numberOfreplies,parentId,parsedCommunityName,parsedId,scrapedAt,thumbnailUrl,title,upVoteRatio,upVotes,url,userId,username,sentiment_score
"Abbott and Kemp are in a decisive second place in the primary polls like DeSantis? Why is this comment upvoted so much?

https://www.realclearpolitics.com/epolls/2024/president/us/2024_republican_presidential_nomination-7548.html

Like… this isn’t even remotely close to true. Kemp and Abbott’s names aren’t even up here. Meanwhile DeSantis is way ahead of the rest of the pack.",r/Conservative,2023-05-10T03:21:10.000Z,comment,t1_jjk5uzg,,,0.0,t1_jjjgqrw,,jjk5uzg,2024-03-31T20:04:09.014Z,,,,13,https://www.reddit.com/r/Conservative/comments/13d2zn7/trump_found_liable_of_sexual_abuse_defamation_in/jjk5uzg/,t2_91wa3,superduperm1,40.0
"He is signing anti 1st amendment hate crime bills

https://youtu.be/q01VWnmlUWY",r/Conservative,2023-05-09T23:03:06.000Z,comment,t1_jjj88w6,,,0.0,t1_jjihebr,,jjj88w6,2024-03-31T20:04:09.014Z,,,,78,https://www.reddit.com/r/Conservative/comments/13d2zn7/trump_found_liable_of_sexual_abuse_defamation_in/jjj88w6/,t2_39x5mbyo,Czeslaw_Meyer,80.0
"Candidate Trump is an unhinged, wild ride.",r/Conservative,2023-05-10T00:04:13.000Z,comment,t1_jjjgc4l,,,1.0,t1_jjihebr,,jjjgc4l,2024-03-31T20:04:09.014Z,,,,19,https://www.reddit.com/r/Conservative/comments/13d2zn7/trump_found_liable_of_sexual_abuse_defamation_in/jjjgc4l/,t2_141725,DarkMark94,90.0
"DeSantis has no charisma and does not have a support base nearly as large or loyal as Trump does.  In an election where Dems will almost certainly employ the same smear tactics they did against Trump, that’s a significant liability.",r/Conservative,2023-05-10T01:46:53.000Z,comment,t1_jjju16n,,,2.0,t1_jjihebr,,jjju16n,2024-03-31T20:04:09.014Z,,,,26,https://www.reddit.com/r/Conservative/comments/13d2zn7/trump_found_liable_of_sexual_abuse_defamation_in/jjju16n/,t2_4a91t,richmomz,20.0
"I’d love to see how these same “smear tactics” will work on DeSantis.

Last time I checked, Trump’s skeleton closet includes an Access Hollywood tape, a draft-dodging history, an indictment with potentially more coming, and an ugly Twitter account.

DeSantis’ skeleton closet includes… eating pudding without a spoon.

Now, maybe I’m a little too logical and/or optimistic… but something tells me the smear tactics, while certainly something that the media will attempt, will not be nearly as effective on DeSantis as it’s been on Trump.",r/Conservative,2023-05-10T04:15:58.000Z,comment,t1_jjkbrv6,,,2.0,t1_jjju16n,,jjkbrv6,2024-03-31T20:04:09.014Z,,,,28,https://www.reddit.com/r/Conservative/comments/13d2zn7/trump_found_liable_of_sexual_abuse_defamation_in/jjkbrv6/,t2_91wa3,superduperm1,85.0
"I think that’s optimistic. There are simply too many people who absorb mass media/ the democrats propaganda arm. They will use anything and everything against him. He’s made a lot of controversial moves that are going to be repeated on the media non-stop and spun as racist. As far as the pudding thing, remember when Trump ate two scoops of ice cream?",r/Conservative,2023-05-10T14:13:18.000Z,comment,t1_jjlt1dp,,,0.0,t1_jjkbrv6,,jjlt1dp,2024-03-31T20:04:09.014Z,,,,9,https://www.reddit.com/r/Conservative/comments/13d2zn7/trump_found_liable_of_sexual_abuse_defamation_in/jjlt1dp/,t2_8za5a,Aeropro,10.0
Should vote vivek in the primary instead,r/Conservative,2023-05-09T20:39:20.000Z,comment,t1_jjinner,,,2.0,t1_jjihebr,,jjinner,2024-03-31T20:04:09.014Z,,,,21,https://www.reddit.com/r/Conservative/comments/13d2zn7/trump_found_liable_of_sexual_abuse_defamation_in/jjinner/,t2_49jceue7,just_shy_of_perfect,75.0
https://news.yahoo.com/vivek-ramaswamy-paid-soros-connection-195037897.html,r/Conservative,2023-05-09T20:54:22.000Z,comment,t1_jjipzll,,,2.0,t1_jjinner,,jjipzll,2024-03-31T20:04:09.014Z,,,,2,https://www.reddit.com/r/Conservative/comments/13d2zn7/trump_found_liable_of_sexual_abuse_defamation_in/jjipzll/,t2_112snb,CSGOW1ld,60.0
"It comes from mediaite and there's not much explaining anything else in there. 

While I hadn't seen it, I'll still take ramaswamy over trump in the primaries. I figure if there's actually any teeth to this it'll come out and change my mind.

The guy from a policy perspective is still better than trump.",r/Conservative,2023-05-09T21:08:31.000Z,comment,t1_jjis7wt,,,0.0,t1_jjipzll,,jjis7wt,2024-03-31T20:04:09.014Z,,,,11,https://www.reddit.com/r/Conservative/comments/13d2zn7/trump_found_liable_of_sexual_abuse_defamation_in/jjis7wt/,t2_49jceue7,just_shy_of_perfect,60.0
"Go ahead and vote DeSantis but in this context, I don't think some show trial should sway you one way or the other.",r/Conservative,2023-05-09T20:04:42.000Z,comment,t1_jjii5b7,,,3.0,t1_jjihebr,,jjii5b7,2024-03-31T20:04:09.014Z,,,,37,https://www.reddit.com/r/Conservative/comments/13d2zn7/trump_found_liable_of_sexual_abuse_defamation_in/jjii5b7/,t2_qub6odhl,MichaelSquare,25.0
I’ve been swayed from trump for a long time now.,r/Conservative,2023-05-09T22:13:39.000Z,comment,t1_jjj1mgc,,,1.0,t1_jjii5b7,,jjj1mgc,2024-03-31T20:04:09.014Z,,,,55,https://www.reddit.com/r/Conservative/comments/13d2zn7/trump_found_liable_of_sexual_abuse_defamation_in/jjj1mgc/,t2_1eyjarcq,conceiv3d-in-lib3rty,15.0
"It's not swaying me, its swaying the independents that we need to win. A vote for Trump in the primaries is a vote for Biden.",r/Conservative,2023-05-09T21:17:35.000Z,comment,t1_jjitkob,,,2.0,t1_jjii5b7,,jjitkob,2024-03-31T20:04:09.014Z,,,,62,https://www.reddit.com/r/Conservative/comments/13d2zn7/trump_found_liable_of_sexual_abuse_defamation_in/jjitkob/,t2_p0ym0qsp,Ed_Durr,30.0
So you'd rather let Biden win if DeSantis bevomes the nominee?,r/Conservative,2023-05-10T07:21:19.000Z,comment,t1_jjkr4rn,,,1.0,t1_jjkkntp,,jjkr4rn,2024-03-31T20:04:09.014Z,,,,2,https://www.reddit.com/r/Conservative/comments/13d2zn7/trump_found_liable_of_sexual_abuse_defamation_in/jjkr4rn/,t2_p0ym0qsp,Ed_Durr,50.0
Have you ever voted for Trump in the past?,r/Conservative,2023-05-09T21:39:07.000Z,comment,t1_jjiwqj1,,,2.0,t1_jjihebr,,jjiwqj1,2024-03-31T20:04:09.014Z,,,,6,https://www.reddit.com/r/Conservative/comments/13d2zn7/trump_found_liable_of_sexual_abuse_defamation_in/jjiwqj1/,t2_7vg6v,Imissyourgirlfriend2,50.0
So what was it about him that made you decide to vote for him that many times?,r/Conservative,2023-05-10T00:05:14.000Z,comment,t1_jjjgh7r,,,0.0,t1_jjj17sr,,jjjgh7r,2024-03-31T20:04:09.014Z,,,,24,https://www.reddit.com/r/Conservative/comments/13d2zn7/trump_found_liable_of_sexual_abuse_defamation_in/jjjgh7r/,t2_7vg6v,Imissyourgirlfriend2,50.0
"How is DeSantis establishment? Because Trump decided to start mocking him on Truth Social and you need to agree with everything Trump does?

The left cries that DeSantis is too conservative, meanwhile Trump diehards are claiming he’s too establishment. Makes absolutely zero sense. Both cannot be true.",r/Conservative,2023-05-10T15:27:29.000Z,comment,t1_jjm3xiw,,,2.0,t1_jjkjsv7,,jjm3xiw,2024-03-31T20:04:09.014Z,,,,15,https://www.reddit.com/r/Conservative/comments/13d2zn7/trump_found_liable_of_sexual_abuse_defamation_in/jjm3xiw/,t2_91wa3,superduperm1,30.0
The fact that people like Mitch McConnell were telling people to rally around DeSantis is enough of a reason to give me pause.,r/Conservative,2023-05-10T20:45:04.000Z,comment,t1_jjnhv6f,,,0.0,t1_jjm3xiw,,jjnhv6f,2024-03-31T20:04:09.014Z,,,,1,https://www.reddit.com/r/Conservative/comments/13d2zn7/trump_found_liable_of_sexual_abuse_defamation_in/jjnhv6f/,t2_y9k5j,Revydown,80.0
1) DeSantis is governor of FL until 2026. -&gt; 2) he isn't on the ballot -&gt; 3) and you'd be splitting the conservative vote during the primary which allows a RINO/Romney/Bush type to win the primary.,r/Conservative,2023-05-10T02:18:35.000Z,comment,t1_jjjy6l9,,,0.0,t1_jjihebr,,jjjy6l9,2024-03-31T20:04:09.014Z,,,,1,https://www.reddit.com/r/Conservative/comments/13d2zn7/trump_found_liable_of_sexual_abuse_defamation_in/jjjy6l9/,t2_13sz5z,Hylian_Shield,15.0
Polls show Trump doing better than DeSantis,r/Conservative,2023-05-09T23:13:55.000Z,comment,t1_jjj9oop,,,4.0,t1_jjihebr,,jjj9oop,2024-03-31T20:04:09.014Z,,,,-3,https://www.reddit.com/r/Conservative/comments/13d2zn7/trump_found_liable_of_sexual_abuse_defamation_in/jjj9oop/,t2_89l1x8w,HNutz,10.0
Polls showed Hillary winning in 2016,r/Conservative,2023-05-09T23:22:48.000Z,comment,t1_jjjav8i,,,1.0,t1_jjj9oop,,jjjav8i,2024-03-31T20:04:09.014Z,,,,64,https://www.reddit.com/r/Conservative/comments/13d2zn7/trump_found_liable_of_sexual_abuse_defamation_in/jjjav8i/,t2_5nms7klg,amarti33,10.0
DeSantis isn't even running yet,r/Conservative,2023-05-10T01:29:18.000Z,comment,t1_jjjrp5r,,,0.0,t1_jjj9oop,,jjjrp5r,2024-03-31T20:04:09.014Z,,,,11,https://www.reddit.com/r/Conservative/comments/13d2zn7/trump_found_liable_of_sexual_abuse_defamation_in/jjjrp5r/,t2_ipr43msd,Mountain_Man_88,50.0
"Trump is ahead in polling vs DeSantis in the primary, but not in a general vs Biden, whereas DeSantis actually beats Biden in the general",r/Conservative,2023-05-10T03:48:39.000Z,comment,t1_jjk8x29,,,1.0,t1_jjj9oop,,jjk8x29,2024-03-31T20:04:09.014Z,,,,8,https://www.reddit.com/r/Conservative/comments/13d2zn7/trump_found_liable_of_sexual_abuse_defamation_in/jjk8x29/,t2_jkc6f,DaMantis,50.0
"Surprise. What you heard was wrong. That poll, which has DeSantis in at least as good of a position as Trump against Biden, shows that 45% of people are Definitely/Probably for Trump while 38% are Definitely/Probably for Biden. That leaves (after a few other small carveouts for 3rd-party, not voting, etc.) 11% undecided voters who will determine the election. Those voters have broken hard AGAINST Trump the last 3 elections, about to be a 4th. And, that's all without a Libertarian candidate on the ballot in key states.",r/Conservative,2023-05-10T16:40:05.000Z,comment,t1_jjmfd3z,,,0.0,t1_jjkkrkl,,jjmfd3z,2024-03-31T20:04:09.014Z,,,,3,https://www.reddit.com/r/Conservative/comments/13d2zn7/trump_found_liable_of_sexual_abuse_defamation_in/jjmfd3z/,t2_13wnlp,jchon960,
"So, this woman has a book that claims Trump raped her. She can't remember any details from her own book, which seems an awful lot like a ghost writer copied the story of Law&amp;Order SVU Theater Tricks (S13Ep11). And even the book does not have any details, and the date of this alledgedly happening is 'somewhere between 1995 and 1997, probably'.

Trump says that didn't happen.

Now she sues him, because him calling out her lack of evidence and refusal to press charges in criminal court is slander on his part. And wins 5 million dollars in damages due to lost book sales. In a clown court, with no evidence, and him being orange more likely than not.",r/Conservative,2023-05-10T15:12:24.000Z,comment,t1_jjm1n3u,,,1.0,t3_13d2zn7,,jjm1n3u,2024-03-31T20:04:09.014Z,,,,10,https://www.reddit.com/r/Conservative/comments/13d2zn7/trump_found_liable_of_sexual_abuse_defamation_in/jjm1n3u/,t2_uhb0cwgp,M4ster0fDesaster,5.0
Tara Reade just should have sued Joe Biden in civil court instead.,r/Conservative,2023-05-09T20:23:50.000Z,comment,t1_jjil62e,,,2.0,t3_13d2zn7,,jjil62e,2024-03-31T20:04:09.014Z,,,,348,https://www.reddit.com/r/Conservative/comments/13d2zn7/trump_found_liable_of_sexual_abuse_defamation_in/jjil62e/,t2_s1x0gw1r,AnonPlzzzzzz,30.0
Instead her story got buried. Starting to feel desensitized to any accusations by the left towards the right. Like a toddler throwing a tantrum.,r/Conservative,2023-05-09T21:53:21.000Z,comment,t1_jjiysix,,,2.0,t1_jjil62e,,jjiysix,2024-03-31T20:04:09.014Z,,,,93,https://www.reddit.com/r/Conservative/comments/13d2zn7/trump_found_liable_of_sexual_abuse_defamation_in/jjiysix/,t2_gbjgz47j,QuackQuackH0nk,20.0
"To the person who responded and is not flaired. I don't think she can. Might be past the statute of limitations. I read the only reason this went to court is that New York revamped an old law or passed a new law that reset the statute of limitations on past committed crimes. It allowed for the accusers to have a year to file. Possibly the only reason this went to trial.

Edited for poor grammar. I blame my liberal school district and not my own caring about education.",r/Conservative,2023-05-09T22:38:14.000Z,comment,t1_jjj4xr1,,,1.0,t1_jjiysix,,jjj4xr1,2024-03-31T20:04:09.014Z,,,,1,https://www.reddit.com/r/Conservative/comments/13d2zn7/trump_found_liable_of_sexual_abuse_defamation_in/jjj4xr1/,t2_gbjgz47j,QuackQuackH0nk,30.0
"Yea I'm baffled how you can make a claim with no date. If you have no date, the person you're accusing has no ability to have an alibi. Seems so wrong.",r/Conservative,2023-05-09T20:44:17.000Z,comment,t1_jjioezw,,,2.0,t1_jjigujb,,jjioezw,2024-03-31T20:04:09.014Z,,,,91,https://www.reddit.com/r/Conservative/comments/13d2zn7/trump_found_liable_of_sexual_abuse_defamation_in/jjioezw/,t2_8dtjzj5q,The_great_Mrs_D,10.0
Something happened to me some time in the past. And you did it,r/Conservative,2023-05-10T11:57:45.000Z,comment,t1_jjlc6rg,,,1.0,t1_jjioezw,,jjlc6rg,2024-03-31T20:04:09.014Z,,,,29,https://www.reddit.com/r/Conservative/comments/13d2zn7/trump_found_liable_of_sexual_abuse_defamation_in/jjlc6rg/,t2_4ol84now,EverySingleMinute,50.0
Agreed - but his ego won’t let his brain work sometimes.,r/Conservative,2023-05-09T19:51:15.000Z,comment,t1_jjify5b,,,2.0,t1_jjieqe5,,jjify5b,2024-03-31T20:04:09.014Z,,,,28,https://www.reddit.com/r/Conservative/comments/13d2zn7/trump_found_liable_of_sexual_abuse_defamation_in/jjify5b/,t2_8cdc9zr2,Darstanter,30.0
like Fetterman?  Abrams?,r/Conservative,2023-05-09T20:21:43.000Z,comment,t1_jjiku24,,,1.0,t1_jjigb70,,jjiku24,2024-03-31T20:04:09.014Z,,,,8,https://www.reddit.com/r/Conservative/comments/13d2zn7/trump_found_liable_of_sexual_abuse_defamation_in/jjiku24/,t2_10kypb,Jakebob70,50.0
Is that why Biden is the current president?,r/Conservative,2023-05-09T19:56:44.000Z,comment,t1_jjigums,,,1.0,t1_jjigb70,,jjigums,2024-03-31T20:04:09.014Z,,,,13,https://www.reddit.com/r/Conservative/comments/13d2zn7/trump_found_liable_of_sexual_abuse_defamation_in/jjigums/,t2_6qceq5b,Scottsm124,50.0
