body,communityName,createdAt,dataType,id,isVideo,numberOfComments,numberOfreplies,parentId,parsedCommunityName,parsedId,scrapedAt,thumbnailUrl,title,upVoteRatio,upVotes,url,userId,username,sentiment_score
"URL: https://www.independent.co.uk/news/world/americas/us-politics/trump-indictment-espionage-prosecution-charges-b2353397.html
Thumbnail: https://b.thumbs.redditmedia.com/GryD5A9xI07-_NF2iJIQbWRDI7DvIRb8Z3Pf3M7t9KI.jpg
Images:
	https://external-preview.redd.it/kskmFfqWg3Gfw0r6-AsKxI4s63cPCTihU5x-b7R6Kto.jpg?auto=webp&amp;s=4f0d8aa474bf07df88eadefb77e003abb87f4d72
",r/moderatepolitics,2023-06-07T19:55:21.000Z,post,t3_143n58m,False,477.0,,,moderatepolitics,143n58m,2024-03-31T20:27:59.190Z,https://b.thumbs.redditmedia.com/GryD5A9xI07-_NF2iJIQbWRDI7DvIRb8Z3Pf3M7t9KI.jpg,Prosecutors ready to ask for Trump indictment on obstruction and Espionage Act charges | The Independent,0.9,712,https://www.reddit.com/r/moderatepolitics/comments/143n58m/prosecutors_ready_to_ask_for_trump_indictment_on/,t2_2kx83lal,greg-stiemsma,90.0
"He literally had to do the bare minimum and return the documents when asked by the government. It wasn't that hard. Pence did it. Biden did it.

He had one job any person could do.",r/moderatepolitics,2023-06-07T21:54:23.000Z,comment,t1_jnbbubm,,,5.0,t3_143n58m,,jnbbubm,2024-03-31T20:27:59.302Z,,,,266,https://www.reddit.com/r/moderatepolitics/comments/143n58m/prosecutors_ready_to_ask_for_trump_indictment_on/jnbbubm/,t2_gd7r9qze,Individual_Lion_7606,20.0
"Yeah, both of them probably would've been better off either shredding the documents or ignoring it &amp; pretend they didn't find anything until after Trump's cases were wrapped up and nobody would've been the wiser, but they did the right thing anyway. The complete opposite of what Trump did. Not to mention Trump took them well *after* the election right before Biden's inauguration for the sole purpose of keeping them for whatever reasons he had in mind, nothing to do with the duties of being president in those last few days.",r/moderatepolitics,2023-06-07T22:53:03.000Z,comment,t1_jnbketh,,,1.0,t1_jnbi1pd,,jnbketh,2024-03-31T20:27:59.302Z,,,,97,https://www.reddit.com/r/moderatepolitics/comments/143n58m/prosecutors_ready_to_ask_for_trump_indictment_on/jnbketh/,t2_6ftcn,gtalley10,70.0
Yeah well that's hard to do when you're trying to sell the documents for money ok????,r/moderatepolitics,2023-06-07T23:32:46.000Z,comment,t1_jnbpz0u,,,0.0,t1_jnbbubm,,jnbpz0u,2024-03-31T20:27:59.302Z,,,,39,https://www.reddit.com/r/moderatepolitics/comments/143n58m/prosecutors_ready_to_ask_for_trump_indictment_on/jnbpz0u/,t2_jcgqd,sungazer69,25.0
Yes but ONLY he could the job this incompetently. Isn't that what he campaigns on?,r/moderatepolitics,2023-06-07T23:04:34.000Z,comment,t1_jnbm1b1,,,0.0,t1_jnbbubm,,jnbm1b1,2024-03-31T20:27:59.302Z,,,,12,https://www.reddit.com/r/moderatepolitics/comments/143n58m/prosecutors_ready_to_ask_for_trump_indictment_on/jnbm1b1/,t2_hjqjp,double_shadow,10.0
It IS that hard when you don't have them anymore.,r/moderatepolitics,2023-06-08T08:02:41.000Z,comment,t1_jnd9q6w,,,1.0,t1_jnbbubm,,jnd9q6w,2024-03-31T20:27:59.302Z,,,,2,https://www.reddit.com/r/moderatepolitics/comments/143n58m/prosecutors_ready_to_ask_for_trump_indictment_on/jnd9q6w/,t2_axgmjok,ExSaviour,50.0
Which was proven to be a lie of course after the FBI raid,r/moderatepolitics,2023-06-08T16:48:11.000Z,comment,t1_jneyo2p,,,1.0,t1_jnd9q6w,,jneyo2p,2024-03-31T20:27:59.302Z,,,,3,https://www.reddit.com/r/moderatepolitics/comments/143n58m/prosecutors_ready_to_ask_for_trump_indictment_on/jneyo2p/,t2_41myhrbg,bwheelin01,10.0
"No no. The Iran document at the center of the video monitoring scandal is still missing.

So he covered up the movement of the doc, quote blatantly, and they know what doc is missing and can't find it. Recall there were several top secret folders with nothing inside?",r/moderatepolitics,2023-06-08T20:08:29.000Z,comment,t1_jnfun0l,,,0.0,t1_jneyo2p,,jnfun0l,2024-03-31T20:27:59.302Z,,,,1,https://www.reddit.com/r/moderatepolitics/comments/143n58m/prosecutors_ready_to_ask_for_trump_indictment_on/jnfun0l/,t2_axgmjok,ExSaviour,30.0
"Glad that at least part of this process is taking place in Florida, so that there's a bit less ""witchhunt/unfair"" nonsense, since we've already seen Trump supporters lament about unfair trials in DC/NYC/etc",r/moderatepolitics,2023-06-07T20:02:58.000Z,comment,t1_jnatsfx,,,6.0,t3_143n58m,,jnatsfx,2024-03-31T20:27:59.302Z,,,,141,https://www.reddit.com/r/moderatepolitics/comments/143n58m/prosecutors_ready_to_ask_for_trump_indictment_on/jnatsfx/,t2_hu5fqk7,motorboat_mcgee,70.0
Anyone know if it’s possible we could end up with Aileen Cannon (district court judge for Southern Florida) presiding over this trial?,r/moderatepolitics,2023-06-07T20:31:31.000Z,comment,t1_jnaygr4,,,1.0,t1_jnatsfx,,jnaygr4,2024-03-31T20:27:59.302Z,,,,30,https://www.reddit.com/r/moderatepolitics/comments/143n58m/prosecutors_ready_to_ask_for_trump_indictment_on/jnaygr4/,t2_3hs8ujul,pluralofjackinthebox,50.0
Wouldn’t she have a conflict of interest given her history with this case?,r/moderatepolitics,2023-06-07T20:56:49.000Z,comment,t1_jnb2ol2,,,3.0,t1_jnaygr4,,jnb2ol2,2024-03-31T20:27:59.302Z,,,,40,https://www.reddit.com/r/moderatepolitics/comments/143n58m/prosecutors_ready_to_ask_for_trump_indictment_on/jnb2ol2/,t2_cwmwyyw4,Exploding_Kick,50.0
"Yes!  And given what we know of her extensive history, we should be able to expect her to do the ethically right thing and recuse herself!",r/moderatepolitics,2023-06-07T23:00:31.000Z,comment,t1_jnblh70,,,1.0,t1_jnb2ol2,,jnblh70,2024-03-31T20:27:59.302Z,,,,39,https://www.reddit.com/r/moderatepolitics/comments/143n58m/prosecutors_ready_to_ask_for_trump_indictment_on/jnblh70/,t2_2bs97,AngledLuffa,85.0
"[Yeah, sure.](https://youtu.be/lhckuhUxcgA)",r/moderatepolitics,2023-06-08T12:08:45.000Z,comment,t1_jndubds,,,0.0,t1_jnblh70,,jndubds,2024-03-31T20:27:59.302Z,,,,8,https://www.reddit.com/r/moderatepolitics/comments/143n58m/prosecutors_ready_to_ask_for_trump_indictment_on/jndubds/,t2_nu8otnfc,BeignetsByMitch,50.0
"Being appointed by Trump was itself a conflict of interest, and that didn’t stop her. In the US, Judges are typically responsible for deciding whether or not to recuse.

I’m not sure to what degree judge shopping is possible in Florida or how it works — like I’m not sure if Trump was just lucky or not in getting Cannon to oversee his case, and to what degree Jack Smith might be able to sideline her.

I think if she does get the case there will be ways to get the case taken away from her probably, a motion for disqualification, appeals to higher courts — but it will really drag things out.",r/moderatepolitics,2023-06-07T21:13:35.000Z,comment,t1_jnb5fc4,,,2.0,t1_jnb2ol2,,jnb5fc4,2024-03-31T20:27:59.302Z,,,,30,https://www.reddit.com/r/moderatepolitics/comments/143n58m/prosecutors_ready_to_ask_for_trump_indictment_on/jnb5fc4/,t2_3hs8ujul,pluralofjackinthebox,80.0
"When I made my comment, I wasn’t considering her appointment to be the thing that would disqualify her. My thought was, unless I’m mistaken, that her mishandling of the initial parts of the investigation that earned her a legal slap down from the 11th circuit would disqualify her from having any part of this future trial which is related to the same case. What do you think?

I think judge shopping was what got Cannon involved in the first place, no?

I think you’d be right. Given her history, there’s no way the DOJ lets her keep this case if, for whatever reason, she gets assigned this case.",r/moderatepolitics,2023-06-07T21:19:50.000Z,comment,t1_jnb6ff1,,,1.0,t1_jnb5fc4,,jnb6ff1,2024-03-31T20:27:59.302Z,,,,28,https://www.reddit.com/r/moderatepolitics/comments/143n58m/prosecutors_ready_to_ask_for_trump_indictment_on/jnb6ff1/,t2_cwmwyyw4,Exploding_Kick,40.0
"I really think it’s ultimately Cannon’s responsibility to decide if she’s qualified if she’s handed Trumps case. 

I think there might be a possibility that they might get around her on more technical grounds — although judges are assigned on a random or rotating basis in Florida, sometimes there are “Administrarive Assignments” where judges are assigned to special cases because of their areas of expertise. I have no idea if a classified documents case would fit this though.",r/moderatepolitics,2023-06-07T23:41:49.000Z,comment,t1_jnbr7va,,,1.0,t1_jnb6ff1,,jnbr7va,2024-03-31T20:27:59.302Z,,,,12,https://www.reddit.com/r/moderatepolitics/comments/143n58m/prosecutors_ready_to_ask_for_trump_indictment_on/jnbr7va/,t2_3hs8ujul,pluralofjackinthebox,10.0
"&gt; I really think it’s ultimately Cannon’s responsibility to decide if she’s qualified

Yes, the judiciary has a lot of leeway in deciding if they should recuse themselves. This has historically been rather mundane because the appearance of impropriety undermines the entire system of justice we have in this country. 

With this said, I do not think she would recuse. *Technically,* being  appointed by someone shouldn't be reason enough for recusal, especially since that person is no longer in a position of authority, although her past actions seem fairly suspect from my perspective.",r/moderatepolitics,2023-06-08T15:01:20.000Z,comment,t1_jnehtbp,,,0.0,t1_jnbr7va,,jnehtbp,2024-03-31T20:27:59.302Z,,,,2,https://www.reddit.com/r/moderatepolitics/comments/143n58m/prosecutors_ready_to_ask_for_trump_indictment_on/jnehtbp/,t2_ih9v4,PM_ME_YOUR_DARKNESS,30.0
"&gt;Being appointed by Trump was itself a conflict of interest

I think that is a hard standard to hold. Almost impossible, really.",r/moderatepolitics,2023-06-08T02:08:27.000Z,comment,t1_jncbewy,,,0.0,t1_jnb5fc4,,jncbewy,2024-03-31T20:27:59.302Z,,,,8,https://www.reddit.com/r/moderatepolitics/comments/143n58m/prosecutors_ready_to_ask_for_trump_indictment_on/jncbewy/,,[deleted],20.0
"Oh no - somebody with a ""conflict of interest""  - funny how that Never happens when there is a dem involved",r/moderatepolitics,2023-06-08T18:27:38.000Z,comment,t1_jnfelf5,,,0.0,t1_jnb2ol2,,jnfelf5,2024-03-31T20:27:59.302Z,,,,1,https://www.reddit.com/r/moderatepolitics/comments/143n58m/prosecutors_ready_to_ask_for_trump_indictment_on/jnfelf5/,t2_itdymc0a,Defiant-Gain3345,75.0
DeSantis is running against him. Anything that lands will just be called primary pot stirring,r/moderatepolitics,2023-06-07T20:50:43.000Z,comment,t1_jnb1nt0,,,2.0,t1_jnatsfx,,jnb1nt0,2024-03-31T20:27:59.302Z,,,,55,https://www.reddit.com/r/moderatepolitics/comments/143n58m/prosecutors_ready_to_ask_for_trump_indictment_on/jnb1nt0/,t2_nd0tprer,shacksrus,25.0
The tyrannical State of Florida going after a private citizen like Donald J Trump,r/moderatepolitics,2023-06-07T20:55:03.000Z,comment,t1_jnb2dyh,,,2.0,t1_jnb1nt0,,jnb2dyh,2024-03-31T20:27:59.302Z,,,,34,https://www.reddit.com/r/moderatepolitics/comments/143n58m/prosecutors_ready_to_ask_for_trump_indictment_on/jnb2dyh/,,[deleted],80.0
"Honestly, if it gets the right to recognize the authoritarian leanings of Desantis (even if only in regard to Trump), it's probably worth it.",r/moderatepolitics,2023-06-07T22:14:49.000Z,comment,t1_jnbewi0,,,1.0,t1_jnb2dyh,,jnbewi0,2024-03-31T20:27:59.302Z,,,,11,https://www.reddit.com/r/moderatepolitics/comments/143n58m/prosecutors_ready_to_ask_for_trump_indictment_on/jnbewi0/,t2_d2ilm,Darth_Ra,70.0
"&gt; gets the right to recognize the authoritarian leanings of Desantis

...so they'll vote for him over Trump?",r/moderatepolitics,2023-06-07T23:29:35.000Z,comment,t1_jnbpix4,,,0.0,t1_jnbewi0,,jnbpix4,2024-03-31T20:27:59.302Z,,,,10,https://www.reddit.com/r/moderatepolitics/comments/143n58m/prosecutors_ready_to_ask_for_trump_indictment_on/jnbpix4/,t2_3gyqqqqa,N44K00,85.0
"But it's federal, so he'll just blame the deep state anyway.  If it was Florida state court I'd be with you.",r/moderatepolitics,2023-06-07T21:01:19.000Z,comment,t1_jnb3f4y,,,1.0,t1_jnatsfx,,jnb3f4y,2024-03-31T20:27:59.302Z,,,,17,https://www.reddit.com/r/moderatepolitics/comments/143n58m/prosecutors_ready_to_ask_for_trump_indictment_on/jnb3f4y/,t2_4moxb,pwmg,40.0
"Absolutely, but at least it kills the location nonsense I've had spouted at me more than a few times. Goal posts and all.",r/moderatepolitics,2023-06-07T21:47:43.000Z,comment,t1_jnbasz4,,,1.0,t1_jnb3f4y,,jnbasz4,2024-03-31T20:27:59.302Z,,,,2,https://www.reddit.com/r/moderatepolitics/comments/143n58m/prosecutors_ready_to_ask_for_trump_indictment_on/jnbasz4/,t2_hu5fqk7,motorboat_mcgee,30.0
"&gt;Absolutely, but at least it kills the location nonsense

That's not total nonsense, do you think that Hillary could get a reasonable jury of her peers in some deep red maga county? Or Trump in SF.",r/moderatepolitics,2023-06-08T11:51:58.000Z,comment,t1_jndshx3,,,0.0,t1_jnbasz4,,jndshx3,2024-03-31T20:27:59.302Z,,,,1,https://www.reddit.com/r/moderatepolitics/comments/143n58m/prosecutors_ready_to_ask_for_trump_indictment_on/jndshx3/,t2_5tdhwoq8,Boise_State_2020,20.0
Yeah that’s going to stop him from playing the victim.,r/moderatepolitics,2023-06-07T20:18:06.000Z,comment,t1_jnaw82h,,,1.0,t1_jnatsfx,,jnaw82h,2024-03-31T20:27:59.302Z,,,,44,https://www.reddit.com/r/moderatepolitics/comments/143n58m/prosecutors_ready_to_ask_for_trump_indictment_on/jnaw82h/,t2_14ifvt,Baladas89,10.0
"No, but it will make his claims seem even more ridiculous.",r/moderatepolitics,2023-06-07T22:19:04.000Z,comment,t1_jnbfil4,,,1.0,t1_jnaw82h,,jnbfil4,2024-03-31T20:27:59.302Z,,,,6,https://www.reddit.com/r/moderatepolitics/comments/143n58m/prosecutors_ready_to_ask_for_trump_indictment_on/jnbfil4/,t2_d2ilm,Darth_Ra,25.0
"Just wait until Trump turns this into a ""witch-hunt"" by DeSantis to knock him out of the primaries. It'll be years of ""there was no collusion with foreign governments, Trump declassified those documents before selling them to the highest bidder!""",r/moderatepolitics,2023-06-08T00:49:46.000Z,comment,t1_jnc0igz,,,0.0,t1_jnatsfx,,jnc0igz,2024-03-31T20:27:59.302Z,,,,5,https://www.reddit.com/r/moderatepolitics/comments/143n58m/prosecutors_ready_to_ask_for_trump_indictment_on/jnc0igz/,t2_xa6ef,you-create-energy,75.0
"Prosecutors are set to indict former president Donald Trump on obstruction of justice and Espionage Act charges related to his retention of classified information after he left the White House.

Prosecutors will charge him with violating a portion of the US criminal code known as Section 793, which prohibits “gathering, transmitting or losing” any “information respecting the national defence”. His former chief of staff Mark Meadows has already pleaded guilty to lesser crimes in exchange for his testimony against Trump.

That section of US criminal law is written in a way that could encompass Mr Trump’s conduct even if he was authorised to possess the information as president, as he claims, because it states that anyone who “lawfully having possession of, access to, control over, or being entrusted with any document ...relating to the national defence,” and “willfully communicates, delivers, transmits or causes to be communicated, delivered, or transmitted or attempts to communicate, deliver, transmit or cause to be communicated, delivered or transmitted the same to any person not entitled to receive it, or willfully retains the same and fails to deliver it on demand to the officer or employee of the United States entitled to receive it” can be punished by as many as ten years in prison.

This will be the 2nd indictment against Trump. It is particularly noteworthy that Meadows, a close ally of the former president, is now cooperating with prosecutors against him.

How will this impact the 2024 Republican presidential primary?

How will this impact the 2024 general election if Trump wins the GOP nomination?",r/moderatepolitics,2023-06-07T19:59:26.000Z,comment,t1_jnat7tx,,,7.0,t3_143n58m,,jnat7tx,2024-03-31T20:27:59.302Z,,,,91,https://www.reddit.com/r/moderatepolitics/comments/143n58m/prosecutors_ready_to_ask_for_trump_indictment_on/jnat7tx/,t2_2kx83lal,greg-stiemsma,80.0
"&gt; His former chief of staff Mark Meadows has already pleaded guilty to lesser crimes in exchange for his testimony against Trump.

Oh my - that's actually a big deal if this is true.  

The DoJ seemed to be using the same (or similar) methods they use to take down organized crime leadership with these Trump cases.  Get the lower level people to flip in exchange for reduced charges or immunity.",r/moderatepolitics,2023-06-07T20:03:24.000Z,comment,t1_jnatux1,,,4.0,t1_jnat7tx,,jnatux1,2024-03-31T20:27:59.302Z,,,,103,https://www.reddit.com/r/moderatepolitics/comments/143n58m/prosecutors_ready_to_ask_for_trump_indictment_on/jnatux1/,t2_cxecn,mclumber1,70.0
That's why you need loyalty. Demand it even!,r/moderatepolitics,2023-06-07T21:26:35.000Z,comment,t1_jnb7i67,,,0.0,t1_jnatux1,,jnb7i67,2024-03-31T20:27:59.302Z,,,,27,https://www.reddit.com/r/moderatepolitics/comments/143n58m/prosecutors_ready_to_ask_for_trump_indictment_on/jnb7i67/,t2_2a3nmksu,ThatOneDevThatDevs,10.0
"Looks like he may have testified but did not plead to anything.  
  
&gt;A source who was briefed on the agreement claimed that the alleged agreement will involve the ex-chief of staff entering pleas of guilty to unspecified federal crimes but an attorney for Mr Meadows, George Terwilliger, denied that to The Independent. Mr Terwilliger said that the idea that his client would enter any guilty pleas was “complete bulls***” but did not address the matter of immunity in a brief telephone conversation with this reporter.  
  
From the article.",r/moderatepolitics,2023-06-08T06:09:29.000Z,comment,t1_jnd15ql,,,0.0,t1_jnatux1,,jnd15ql,2024-03-31T20:27:59.302Z,,,,7,https://www.reddit.com/r/moderatepolitics/comments/143n58m/prosecutors_ready_to_ask_for_trump_indictment_on/jnd15ql/,t2_g6477v5,redditthrowaway1294,20.0
Just to caution you...that's what people said about the Mueller Report too. Using the method of creeping up the chain of command with immunity and plea deals doesn't mean there will eventually be enough evidence to say the person at the top did anything in particular. It's just the way prosecutors search for truth.,r/moderatepolitics,2023-06-08T11:22:53.000Z,comment,t1_jndpi8k,,,2.0,t1_jnatux1,,jndpi8k,2024-03-31T20:27:59.302Z,,,,6,https://www.reddit.com/r/moderatepolitics/comments/143n58m/prosecutors_ready_to_ask_for_trump_indictment_on/jndpi8k/,t2_4se65,nemoomen,35.0
"There was with the Mueller report, Trump just had Barr and a friendly Congress around to run interference.",r/moderatepolitics,2023-06-08T13:50:17.000Z,comment,t1_jne7516,,,0.0,t1_jndpi8k,,jne7516,2024-03-31T20:27:59.302Z,,,,2,https://www.reddit.com/r/moderatepolitics/comments/143n58m/prosecutors_ready_to_ask_for_trump_indictment_on/jne7516/,t2_2gc1i7f,WiseassWolfOfYoitsu,85.0
"&gt; How will this impact the 2024 Republican presidential primary?

Seems pretty wild.

Will the RNC pump the brakes on Trump if he's indicted for serious crimes like this?  Will they just let the primary play out?  Will Trump voters abandon him?

Certainly seems like a golden opportunity for DeSantis above all else.  Be interesting to see how DeSantis navigates it--will he attack Trump for it, or will he attack Democrats for it?",r/moderatepolitics,2023-06-07T20:16:47.000Z,comment,t1_jnaw0bg,,,2.0,t1_jnat7tx,,jnaw0bg,2024-03-31T20:27:59.302Z,,,,38,https://www.reddit.com/r/moderatepolitics/comments/143n58m/prosecutors_ready_to_ask_for_trump_indictment_on/jnaw0bg/,t2_gfxpx,TapedeckNinja,70.0
"&gt;pump the brakes 

No brakes on the trump train.  He does love a good pump though.",r/moderatepolitics,2023-06-07T21:30:17.000Z,comment,t1_jnb8300,,,0.0,t1_jnaw0bg,,jnb8300,2024-03-31T20:27:59.302Z,,,,28,https://www.reddit.com/r/moderatepolitics/comments/143n58m/prosecutors_ready_to_ask_for_trump_indictment_on/jnb8300/,t2_90mbp,cybercuzco,75.0
During the primary he will attack trump and if he gets the nomination and his staff finds that it will boost his ratings he will attack the dems.,r/moderatepolitics,2023-06-07T21:39:09.000Z,comment,t1_jnb9gyg,,,1.0,t1_jnaw0bg,,jnb9gyg,2024-03-31T20:27:59.302Z,,,,9,https://www.reddit.com/r/moderatepolitics/comments/143n58m/prosecutors_ready_to_ask_for_trump_indictment_on/jnb9gyg/,t2_dk5au,jedi21knight,50.0
"I don't think that anyone whose serious about the nomination can afford to meaningfully attack Trump. Which is a weird and nonsensical situation, but then, that's politics since Trump took over.",r/moderatepolitics,2023-06-07T22:21:22.000Z,comment,t1_jnbfumh,,,1.0,t1_jnb9gyg,,jnbfumh,2024-03-31T20:27:59.302Z,,,,18,https://www.reddit.com/r/moderatepolitics/comments/143n58m/prosecutors_ready_to_ask_for_trump_indictment_on/jnbfumh/,t2_d2ilm,Darth_Ra,55.0
"&gt;Which is a weird and nonsensical situation, but then, that's politics since Trump took over.

Trumpism is firmly in control of the GOP but somehow Trump is viewed as an outsider who is here to drain the swamp. He is the biggest swamp monster of them all, and he did it in only a few years",r/moderatepolitics,2023-06-09T02:01:51.000Z,comment,t1_jnh6pn8,,,0.0,t1_jnbfumh,,jnh6pn8,2024-03-31T20:27:59.302Z,,,,1,https://www.reddit.com/r/moderatepolitics/comments/143n58m/prosecutors_ready_to_ask_for_trump_indictment_on/jnh6pn8/,t2_2olgrra5,NoAWP,85.0
"Anything less than a heart attack won’t stop Trump from winning the primary. The same people who will be on that primary stage have defended his behavior over and over again. They are stuck between a rock and a hard place. I bet the candidates will either dance around the issues or will continue to defend his behavior while trying to present their own case for the nomination.

I really don’t think anything will move the needle. I think a majority of Americans have made up their mind between Trump and Biden. Nothing less than the biggest October surprise ever can shake things up.",r/moderatepolitics,2023-06-07T20:45:00.000Z,comment,t1_jnb0ptc,,,2.0,t1_jnat7tx,,jnb0ptc,2024-03-31T20:27:59.302Z,,,,37,https://www.reddit.com/r/moderatepolitics/comments/143n58m/prosecutors_ready_to_ask_for_trump_indictment_on/jnb0ptc/,t2_fjc3p,FabioFresh93,80.0
Christie might not hold back.,r/moderatepolitics,2023-06-07T22:42:54.000Z,comment,t1_jnbiydv,,,1.0,t1_jnb0ptc,,jnbiydv,2024-03-31T20:27:59.302Z,,,,8,https://www.reddit.com/r/moderatepolitics/comments/143n58m/prosecutors_ready_to_ask_for_trump_indictment_on/jnbiydv/,t2_32jc4,cranktheguy,20.0
Christie would be the only Republican I’d vote for.,r/moderatepolitics,2023-06-08T09:44:44.000Z,comment,t1_jndh2tq,,,2.0,t1_jnbiydv,,jndh2tq,2024-03-31T20:27:59.302Z,,,,5,https://www.reddit.com/r/moderatepolitics/comments/143n58m/prosecutors_ready_to_ask_for_trump_indictment_on/jndh2tq/,t2_entdym4,4904burchfield,25.0
"Chris Christie? Has everyone already forgotten what a steaming pile of shit he is?

I mean, he looks great when compared to the other two, but still.",r/moderatepolitics,2023-06-08T22:19:29.000Z,comment,t1_jngfhkp,,,0.0,t1_jndh2tq,,jngfhkp,2024-03-31T20:27:59.302Z,,,,2,https://www.reddit.com/r/moderatepolitics/comments/143n58m/prosecutors_ready_to_ask_for_trump_indictment_on/jngfhkp/,t2_okmu0ybu,BootyMcStuffins,80.0
"&gt;Anything less than a heart attack won’t stop Trump from winning the primary

A heart attack will be called an assassination attempt and the GQP will go nuts.  Even death won't stop his followers.",r/moderatepolitics,2023-06-07T20:56:42.000Z,comment,t1_jnb2nua,,,3.0,t1_jnb0ptc,,jnb2nua,2024-03-31T20:27:59.302Z,,,,31,https://www.reddit.com/r/moderatepolitics/comments/143n58m/prosecutors_ready_to_ask_for_trump_indictment_on/jnb2nua/,t2_7g2w2,sirspidermonkey,90.0
"They wont be stopped, but you will suddenly have dozens of voices saying different things to the effect of ""this is what Trump would have wanted.""  Without Trump, the movement will keep going, just not in a unified way.",r/moderatepolitics,2023-06-07T21:39:58.000Z,comment,t1_jnb9lor,,,1.0,t1_jnb2nua,,jnb9lor,2024-03-31T20:27:59.302Z,,,,15,https://www.reddit.com/r/moderatepolitics/comments/143n58m/prosecutors_ready_to_ask_for_trump_indictment_on/jnb9lor/,t2_4vd88,countfizix,60.0
"&gt;the movement will keep going,

To this day I am not too sure what the MAGA folks want in terms of actual policy",r/moderatepolitics,2023-06-09T07:18:35.000Z,comment,t1_jni2gbn,,,0.0,t1_jnb9lor,,jni2gbn,2024-03-31T20:27:59.302Z,,,,1,https://www.reddit.com/r/moderatepolitics/comments/143n58m/prosecutors_ready_to_ask_for_trump_indictment_on/jni2gbn/,t2_2olgrra5,NoAWP,25.0
Yep. There were those who said Scalia was assassinated.,r/moderatepolitics,2023-06-07T22:03:44.000Z,comment,t1_jnbd9j1,,,0.0,t1_jnb2nua,,jnbd9j1,2024-03-31T20:27:59.302Z,,,,11,https://www.reddit.com/r/moderatepolitics/comments/143n58m/prosecutors_ready_to_ask_for_trump_indictment_on/jnbd9j1/,t2_5zqrucjx,IHerebyDemandtoPost,10.0
"&gt;That section of US criminal law is written in a way that could encompass Mr Trump’s conduct even if he was authorised to possess the information as president

The key thing about the Espionage Act is it was passed in 1917. So it doesn't have any reference to ""top secret,"" ""secret"" or documents that have been declassified because the classification system didn't exist until Harry Truman created in 1951. 

You can definitely argue that the sitting President has the authority through the constitution to view any document (since the classification system only exists due to Presidential Executive Order, the President owns the classification system). But there is nothing in the law that says a former president has access to any document, and you can't make the constitutional argument because a former president doesn't have any constitutional authority.",r/moderatepolitics,2023-06-07T21:30:53.000Z,comment,t1_jnb86g8,,,1.0,t1_jnat7tx,,jnb86g8,2024-03-31T20:27:59.302Z,,,,22,https://www.reddit.com/r/moderatepolitics/comments/143n58m/prosecutors_ready_to_ask_for_trump_indictment_on/jnb86g8/,t2_41kgk,FunkyPete,40.0
