body,communityName,createdAt,dataType,id,isVideo,numberOfComments,numberOfreplies,parentId,parsedCommunityName,parsedId,scrapedAt,thumbnailUrl,title,upVoteRatio,upVotes,url,userId,username,sentiment_score
"God I hope not. That would be a dream come true for liberals. But yeah, I wouldn’t put it past him.",r/Conservative,2023-04-27T18:15:44.000Z,comment,t1_jhy7hmi,,,1.0,t1_jhy6yby,,jhy7hmi,2024-03-31T20:21:31.762Z,,,,4,https://www.reddit.com/r/Conservative/comments/130mwr6/if_the_gop_cant_figure_out_how_to_beat_old_joe/jhy7hmi/,t2_3iqjr27b,PieIsFairlyDelicious,80.0
No his base will cry stolen election before the election even takes place. If they havent left that losers side by now they never will. These people are mentally unwell lets just be honest with ourselves. Propaganda works in the usa.,r/Conservative,2023-04-27T18:28:33.000Z,comment,t1_jhy9gmh,,,0.0,t1_jhxqwdk,,jhy9gmh,2024-03-31T20:21:31.762Z,,,,10,https://www.reddit.com/r/Conservative/comments/130mwr6/if_the_gop_cant_figure_out_how_to_beat_old_joe/jhy9gmh/,t2_vp4wan1f,irish-riviera,10.0
"&gt; Also, at his age he could actually die.  

How many obese 80 year-olds do you see in the wild?",r/Conservative,2023-04-27T17:54:23.000Z,comment,t1_jhy491o,,,0.0,t1_jhxqwdk,,jhy491o,2024-03-31T20:21:31.762Z,,,,4,https://www.reddit.com/r/Conservative/comments/130mwr6/if_the_gop_cant_figure_out_how_to_beat_old_joe/jhy491o/,t2_lz03zv37,Rock-n-RollingStart,20.0
"&gt; Instead, the primary voters will nominate the only one in the field who will be almost certain to lose.

See Hillary Clinton for a clear example of this, they chose a candidate that half the country hated out of the gate.

Don't do the same with Trump FFS.",r/Conservative,2023-04-27T16:44:16.000Z,comment,t1_jhxthmx,,,0.0,t1_jhxkfhu,,jhxthmx,2024-03-31T20:21:31.762Z,,,,8,https://www.reddit.com/r/Conservative/comments/130mwr6/if_the_gop_cant_figure_out_how_to_beat_old_joe/jhxthmx/,t2_15p34b,useablelobster2,25.0
Once the rightwing realizes corporate bootlicking and cuts to social programs is a losing position irregardless of candidate then they might have a chance at winning a nation wide contest,r/Conservative,2023-04-27T16:35:56.000Z,comment,t1_jhxs6p9,,,2.0,t1_jhxkfhu,,jhxs6p9,2024-03-31T20:21:31.762Z,,,,15,https://www.reddit.com/r/Conservative/comments/130mwr6/if_the_gop_cant_figure_out_how_to_beat_old_joe/jhxs6p9/,t2_dqtb0,SLIMEbaby,80.0
"You can get away with those. 

Abortion and marijuana will tank GOP in a national election.",r/Conservative,2023-04-27T17:57:58.000Z,comment,t1_jhy4sm0,,,1.0,t1_jhxs6p9,,jhy4sm0,2024-03-31T20:21:31.762Z,,,,6,https://www.reddit.com/r/Conservative/comments/130mwr6/if_the_gop_cant_figure_out_how_to_beat_old_joe/jhy4sm0/,t2_bdmopxvd,corncob_subscriber,75.0
"&gt;any generic republican

I would preface this as any Republican who did not take the &lt;30% position on abortion. Anyone who put in six week abortion bans is doomed in a general election against any Dem.",r/Conservative,2023-04-27T18:26:49.000Z,comment,t1_jhy96yv,,,0.0,t1_jhxkfhu,,jhy96yv,2024-03-31T20:21:31.762Z,,,,3,https://www.reddit.com/r/Conservative/comments/130mwr6/if_the_gop_cant_figure_out_how_to_beat_old_joe/jhy96yv/,t2_6hm4a,chipbod,80.0
"You are kind of stuck with him though. Of Trump loses the primary he will 100% claim whoever beat him cheated, and enough of his followers will believe him to sink the candidate.",r/Conservative,2023-04-27T18:05:18.000Z,comment,t1_jhy5vvm,,,0.0,t1_jhxd5e7,,jhy5vvm,2024-03-31T20:21:31.762Z,,,,9,https://www.reddit.com/r/Conservative/comments/130mwr6/if_the_gop_cant_figure_out_how_to_beat_old_joe/jhy5vvm/,t2_sxul2,degre715,75.0
"Man, I was gonna bring up the same thing. Looks like we both should be on their board of advisors",r/Conservative,2023-04-27T15:50:19.000Z,comment,t1_jhxl2ho,,,0.0,t1_jhxd5e7,,jhxl2ho,2024-03-31T20:21:31.762Z,,,,37,https://www.reddit.com/r/Conservative/comments/130mwr6/if_the_gop_cant_figure_out_how_to_beat_old_joe/jhxl2ho/,t2_4v4ahlng,jimboslyce04,50.0
"Even the best candidate in the world would have to cater to the MAGA vote. A “reasonable” Republican who didn’t have mean things to say about trans people or abortion would never win the ticket. 

I’d love to see a sharp Republican candidate tear Joe apart on issues of economy and foreign policy, but I think it’s all going to be cheap shots and culture war.",r/Conservative,2023-04-27T18:47:00.000Z,comment,t1_jhycar1,,,0.0,t1_jhxd5e7,,jhycar1,2024-03-31T20:21:31.762Z,,,,6,https://www.reddit.com/r/Conservative/comments/130mwr6/if_the_gop_cant_figure_out_how_to_beat_old_joe/jhycar1/,t2_6w7pr6wcg,Crafty_Yak_1747,80.0
"I say this as someone fairly liberal, Romney should the GOP Nominee.
 
It doesnt benefit anyone when both parties are throwing their bottom of the barrel candidates in, it just turns everything a race to the bottom.
 
While I may not agree with a lot of what romneys does, he isnt heinously corrupt and seems like he can work across the aisle when the need arises.",r/Conservative,2023-04-27T17:21:54.000Z,comment,t1_jhxzb9i,,,0.0,t1_jhxd5e7,,jhxzb9i,2024-03-31T20:21:31.762Z,,,,3,https://www.reddit.com/r/Conservative/comments/130mwr6/if_the_gop_cant_figure_out_how_to_beat_old_joe/jhxzb9i/,t2_ukhuh4em,itwillbedonemylord22,70.0
Imagine us doing the right thing ,r/Conservative,2023-04-27T16:31:23.000Z,comment,t1_jhxrhcn,,,0.0,t1_jhxd5e7,,jhxrhcn,2024-03-31T20:21:31.762Z,,,,5,https://www.reddit.com/r/Conservative/comments/130mwr6/if_the_gop_cant_figure_out_how_to_beat_old_joe/jhxrhcn/,t2_im5ib,KennedyX8,50.0
"It's funnier than that, because during the previous campaign Trump said that if he lost to Biden, ""I don't think you're ever going to see me again, folks.  I think I'll go to Turnberry and play golf or something.""

I guess the way he found around that was to never admit he lost.",r/Conservative,2023-04-27T17:33:07.000Z,comment,t1_jhy10l5,,,0.0,t1_jhxd5e7,,jhy10l5,2024-03-31T20:21:31.762Z,,,,2,https://www.reddit.com/r/Conservative/comments/130mwr6/if_the_gop_cant_figure_out_how_to_beat_old_joe/jhy10l5/,t2_cyy2b,koshgeo,75.0
"I feel like this post/thread is full of people acknowledging this but then other threads are like wildly invoking the culture war BS. 

It’s the same in r / politics but like idk. 

Then there are zero threads in here about whatever Texas is doing regarding local elections or all the libraries people are trying to defund. Wtf is invoking that and where is there a space for people to talk about if they agree with it or not?",r/Conservative,2023-04-28T03:30:41.000Z,comment,t1_ji0e6j0,,,0.0,t1_jhy3v95,,ji0e6j0,2024-03-31T20:21:31.762Z,,,,68,https://www.reddit.com/r/Conservative/comments/130mwr6/if_the_gop_cant_figure_out_how_to_beat_old_joe/ji0e6j0/,t2_11cww3,shrdbrd,35.0
"You lose to Joe, you 100% deserve it. But easier to whine about rigged votes and being stuck in 2020, instead of focusing on real issues like economy, cost of living... 2020 was such a disaster.",r/Conservative,2023-04-27T18:40:51.000Z,comment,t1_jhybcnr,,,1.0,t3_130mwr6,,jhybcnr,2024-03-31T20:21:31.762Z,,,,80,https://www.reddit.com/r/Conservative/comments/130mwr6/if_the_gop_cant_figure_out_how_to_beat_old_joe/jhybcnr/,t2_r6ybu,Lilianthus,20.0
