body,communityName,createdAt,dataType,id,isVideo,numberOfComments,numberOfreplies,parentId,parsedCommunityName,parsedId,scrapedAt,thumbnailUrl,title,upVoteRatio,upVotes,url,userId,username,sentiment_score
"Sort of. That's the secondary benefit, but even without that they'd still support abortion. The mistake I find everyone making is that they keep saying ""Republicans are against abortion because X"", whatever that X happens to be.

The truth is that there *is no X*. Their regard for abortion as a bad thing is *axiomatic*. The right to say abortion bad ***is*** the moral good for them.  


Once you realize this, all the contradictions go away. Why are they against birth control and sex education despite it resulting in more abortions? Because preventing abortions is only a secondary benefit to their primary moral goal of saying abortion is bad, and making sure our government says it too.",r/moderatepolitics,2023-06-09T18:13:25.000Z,comment,t1_jnk6kzl,,,0.0,t1_jnj00kc,,jnk6kzl,2024-03-31T20:29:35.898Z,,,,3,https://www.reddit.com/r/moderatepolitics/comments/14549mc/exclusive_donald_trump_admits_on_tape_he_didnt/jnk6kzl/,t2_gtoj93,RocketRelm,80.0
"That may be true, but this surely strengthens the “legal” case against him. I dont think this changes much of the politics, his supporters will continue to support him.",r/moderatepolitics,2023-06-09T14:04:43.000Z,comment,t1_jnj4e3z,,,0.0,t1_jniwjzq,,jnj4e3z,2024-03-31T20:29:35.898Z,,,,2,https://www.reddit.com/r/moderatepolitics/comments/14549mc/exclusive_donald_trump_admits_on_tape_he_didnt/jnj4e3z/,t2_sob9g,MachiavelliSJ,10.0
"The fact that he repeats ""secret"" so many times tells me that the document had large markings on top and bottom that said SECRET",r/moderatepolitics,2023-06-09T14:12:54.000Z,comment,t1_jnj5lkt,,,1.0,t1_jniumvl,,jnj5lkt,2024-03-31T20:29:35.898Z,,,,22,https://www.reddit.com/r/moderatepolitics/comments/14549mc/exclusive_donald_trump_admits_on_tape_he_didnt/jnj5lkt/,t2_hu5fqk7,motorboat_mcgee,10.0
"All classified documents do, and you can see them clearly in the FBI search warrant photos.",r/moderatepolitics,2023-06-09T15:23:54.000Z,comment,t1_jnjgdvn,,,1.0,t1_jnj5lkt,,jnjgdvn,2024-03-31T20:29:35.898Z,,,,5,https://www.reddit.com/r/moderatepolitics/comments/14549mc/exclusive_donald_trump_admits_on_tape_he_didnt/jnjgdvn/,t2_je77v,Bakkster,10.0
...that's my point,r/moderatepolitics,2023-06-09T16:12:17.000Z,comment,t1_jnjo1nt,,,1.0,t1_jnjgdvn,,jnjo1nt,2024-03-31T20:29:35.898Z,,,,8,https://www.reddit.com/r/moderatepolitics/comments/14549mc/exclusive_donald_trump_admits_on_tape_he_didnt/jnjo1nt/,t2_hu5fqk7,motorboat_mcgee,50.0
...so why is *that* the thing that tells you the docs have the label?,r/moderatepolitics,2023-06-09T20:36:07.000Z,comment,t1_jnkrrw0,,,0.0,t1_jnjo1nt,,jnkrrw0,2024-03-31T20:29:35.898Z,,,,2,https://www.reddit.com/r/moderatepolitics/comments/14549mc/exclusive_donald_trump_admits_on_tape_he_didnt/jnkrrw0/,t2_4a6a1,TrainOfThought6,30.0
"&gt;Will Trump basically admitting to the crime on audio tape convince any of his supporters he is guilty?

His supporters for the most part have taken the stance of 'No crime was even really committed since he once had the power to declassify the information so that means this just a teensy mistake' so no, I don't think this will change their minds at all.  They knew full well what he did and they rationalized it away.",r/moderatepolitics,2023-06-09T13:44:47.000Z,comment,t1_jnj1k5e,,,0.0,t1_jniumvl,,jnj1k5e,2024-03-31T20:29:35.898Z,,,,13,https://www.reddit.com/r/moderatepolitics/comments/14549mc/exclusive_donald_trump_admits_on_tape_he_didnt/jnj1k5e/,t2_6uwzs,hatersaurusrex,90.0
"&gt;“All sorts of stuff – pages long, look. Wait a minute, let’s see here. I just found, isn’t that amazing? This totally wins my case, you know. Except it is like, highly confidential. Secret. This is secret information. Look, look at this.”

What does he mean by ""this totally wins my case""? There's so many cases against him. How can we narrow it down.",r/moderatepolitics,2023-06-09T15:19:29.000Z,comment,t1_jnjfopv,,,0.0,t1_jniumvl,,jnjfopv,2024-03-31T20:29:35.898Z,,,,6,https://www.reddit.com/r/moderatepolitics/comments/14549mc/exclusive_donald_trump_admits_on_tape_he_didnt/jnjfopv/,t2_8ap50,Daetra,45.0
"Screw convincing anyone. He should have gone to jail for obstruction while he was President, now he can go to jail for obstruction and mishandling instead.

Let the extreme right riot, they're going to eventually anyway.",r/moderatepolitics,2023-06-09T13:46:08.000Z,comment,t1_jnj1qzt,,,0.0,t1_jniumvl,,jnj1qzt,2024-03-31T20:29:35.898Z,,,,26,https://www.reddit.com/r/moderatepolitics/comments/14549mc/exclusive_donald_trump_admits_on_tape_he_didnt/jnj1qzt/,t2_d2ilm,Darth_Ra,90.0
"Of course not, but at this point what they think doesn't matter. What matters is whether Americans are all equal under the law or not.

We'll be finding out soon enough, it seems",r/moderatepolitics,2023-06-09T13:44:32.000Z,comment,t1_jnj1iyl,,,0.0,t1_jniumvl,,jnj1iyl,2024-03-31T20:29:35.898Z,,,,8,https://www.reddit.com/r/moderatepolitics/comments/14549mc/exclusive_donald_trump_admits_on_tape_he_didnt/jnj1iyl/,t2_16lip8,drossbots,10.0
"Watch, the justification conspiracy will be that this is a deepfake audio and not really Trump. There is no evidence that you could ever supply to his supporters that would ever change their minds. There is a built in justification to anything that he does because he has made them believe in his conspiracy. He is a more grandiose Jim Jones. He could tell them to drink the poisoned Kool-Aid and they all dutifully would. Honestly, I wish he would do that. We came close with the Ivermectin hoax and the ""Can't we just drink bleach or shine a light inside"" to kill COVID. His followers are in a total delusion.",r/moderatepolitics,2023-06-09T13:44:06.000Z,comment,t1_jnj1grn,,,0.0,t1_jniumvl,,jnj1grn,2024-03-31T20:29:35.898Z,,,,9,https://www.reddit.com/r/moderatepolitics/comments/14549mc/exclusive_donald_trump_admits_on_tape_he_didnt/jnj1grn/,,[deleted],90.0
Probably not. My mom says she won’t even look at the indictment since it’s all a distraction from biden being bribed with 5 mil. Some people are just lost.,r/moderatepolitics,2023-06-09T22:19:54.000Z,comment,t1_jnl6grv,,,0.0,t1_jniumvl,,jnl6grv,2024-03-31T20:29:35.898Z,,,,2,https://www.reddit.com/r/moderatepolitics/comments/14549mc/exclusive_donald_trump_admits_on_tape_he_didnt/jnl6grv/,t2_jhszjkd,sirlost33,80.0
"[Can a president secretly declassify information without leaving a written record or telling anyone? That question, according to specialists in the law of government secrecy, is borderline incoherent.  If there is no directive memorializing a decision to declassify information and conveying that decision to the rest of the government, the action would essentially have no consequence. Departments and agencies would continue to consider that information classified and so would continue to treat it as a closely held secret, restricting access to records containing it.  “Hypothetical questions like ‘What if a president thinks to himself that something is declassified? Does that change its status?’ are so speculative that their practical meaning is negligible,” said Steven Aftergood, a secrecy specialist with the Federation of American Scientists.  He added: “It’s a logical mess. The system is not meant to be deployed in such an arbitrary fashion.”](https://www.nytimes.com/2022/08/14/us/politics/trump-classified-documents.html)",r/moderatepolitics,2023-06-09T14:24:26.000Z,comment,t1_jnj7bcj,,,1.0,t1_jnj51xu,,jnj7bcj,2024-03-31T20:29:35.898Z,,,,16,https://www.reddit.com/r/moderatepolitics/comments/14549mc/exclusive_donald_trump_admits_on_tape_he_didnt/jnj7bcj/,t2_b5qgtwoe,TheRareWhiteRhino,35.0
Imagine if Obama came out tomorrow and said every secret document that existed in the government before I left office is declassified because I thought in my head 'All documents are now declassified'. Does that make it so? Absolutely not.,r/moderatepolitics,2023-06-10T06:09:21.000Z,comment,t1_jnmmtnb,,,0.0,t1_jnj7bcj,,jnmmtnb,2024-03-31T20:29:35.898Z,,,,3,https://www.reddit.com/r/moderatepolitics/comments/14549mc/exclusive_donald_trump_admits_on_tape_he_didnt/jnmmtnb/,t2_561caj6o,nacreon,20.0
"&gt;Or is it more of an ex Cathedra kinda thing where a president can declassify something merely by saying it’s declassified?

Trump's own administration had to argue on multiple occasions that his simply saying ""declassify this"" was not self-executing.

https://www.cnn.com/2020/10/13/politics/trump-declassification-tweets/index.html

The best example is that we know Trump had HCS documents, stuff from human sources, from the various unsealed documents. Spies, double agents, etc. The kind of people who can be killed by a foreign government if they're exposed. 

At a minimum, the agency in charge of that human source needs to know both that the information from that agent now needs to be marked differently (otherwise you end up with the absurd situation where Trump is allowed to use the information, but agency staff could still be prosecuted for the same information there protecting as if it were still classified), and they need to get the source to safety now that they're no longer able to stay covert.",r/moderatepolitics,2023-06-09T15:32:05.000Z,comment,t1_jnjho9h,,,0.0,t1_jnj51xu,,jnjho9h,2024-03-31T20:29:35.898Z,,,,11,https://www.reddit.com/r/moderatepolitics/comments/14549mc/exclusive_donald_trump_admits_on_tape_he_didnt/jnjho9h/,t2_je77v,Bakkster,20.0
"For starters, Trump signed a bill updating some declassification standards, lol. So there are apparently laws on the books to detail the declassification process. But with all things, the nuts and bolts of it are that the president needs to notify the appropriate agency of his declassification efforts. Some things require a review of the material following the president's order to ensure a document doesn't have something the president didn't mean to declassify. Other can happen in ""real time"", but there needs to be an official declaration so it can be logged, because a lot of laws rest on the classification of a document. There are also departments in agencies that independently review documents for re-classification, like JKF assassination files or something.  

In ""real time"" could mean that POTUS saying something in a press conference that was classified. Well, he can legally share whatever he wants, but then the government could work to declassify that specific information to ensure others don't get in trouble for answering follow up questions or dealing with the blow back.

In every instance of the president's powers, the government must be notified in some capacity and changes like declassifications official logged. Trump didn't do any of that so the documents maintained their classifications.",r/moderatepolitics,2023-06-09T14:32:47.000Z,comment,t1_jnj8job,,,0.0,t1_jnj51xu,,jnj8job,2024-03-31T20:29:35.898Z,,,,11,https://www.reddit.com/r/moderatepolitics/comments/14549mc/exclusive_donald_trump_admits_on_tape_he_didnt/jnj8job/,t2_vo74fhbx,Emperor_FranzJohnson,70.0
"There’s an actual process. Formal requests made in writing, Relevant Agencies are notified, Stuff is logged and stamped. Nothing is ever done in secret. nuclear stuff can’t ever be declassified per act of congress.",r/moderatepolitics,2023-06-09T14:47:10.000Z,comment,t1_jnjapq5,,,1.0,t1_jnj51xu,,jnjapq5,2024-03-31T20:29:35.898Z,,,,9,https://www.reddit.com/r/moderatepolitics/comments/14549mc/exclusive_donald_trump_admits_on_tape_he_didnt/jnjapq5/,t2_6gkogbeq,GrayBox1313,20.0
"Whatever happens to Trump based on what he did after he was no longer president, I do want to clarify that the *sitting* president has broad powers of classification and declassification, and does not himself have to follow any procedures for declassifying information, even ones he developed himself. 

&gt;nuclear stuff can’t ever be declassified per act of congress.

It's not clear that this would be binding on the executive branch. There is no precedent applying this to the president and it would have to be tested in court.",r/moderatepolitics,2023-06-09T16:00:15.000Z,comment,t1_jnjm5vo,,,2.0,t1_jnjapq5,,jnjm5vo,2024-03-31T20:29:35.898Z,,,,4,https://www.reddit.com/r/moderatepolitics/comments/14549mc/exclusive_donald_trump_admits_on_tape_he_didnt/jnjm5vo/,t2_5lltk,Spokker,20.0
"&gt; does not himself have to follow any procedures for declassifying information

Well, depends. If the relevant agencies don't hear about it, they can't perform the steps that actually make the document declassified. It's the same as, for example, the president has plenary power to open national parks, but if he doesn't tell anyone, don't be surprised if some agency allows an oil drilling permit in the area following an earlier order; the national park doesn't magically physically appear in the spot the second the president thinks about it.

Also, if the procedure is nonstandard, the agencies might not interpret it as the real deal and choose not to carry it out. After all, the executive order of the procedure more or less told them ""this is what it will look like when I order declassification"", so by due process they don't really have to interpret anything else as an order.",r/moderatepolitics,2023-06-09T16:32:17.000Z,comment,t1_jnjr6b3,,,0.0,t1_jnjm5vo,,jnjr6b3,2024-03-31T20:29:35.898Z,,,,7,https://www.reddit.com/r/moderatepolitics/comments/14549mc/exclusive_donald_trump_admits_on_tape_he_didnt/jnjr6b3/,,[deleted],30.0
"I don’t really agree here and I don’t think the law does either.

There are items that are “born secret” meaning they are secret from creation and forever. Everything  related to identify of spies and nuclear energy and weapons falls under this. 

“Not Even the President Can Declassify Nuclear Secrets

there are certain materials that presidents cannot classify and declassify at will. One such category of material is the identity of spies.

Another is nuclear secrets. The Atomic Energy Acts of 1946 and 1954 produced an even stranger category of classified knowledge. Anything related to the production or use of nuclear weapons and nuclear power is inherently classified, and Trump could utter whatever words he pleased yet still be in possession of classified material. Where are our nuclear warheads? What tricks have we developed to make sure they work? This information is “born secret” no matter who produces it. The restrictions on documents of this type are incredibly tight. In the unlikely event that Trump came up with a new way to enrich uranium, and scribbled it on a cocktail napkin poolside at Mar-a-Lago early this year, that napkin would instantly have become a classified document subject to various controls and procedures, and possibly illegal for the former president to possess. Of course if he did so, no prosecutor would pursue him. A certain amount of leeway is crucial to the system.”",r/moderatepolitics,2023-06-09T16:08:54.000Z,comment,t1_jnjnido,,,0.0,t1_jnjm5vo,,jnjnido,2024-03-31T20:29:35.898Z,,,,8,https://www.reddit.com/r/moderatepolitics/comments/14549mc/exclusive_donald_trump_admits_on_tape_he_didnt/jnjnido/,t2_6gkogbeq,GrayBox1313,50.0
"It's the same as ordering any other executive government procedure (such as a disaster response or a military operation or the opening of a national park). You notify the people that carry it out. If you don't notify them about it, then obviously there will be no one to carry out the declassification or to open the national park, so the document won't be declassified and the national park will not be opened. In the case of declassification that would mean the national archives and any agencies that hold those documents, because they'll have to make the documents publicly available and put new stamps on them. There's an official process in place to do it (which has been declared by an executive order), but that mostly exists in order to avoid any confusion among the officials.

In a pinch, you could just send a memo to NARA and it might be treated as a declassification order over there, though then all the other agencies might miss it. And certainly if the NARA employees chose not to carry it out and you took them to court over it, the NARA people would probably win because the White House had previously declared to them that declassification orders look like this and not that (due process applies to government employees as well). There isn't really precedent about any of this, though, because usually presidents have enough of an idea of how to run organizations without confusing their workers and/or don't have to resort to weird sophistry to get out of criminal charges.",r/moderatepolitics,2023-06-09T16:09:27.000Z,comment,t1_jnjnli0,,,0.0,t1_jnj51xu,,jnjnli0,2024-03-31T20:29:35.898Z,,,,2,https://www.reddit.com/r/moderatepolitics/comments/14549mc/exclusive_donald_trump_admits_on_tape_he_didnt/jnjnli0/,,[deleted],25.0
We're talking about a group of people that see him as the next coming of Christ lol.,r/moderatepolitics,2023-06-09T13:49:55.000Z,comment,t1_jnj2a1q,,,0.0,t1_jniumvl,,jnj2a1q,2024-03-31T20:29:35.898Z,,,,2,https://www.reddit.com/r/moderatepolitics/comments/14549mc/exclusive_donald_trump_admits_on_tape_he_didnt/jnj2a1q/,t2_rxfhm,keeleon,75.0
"All the defense has to convince the jury of is that ""an ex-president is in a distinctly unique position in regard to classified documents when compared to any other individual"". 

I don't see much criminal exposure but I do feel the trial will demonstrate just how careless and inept Trump can be - not the type of person we want to hand the reigns of power to again.

I feel like the Georgia case has the most criminal exposure.",r/moderatepolitics,2023-06-09T13:38:22.000Z,comment,t1_jnj0ohk,,,4.0,t1_jniumvl,,jnj0ohk,2024-03-31T20:29:35.898Z,,,,-5,https://www.reddit.com/r/moderatepolitics/comments/14549mc/exclusive_donald_trump_admits_on_tape_he_didnt/jnj0ohk/,t2_daco1,gizzardgullet,25.0
"&gt;All the defense has to convince the jury of is that ""an ex-president is in a distinctly unique position in regard to classified documents when compared to any other individual"". 

Can we at least agree that this would require convincing the jury of something that is false? The classification authority rests on the office of the president, as Trump himself is saying here.

They'd also need to walk the very thin line of ""our client lied about the thing that incriminates him, but he hasn't lied about anything else"".",r/moderatepolitics,2023-06-09T15:36:11.000Z,comment,t1_jnjiboc,,,1.0,t1_jnj0ohk,,jnjiboc,2024-03-31T20:29:35.898Z,,,,12,https://www.reddit.com/r/moderatepolitics/comments/14549mc/exclusive_donald_trump_admits_on_tape_he_didnt/jnjiboc/,t2_je77v,Bakkster,75.0
I don't think they can do that. All the prosecutors would need is statements from other ex presidents and biden to the contrary.,r/moderatepolitics,2023-06-09T13:55:18.000Z,comment,t1_jnj31r3,,,1.0,t1_jnj0ohk,,jnj31r3,2024-03-31T20:29:35.898Z,,,,11,https://www.reddit.com/r/moderatepolitics/comments/14549mc/exclusive_donald_trump_admits_on_tape_he_didnt/jnj31r3/,t2_dz8j9,commissar0617,25.0
"Even if an ex-president is in a unique position to handle classified documents, he’s still in no position to be showing them off to the author of a biography of a colleague, which is what this recording clearly shows.",r/moderatepolitics,2023-06-09T15:57:14.000Z,comment,t1_jnjlopf,,,0.0,t1_jnj0ohk,,jnjlopf,2024-03-31T20:29:35.898Z,,,,2,https://www.reddit.com/r/moderatepolitics/comments/14549mc/exclusive_donald_trump_admits_on_tape_he_didnt/jnjlopf/,t2_owpjw,Stillwater215,10.0
Probably with the Saudi’s. That lucrative financial relationship between his family and the Saudi’s sure did appear out of nowhere.,r/moderatepolitics,2023-06-09T15:38:55.000Z,comment,t1_jnjir8l,,,0.0,t1_jnj71kj,,jnjir8l,2024-03-31T20:29:35.898Z,,,,21,https://www.reddit.com/r/moderatepolitics/comments/14549mc/exclusive_donald_trump_admits_on_tape_he_didnt/jnjir8l/,t2_12vaqs,F0rkbombz,90.0
"I'm convinced. I don't begrudge anyone for withholding judgement on guilt until the conclusion of the case, but this case is likely to go past the election so you have to make your own decision for your vote before you have the final call. Ignoring the case is deciding to give him a pass for this behavior which could have harmed national security. 

As of right now you aren't deciding between Trump and Biden, you're deciding between Trump and DeSantis and Tim Scott or whoever. 90% of their policies are identical, it just seems eminently reasonable to go with someone else at this stage.",r/moderatepolitics,2023-06-09T13:19:45.000Z,comment,t1_jniy8gd,,,9.0,t3_14549mc,,jniy8gd,2024-03-31T20:29:35.898Z,,,,260,https://www.reddit.com/r/moderatepolitics/comments/14549mc/exclusive_donald_trump_admits_on_tape_he_didnt/jniy8gd/,t2_4se65,nemoomen,70.0
"&gt; Ignoring the case is deciding to give him a pass for this behavior which could have harmed national security.

This is a really important part of this whole situation.  Are we asking ourselves, has the United States of America been harmed as a result of this?  We should also be asking ourselves Why?

Why did he take the documents in the first place?

Why did he only return a portion of the documents initially?

Why didn't he return them when he was asked again?

Why did his lawyers lie about how the documents were stored and about returning all the documents?

Why weren't the documents secured properly to begin with?

There are just so many ""why"" questions, and while I personally hope the answer isn't more serious/sinister than ""incompetence"" - we should all still be extremely concerned.  If the best case answer is simply incompetence, any true Patriot of this country would be concerned about this incompetence allowing the country to face harm and be even more concerned what the potential incompetence can bring in a second term.",r/moderatepolitics,2023-06-09T14:27:53.000Z,comment,t1_jnj7tub,,,3.0,t1_jniy8gd,,jnj7tub,2024-03-31T20:29:35.898Z,,,,96,https://www.reddit.com/r/moderatepolitics/comments/14549mc/exclusive_donald_trump_admits_on_tape_he_didnt/jnj7tub/,t2_echps,shutupnobodylikesyou,75.0
Yep. Every possible explanation is a negative on Trump's character and ability to lead the country.,r/moderatepolitics,2023-06-09T14:52:28.000Z,comment,t1_jnjbinu,,,0.0,t1_jnj7tub,,jnjbinu,2024-03-31T20:29:35.898Z,,,,51,https://www.reddit.com/r/moderatepolitics/comments/14549mc/exclusive_donald_trump_admits_on_tape_he_didnt/jnjbinu/,,[deleted],85.0
"It’s a red flag that he had them in the first place. Biden had them too. It’s a security problem. 

But the fact that he knowingly misled departments about their existence and tried to keep them despite legal threats is the biggest flag",r/moderatepolitics,2023-06-09T15:08:34.000Z,comment,t1_jnjdzbs,,,3.0,t1_jnj7tub,,jnjdzbs,2024-03-31T20:29:35.898Z,,,,32,https://www.reddit.com/r/moderatepolitics/comments/14549mc/exclusive_donald_trump_admits_on_tape_he_didnt/jnjdzbs/,t2_tygxy,Aedan2016,30.0
There's a big difference in nature too. The stuff Biden had was like old personal schedules and stuff like that. Not Military war plans.,r/moderatepolitics,2023-06-09T15:26:30.000Z,comment,t1_jnjgsps,,,2.0,t1_jnjdzbs,,jnjgsps,2024-03-31T20:29:35.898Z,,,,64,https://www.reddit.com/r/moderatepolitics/comments/14549mc/exclusive_donald_trump_admits_on_tape_he_didnt/jnjgsps/,t2_f1u52,ZZ9ZA,10.0
"It’s amazing because the justice department basically went out of their way to keep this quiet. Only when he lied and withheld items did they have to make it an issue

This is entirely Trumps own doing",r/moderatepolitics,2023-06-09T16:06:11.000Z,comment,t1_jnjn341,,,1.0,t1_jnjgsps,,jnjn341,2024-03-31T20:29:35.898Z,,,,54,https://www.reddit.com/r/moderatepolitics/comments/14549mc/exclusive_donald_trump_admits_on_tape_he_didnt/jnjn341/,t2_tygxy,Aedan2016,20.0
"Heck, during the ""raid"" all the agents put on khakis and plain polos to not publicize it and he had to go and cry to the world about it.",r/moderatepolitics,2023-06-09T17:55:00.000Z,comment,t1_jnk3r0x,,,0.0,t1_jnjyqt4,,jnk3r0x,2024-03-31T20:29:35.898Z,,,,25,https://www.reddit.com/r/moderatepolitics/comments/14549mc/exclusive_donald_trump_admits_on_tape_he_didnt/jnk3r0x/,t2_h8nro,TeddysBigStick,20.0
Wait do you have a source for that? I hadn't heard any specific details of the kinds of materials Biden had.,r/moderatepolitics,2023-06-09T16:02:54.000Z,comment,t1_jnjmku9,,,1.0,t1_jnjgsps,,jnjmku9,2024-03-31T20:29:35.898Z,,,,10,https://www.reddit.com/r/moderatepolitics/comments/14549mc/exclusive_donald_trump_admits_on_tape_he_didnt/jnjmku9/,t2_8ae4o,blewpah,50.0
"It sounds like Pence's stuff was pretty clean (basically daily briefs you receive as VP that were left with him by the agent who delivered them). That investigation has already been declared closed.

Biden apparently had a bunch of stuff even back to his senate years, but a lot of them were things like his hand-written notes on non-classified documents that he should have been smarter with.

The big difference is Biden invited the FBI in to search for whatever they thought he should return, and Trump paid people to move documents around and had his lawyers lie about having returned them. Since intent is a part of the law, it's much easier to prove that Trump acted intentionally.",r/moderatepolitics,2023-06-09T16:27:03.000Z,comment,t1_jnjqcx8,,,1.0,t1_jnjmku9,,jnjqcx8,2024-03-31T20:29:35.898Z,,,,37,https://www.reddit.com/r/moderatepolitics/comments/14549mc/exclusive_donald_trump_admits_on_tape_he_didnt/jnjqcx8/,t2_41kgk,FunkyPete,40.0
