body,communityName,createdAt,dataType,id,isVideo,numberOfComments,numberOfreplies,parentId,parsedCommunityName,parsedId,scrapedAt,thumbnailUrl,title,upVoteRatio,upVotes,url,userId,username,sentiment_score
"URL: https://nypost.com/2023/05/09/trump-must-pay-e-jean-carroll-tktk-after-found-liable-of-rape/
Thumbnail: https://b.thumbs.redditmedia.com/FPU4Fvjn25zsLRmxsvFWHKgjplvEYlBqnYHiDqZ77Ds.jpg
Images:
	https://external-preview.redd.it/ap8XGmf6g-9fLcuOkG0lJMgh8uKl3_0zPXMrnRu5RhE.jpg?auto=webp&amp;s=a281d01efa68c9f53b53ce34c423e6effa34c94e",r/Conservative,2023-05-09T19:14:13.000Z,post,t3_13d2zn7,False,1084.0,,,Conservative,13d2zn7,2024-03-31T20:04:08.976Z,https://b.thumbs.redditmedia.com/FPU4Fvjn25zsLRmxsvFWHKgjplvEYlBqnYHiDqZ77Ds.jpg,"Trump found liable of sexual abuse, defamation in E. Jean Carroll case, ordered to pay $5M in damages",0.79,7659,https://www.reddit.com/r/Conservative/comments/13d2zn7/trump_found_liable_of_sexual_abuse_defamation_in/,t2_d2kiisbo,Vibranium2222,90.0
"Thought I’d share terminology as it relates to civil cases (being found **liable**) vs criminal cases (being found **guilty**). Hopefully this helps clarify what the case decision means:

In a civil case, the standard of proof is “by a preponderance of the evidence.” This means that it is *more likely than unlikely* that the defendant is responsible for the harm to the plaintiff. So, the plaintiff must only prove their case by more than 50% of the evidence. If so, the jury must return with a verdict in favor of the plaintiff.

In a criminal case, the standard of proof is “beyond a reasonable doubt.” This means that the prosecutor must prove *every single element of the crime* alleged beyond a reasonable doubt. If the prosecutor is unable to do this, then the jury must return with a “not guilty” verdict for the defendant. 

**TLDR:** No idea where this will all lead. Just sharing some information about why the term **liable** is in every headline, as apposed to **guilty**. From a high level overview (specifics aside) being found liable in civil cases has a lower standard than being found guilty in criminal cases.

**Edit:** Punctuation / For those that haven't read the specifics about this **civil trial**: The jury decided that Trump was not liable for rape, but was liable for sexual abuse and defamation.",r/Conservative,2023-05-09T19:38:02.000Z,comment,t1_jjidsgm,,,3.0,t3_13d2zn7,,jjidsgm,2024-03-31T20:04:09.013Z,,,,924,https://www.reddit.com/r/Conservative/comments/13d2zn7/trump_found_liable_of_sexual_abuse_defamation_in/jjidsgm/,t2_3arnxqwq,ewurgy,35.0
"“Would a reasonable person think that something had happened?” would be the question in this civil trial.

In a criminal trial, it would be “is there sufficient evidence to conclude that no one other than the defendant committed the alleged crime?”

Just thought I’d simplify further.

**Edit: This post is “flaired users only”. If you don’t have a flair, I won’t be able to see your reply.**",r/Conservative,2023-05-09T19:49:45.000Z,comment,t1_jjifpc2,,,3.0,t1_jjidsgm,,jjifpc2,2024-03-31T20:04:09.013Z,,,,340,https://www.reddit.com/r/Conservative/comments/13d2zn7/trump_found_liable_of_sexual_abuse_defamation_in/jjifpc2/,t2_4e85u1sr,Mad_Chemist_,30.0
That’s not actually accurate in terms of either standard. A criminal trial would require certainty that the crime was committed by that person *beyond a reasonable doubt*. Civil trials can one of two different standards but in this case it was preponderance of the evidence which requires the fact finder to believe it is *more likely than not* that the acts or omissions were committed and that defendant(s) were the responsible parties.,r/Conservative,2023-05-10T00:04:39.000Z,comment,t1_jjjge9f,,,1.0,t1_jjifpc2,,jjjge9f,2024-03-31T20:04:09.013Z,,,,108,https://www.reddit.com/r/Conservative/comments/13d2zn7/trump_found_liable_of_sexual_abuse_defamation_in/jjjge9f/,t2_biry1,deadzip10,20.0
"That’s a good way to put it. Which makes where the case is being held, as well as how well known the defendant is, that much more impactful.

Edit: I see the trolls came out in droves for this singular comment LOL sorry the probability of my statement rings true.",r/Conservative,2023-05-09T21:42:33.000Z,comment,t1_jjix8dm,,,0.0,t1_jjifpc2,,jjix8dm,2024-03-31T20:04:09.013Z,,,,-28,https://www.reddit.com/r/Conservative/comments/13d2zn7/trump_found_liable_of_sexual_abuse_defamation_in/jjix8dm/,t2_3arnxqwq,ewurgy,60.0
"More like ""If you're an NYer who doesn't like Trump, vote to hold him liable""

No evidence was presented that showed this event took place. In NY you can now sue someone and claim an evidence-less crime took place 30 years ago, as long as the person you're suing is a disliked public figure.",r/Conservative,2023-05-09T19:55:32.000Z,comment,t1_jjigniw,,,4.0,t1_jjidsgm,,jjigniw,2024-03-31T20:04:09.013Z,,,,96,https://www.reddit.com/r/Conservative/comments/13d2zn7/trump_found_liable_of_sexual_abuse_defamation_in/jjigniw/,t2_xgvtv,Hrendo,85.0
"&gt;More like ""If you're an NYer who doesn't like Trump, vote to hold him liable""

I don't know. I'm a two time Trump voter and I thought that deposition was a dumpster fire for him. He basically claimed she wasn't good enough for him to bother raping. I could see a jury of not particularly political New Yorkers seeing that and being swayed.",r/Conservative,2023-05-09T21:14:51.000Z,comment,t1_jjit648,,,3.0,t1_jjigniw,,jjit648,2024-03-31T20:04:09.013Z,,,,684,https://www.reddit.com/r/Conservative/comments/13d2zn7/trump_found_liable_of_sexual_abuse_defamation_in/jjit648/,t2_baz13,robinson217,75.0
"You god damn better believe if there’s a rake on the ground, trump is going to step on it.",r/Conservative,2023-05-09T22:09:29.000Z,comment,t1_jjj11ud,,,2.0,t1_jjit648,,jjj11ud,2024-03-31T20:04:09.013Z,,,,349,https://www.reddit.com/r/Conservative/comments/13d2zn7/trump_found_liable_of_sexual_abuse_defamation_in/jjj11ud/,t2_1eyjarcq,conceiv3d-in-lib3rty,80.0
"I have times where I wish he did not say anything, but his ego always gets him.",r/Conservative,2023-05-10T01:47:56.000Z,comment,t1_jjju672,,,2.0,t1_jjj5sij,,jjju672,2024-03-31T20:04:09.013Z,,,,51,https://www.reddit.com/r/Conservative/comments/13d2zn7/trump_found_liable_of_sexual_abuse_defamation_in/jjju672/,t2_gbjgz47j,QuackQuackH0nk,25.0
"It is a feature not a bug. He is entertaining the masses.

Joe Rogan said Trump was comedian of the year awhile back.",r/Conservative,2023-05-10T05:14:01.000Z,comment,t1_jjkh5ye,,,1.0,t1_jjju672,,jjkh5ye,2024-03-31T20:04:09.013Z,,,,16,https://www.reddit.com/r/Conservative/comments/13d2zn7/trump_found_liable_of_sexual_abuse_defamation_in/jjkh5ye/,t2_7eg3g,W_Edwards_Deming,40.0
"Not sure if this is something you can answer but I am genuinely curious: how would a normal person even attempt to defend themselves against a charge where the witness can't even remember a date of when the incident occurred? Like if what Trump did was a bad defense, what should the defense have been instead?",r/Conservative,2023-05-09T22:48:14.000Z,comment,t1_jjj69ft,,,1.0,t1_jjit648,,jjj69ft,2024-03-31T20:04:09.013Z,,,,-10,https://www.reddit.com/r/Conservative/comments/13d2zn7/trump_found_liable_of_sexual_abuse_defamation_in/jjj69ft/,t2_6vwyr,john_the_fisherman,30.0
"&gt; No evidence was presented that showed this event took place. In NY you can now sue someone and claim an evidence-less crime took place 30 years ago, as long as the person you're suing is a disliked public figure.

As the term is used legally, witness testimony is a form of evidence (aside, this is why many news articles that say Trump claims things ""without evidence"" are incorrect). A he said/she said should not be enough for a criminal conviction, but in civil court all you need is for one side to be a little more credible than the other.

Apparently, the jury found the eyewitness testimony including corroboration from her friends of an outcry at the time more credible than Trump's denials. It probably didn't help that even his supporters would admit the guy is a serial liar. Also, the fact that he didn't testify. Or that his ""she's not my type"" defense lost a lot of credibility when he mistook her for his wife in an old photo.

None of us have any idea whether this happened, and the fact that she doesn't even know the year it happened should hurt her credibility. But Trump has done plenty of damage to his own credibility over the years.",r/Conservative,2023-05-09T20:46:00.000Z,comment,t1_jjiookk,,,2.0,t1_jjigniw,,jjiookk,2024-03-31T20:04:09.013Z,,,,326,https://www.reddit.com/r/Conservative/comments/13d2zn7/trump_found_liable_of_sexual_abuse_defamation_in/jjiookk/,t2_n8ktn,oren0,50.0
"Exactly. Trump basically elected to present scant evidence to refute her claims. This isn't like a criminal trial where there's a presumption of innocence. If someone has evidence/testimony to back their claim, you need to counter that evidence or you will lose. Trump barely made an attempt to counter her claims, which is why the jury deliberations were so quick. Also Trump's deposition was a genuine shitshow.",r/Conservative,2023-05-09T21:01:47.000Z,comment,t1_jjir68j,,,2.0,t1_jjiookk,,jjir68j,2024-03-31T20:04:09.013Z,,,,175,https://www.reddit.com/r/Conservative/comments/13d2zn7/trump_found_liable_of_sexual_abuse_defamation_in/jjir68j/,t2_r9vv2,trbtrbtrb,80.0
"Barely made an attempt to counter her claims? How exactly can one refute claims if they didn't do it? All they can say is, ""I didn't do it."" What evidence could they even present to dispute it, especially when there are no specific dates to be able to look at an old calendar or something to be able to say where one was at during the supposed time that it happened?",r/Conservative,2023-05-10T08:17:06.000Z,comment,t1_jjkuxn1,,,2.0,t1_jjir68j,,jjkuxn1,2024-03-31T20:04:09.013Z,,,,4,https://www.reddit.com/r/Conservative/comments/13d2zn7/trump_found_liable_of_sexual_abuse_defamation_in/jjkuxn1/,t2_ve5qq,ExtraToastyCheezits,40.0
You have to undermine the plaintiffs witness testimony. Poke holes in it.,r/Conservative,2023-05-10T13:38:04.000Z,comment,t1_jjlo8ad,,,0.0,t1_jjkuxn1,,jjlo8ad,2024-03-31T20:04:09.014Z,,,,11,https://www.reddit.com/r/Conservative/comments/13d2zn7/trump_found_liable_of_sexual_abuse_defamation_in/jjlo8ad/,t2_r9vv2,trbtrbtrb,10.0
Disliked by liberals. They wouldn't metoo Biden. In fact his accusations seemed to flatline the thing for a bit.,r/Conservative,2023-05-09T20:06:26.000Z,comment,t1_jjiife2,,,1.0,t1_jjigniw,,jjiife2,2024-03-31T20:04:09.014Z,,,,-13,https://www.reddit.com/r/Conservative/comments/13d2zn7/trump_found_liable_of_sexual_abuse_defamation_in/jjiife2/,t2_g9av9,inlinefourpower,20.0
"To everyone viewing this now:

This article has been edited. Previous lines have been removed. If you are confused by some of the comments, that is why.",r/Conservative,2023-05-09T23:33:54.000Z,comment,t1_jjjcbtu,,,2.0,t3_13d2zn7,,jjjcbtu,2024-03-31T20:04:09.014Z,,,,207,https://www.reddit.com/r/Conservative/comments/13d2zn7/trump_found_liable_of_sexual_abuse_defamation_in/jjjcbtu/,t2_5if9146g,Krugnuggets,50.0
This is why you archive the link and share that instead.,r/Conservative,2023-05-10T20:46:42.000Z,comment,t1_jjni4b6,,,0.0,t1_jjjcbtu,,jjni4b6,2024-03-31T20:04:09.014Z,,,,2,https://www.reddit.com/r/Conservative/comments/13d2zn7/trump_found_liable_of_sexual_abuse_defamation_in/jjni4b6/,t2_y9k5j,Revydown,50.0
"His legal defence was ridiculous. In the deposition, he repeatedly mistook the woman for his then-wife, including when he was shown a photo of him and her.",r/Conservative,2023-05-09T19:55:55.000Z,comment,t1_jjigptf,,,1.0,t1_jjiampc,,jjigptf,2024-03-31T20:04:09.014Z,,,,232,https://www.reddit.com/r/Conservative/comments/13d2zn7/trump_found_liable_of_sexual_abuse_defamation_in/jjigptf/,t2_4e85u1sr,Mad_Chemist_,15.0
"As others have pointed out, ￼the Circus sideshow just needs to end already. I kind of miss boring Republican candidates that actually cared about policy and actually doing things to help the American people. Having the position just so that it can be your personal bully pulpit is hardly a reason for voting for someone. I need an executive who can hire competent people to help him do the business of the damn country, not someone who’s going to be hiring and firing people every other day. This is just getting ridiculous. He could never think long-term. He thought as long as he had his base riled up it would always be in the can for him, but he forgot indepen￼dents, undecideds, and center left libertarian types who could be persuaded. He’s scaring those people away and we need them now more than ever. Remember guys he is not going to be around forever.

Edit: ￼ and with today’s news that former White House staffers might be coming out with allegations of sexual harassment there’s probably another payday in those peoples futures. Is this what we want going into the next primary? Also thanks for the silver.",r/Conservative,2023-05-10T02:44:34.000Z,comment,t1_jjk1h1b,,,1.0,t3_13d2zn7,,jjk1h1b,2024-03-31T20:04:09.014Z,,,,273,https://www.reddit.com/r/Conservative/comments/13d2zn7/trump_found_liable_of_sexual_abuse_defamation_in/jjk1h1b/,t2_3xfby,Frankfusion,75.0
Only 3 comments of 33+ are loading for me..?,r/Conservative,2023-05-09T19:36:19.000Z,comment,t1_jjidiqd,,,3.0,t3_13d2zn7,,jjidiqd,2024-03-31T20:04:09.014Z,,,,211,https://www.reddit.com/r/Conservative/comments/13d2zn7/trump_found_liable_of_sexual_abuse_defamation_in/jjidiqd/,t2_c74tf,dazbekzul,50.0
Flaired users only. As expected for a thread like this.,r/Conservative,2023-05-09T19:37:32.000Z,comment,t1_jjidpiy,,,2.0,t1_jjidiqd,,jjidpiy,2024-03-31T20:04:09.014Z,,,,110,https://www.reddit.com/r/Conservative/comments/13d2zn7/trump_found_liable_of_sexual_abuse_defamation_in/jjidpiy/,t2_91wa3,superduperm1,25.0
Great point. I didn’t consider that.,r/Conservative,2023-05-09T22:44:10.000Z,comment,t1_jjj5pzc,,,0.0,t1_jjidpiy,,jjj5pzc,2024-03-31T20:04:09.014Z,,,,2,https://www.reddit.com/r/Conservative/comments/13d2zn7/trump_found_liable_of_sexual_abuse_defamation_in/jjj5pzc/,t2_c74tf,dazbekzul,50.0
"That’s what happens when it’s “Flaired Users Only”. Non-flaired users will comment, and the number of comments keeps going up, but you can only see flaired comments.

Read: A bunch of libs from r/politics are trying to post.",r/Conservative,2023-05-09T19:38:09.000Z,comment,t1_jjidt7x,,,2.0,t1_jjidiqd,,jjidt7x,2024-03-31T20:04:09.014Z,,,,216,https://www.reddit.com/r/Conservative/comments/13d2zn7/trump_found_liable_of_sexual_abuse_defamation_in/jjidt7x/,t2_1hd02dn4,therealdeb,80.0
"I approve of his policies, but I’m just over the circus.",r/Conservative,2023-05-09T20:15:57.000Z,comment,t1_jjijxo6,,,4.0,t1_jjif3j5,,jjijxo6,2024-03-31T20:04:09.014Z,,,,196,https://www.reddit.com/r/Conservative/comments/13d2zn7/trump_found_liable_of_sexual_abuse_defamation_in/jjijxo6/,t2_5w069,FlutGOS,40.0
"His policies were why normal, rational people put up with him. I’m to the point where i don’t even trust die hard trump supporters anymore. it’s literally a cult now, they talk about wanting trump to be king and shit. a lot of die hards are completely insane.",r/Conservative,2023-05-09T22:01:53.000Z,comment,t1_jjizzly,,,2.0,t1_jjijxo6,,jjizzly,2024-03-31T20:04:09.014Z,,,,177,https://www.reddit.com/r/Conservative/comments/13d2zn7/trump_found_liable_of_sexual_abuse_defamation_in/jjizzly/,t2_1eyjarcq,conceiv3d-in-lib3rty,90.0
The irony is when they talk about fake news while simultaneously quoting opinion editorials as fact or when they talk about brainwashing but refuse to be held accountable. It's textbook cult of personality. They don't believe in something they believe in sharing perceived enemies.,r/Conservative,2023-05-09T22:18:57.000Z,comment,t1_jjj2caw,,,1.0,t1_jjizzly,,jjj2caw,2024-03-31T20:04:09.014Z,,,,85,https://www.reddit.com/r/Conservative/comments/13d2zn7/trump_found_liable_of_sexual_abuse_defamation_in/jjj2caw/,t2_14j911,Cain_The_Enabler,70.0
This so much,r/Conservative,2023-05-09T20:19:48.000Z,comment,t1_jjikj79,,,0.0,t1_jjijxo6,,jjikj79,2024-03-31T20:04:09.014Z,,,,18,https://www.reddit.com/r/Conservative/comments/13d2zn7/trump_found_liable_of_sexual_abuse_defamation_in/jjikj79/,t2_14j911,Cain_The_Enabler,50.0
Vote vivek then. He's the guy,r/Conservative,2023-05-09T20:38:43.000Z,comment,t1_jjink28,,,4.0,t1_jjijxo6,,jjink28,2024-03-31T20:04:09.014Z,,,,-7,https://www.reddit.com/r/Conservative/comments/13d2zn7/trump_found_liable_of_sexual_abuse_defamation_in/jjink28/,t2_49jceue7,just_shy_of_perfect,50.0
"My initial reaction to this comment is ""who?"" which I think is a problem when it comes to competing with some of the contenders who are running or thinking about running as household names",r/Conservative,2023-05-09T21:35:37.000Z,comment,t1_jjiw8fz,,,0.0,t1_jjink28,,jjiw8fz,2024-03-31T20:04:09.014Z,,,,23,https://www.reddit.com/r/Conservative/comments/13d2zn7/trump_found_liable_of_sexual_abuse_defamation_in/jjiw8fz/,t2_qh9398qn,ExperimentalGoat,15.0
That's fair for sure,r/Conservative,2023-05-09T23:07:35.000Z,comment,t1_jjj8u8z,,,0.0,t1_jjj606i,,jjj8u8z,2024-03-31T20:04:09.014Z,,,,3,https://www.reddit.com/r/Conservative/comments/13d2zn7/trump_found_liable_of_sexual_abuse_defamation_in/jjj8u8z/,t2_49jceue7,just_shy_of_perfect,50.0
"I like Vivek, I really do, but the man has no chance of winning the primary. Support DeSantis, and Vivek can get a cabinet position.",r/Conservative,2023-05-09T21:11:47.000Z,comment,t1_jjispp5,,,1.0,t1_jjink28,,jjispp5,2024-03-31T20:04:09.014Z,,,,-13,https://www.reddit.com/r/Conservative/comments/13d2zn7/trump_found_liable_of_sexual_abuse_defamation_in/jjispp5/,t2_p0ym0qsp,Ed_Durr,35.0
I'd rather have trump than desantis personally.,r/Conservative,2023-05-09T21:14:14.000Z,comment,t1_jjit2ut,,,2.0,t1_jjispp5,,jjit2ut,2024-03-31T20:04:09.014Z,,,,-4,https://www.reddit.com/r/Conservative/comments/13d2zn7/trump_found_liable_of_sexual_abuse_defamation_in/jjit2ut/,t2_49jceue7,just_shy_of_perfect,70.0
"Maybe so, but first they need to defeat Biden. All signs point towards DeSantis having a better chance of doing so.

Trump has burnt too many bridges to be able to govern effectively, even if he does manage to win. I hate Mitch McConnell, but the Republican president will need to able to work with him if we want to get anything done. 

Plus, Trump would be in his 80s by the time a second term is over. We can't use the age issue against Biden if our guy is just as old.",r/Conservative,2023-05-09T21:24:32.000Z,comment,t1_jjiulov,,,1.0,t1_jjit2ut,,jjiulov,2024-03-31T20:04:09.014Z,,,,9,https://www.reddit.com/r/Conservative/comments/13d2zn7/trump_found_liable_of_sexual_abuse_defamation_in/jjiulov/,t2_p0ym0qsp,Ed_Durr,35.0
What all but admit?  He never mentioned anything about raping this woman other than she wasn’t his type and he had never met her. That’s not an admission to rape.,r/Conservative,2023-05-09T22:08:12.000Z,comment,t1_jjj0v94,,,1.0,t1_jjif3j5,,jjj0v94,2024-03-31T20:04:09.014Z,,,,4,https://www.reddit.com/r/Conservative/comments/13d2zn7/trump_found_liable_of_sexual_abuse_defamation_in/jjj0v94/,t2_c6trw5cm,shamalonight,25.0
"&gt; The guy all but admitted to everything in his deposition.

How so?",r/Conservative,2023-05-09T20:54:13.000Z,comment,t1_jjipyqv,,,2.0,t1_jjif3j5,,jjipyqv,2024-03-31T20:04:09.014Z,,,,-16,https://www.reddit.com/r/Conservative/comments/13d2zn7/trump_found_liable_of_sexual_abuse_defamation_in/jjipyqv/,t2_xway0,SameCookiePseudonym,50.0
"&gt;&gt; The guy all but admitted to everything in his deposition.
&gt;
&gt;How so?

Did you watch it? Rather than deny he tried to redirect, and it was clumsy. ""She's not my type"" is not your first defense against a rape accusation.",r/Conservative,2023-05-09T21:17:00.000Z,comment,t1_jjitho3,,,4.0,t1_jjipyqv,,jjitho3,2024-03-31T20:04:09.014Z,,,,129,https://www.reddit.com/r/Conservative/comments/13d2zn7/trump_found_liable_of_sexual_abuse_defamation_in/jjitho3/,t2_baz13,robinson217,80.0
"Yeah I did watch it, which is why I'm asking how he ""all but admitted to everything,"" because that's not what I heard when I listened to it. Can you cite a quote or line from the deposition that you interpreted as Trump ""all but admitting to everything?""",r/Conservative,2023-05-09T23:50:25.000Z,comment,t1_jjjeiau,,,0.0,t1_jjitho3,,jjjeiau,2024-03-31T20:04:09.014Z,,,,2,https://www.reddit.com/r/Conservative/comments/13d2zn7/trump_found_liable_of_sexual_abuse_defamation_in/jjjeiau/,t2_xway0,SameCookiePseudonym,40.0
DIdn’t he also say that he doesn’t know who that woman is?  I mean 25 years after the supposed fact that the woman never reported to authorities?  And then suing him saying that he ruined her career by saying she wasn’t his type.   She would have been about 50.  Somehow I don’t think Trump ever had any difficulty finding a woman who was willing.  This is beyond a miscarriage of justice.,r/Conservative,2023-05-09T21:35:00.000Z,comment,t1_jjiw56s,,,1.0,t1_jjitho3,,jjiw56s,2024-03-31T20:04:09.014Z,,,,-32,https://www.reddit.com/r/Conservative/comments/13d2zn7/trump_found_liable_of_sexual_abuse_defamation_in/jjiw56s/,t2_6n6e80f6,TheBigBigBigBomb,90.0
America is not ready for a man of principles. Politics is just a show nowadays.,r/Conservative,2023-05-09T20:50:15.000Z,comment,t1_jjipces,,,2.0,t1_jjif3j5,,jjipces,2024-03-31T20:04:09.014Z,,,,-21,https://www.reddit.com/r/Conservative/comments/13d2zn7/trump_found_liable_of_sexual_abuse_defamation_in/jjipces/,t2_1amxup2x,karlcabaniya,20.0
At this point I don't think America deserves someone principled,r/Conservative,2023-05-09T21:10:47.000Z,comment,t1_jjisk8o,,,1.0,t1_jjipces,,jjisk8o,2024-03-31T20:04:09.014Z,,,,4,https://www.reddit.com/r/Conservative/comments/13d2zn7/trump_found_liable_of_sexual_abuse_defamation_in/jjisk8o/,t2_wp0w4,parkstreetpatriot,20.0
You probably would rather have Liz Cheney.,r/Conservative,2023-05-09T19:49:15.000Z,comment,t1_jjifmb8,,,2.0,t1_jjif3j5,,jjifmb8,2024-03-31T20:04:09.014Z,,,,-82,https://www.reddit.com/r/Conservative/comments/13d2zn7/trump_found_liable_of_sexual_abuse_defamation_in/jjifmb8/,t2_bz7eb8rr,Jolaasen,10.0
"Liz actually seems less of a fake than say Desantis. She's willing to commit career suicide to make a statement. That takes massive balls.

Edit: this isn't to say I'd prefer her over someone else, but that she sticks to what she believes.",r/Conservative,2023-05-09T20:04:02.000Z,comment,t1_jjii1fi,,,1.0,t1_jjifmb8,,jjii1fi,2024-03-31T20:04:09.014Z,,,,156,https://www.reddit.com/r/Conservative/comments/13d2zn7/trump_found_liable_of_sexual_abuse_defamation_in/jjii1fi/,t2_14j911,Cain_The_Enabler,75.0
Tell me one reason why I should vote for him over Desantis in a primary. Just 1.,r/Conservative,2023-05-09T20:00:06.000Z,comment,t1_jjihebr,,,12.0,t3_13d2zn7,,jjihebr,2024-03-31T20:04:09.014Z,,,,401,https://www.reddit.com/r/Conservative/comments/13d2zn7/trump_found_liable_of_sexual_abuse_defamation_in/jjihebr/,t2_112snb,CSGOW1ld,50.0
"As of right now anyway, DeSantis isn't on the ballot.",r/Conservative,2023-05-09T20:23:09.000Z,comment,t1_jjil28m,,,4.0,t1_jjihebr,,jjil28m,2024-03-31T20:04:09.014Z,,,,661,https://www.reddit.com/r/Conservative/comments/13d2zn7/trump_found_liable_of_sexual_abuse_defamation_in/jjil28m/,t2_10kypb,Jakebob70,50.0
I would write in a joke candidate before voting for Trump again.,r/Conservative,2023-05-09T22:44:24.000Z,comment,t1_jjj5r0z,,,1.0,t1_jjil28m,,jjj5r0z,2024-03-31T20:04:09.014Z,,,,289,https://www.reddit.com/r/Conservative/comments/13d2zn7/trump_found_liable_of_sexual_abuse_defamation_in/jjj5r0z/,t2_qtn3a2v,PerfectlyCalmDude,20.0
Give it a few weeks.,r/Conservative,2023-05-09T21:15:28.000Z,comment,t1_jjit9h6,,,1.0,t1_jjil28m,,jjit9h6,2024-03-31T20:04:09.014Z,,,,35,https://www.reddit.com/r/Conservative/comments/13d2zn7/trump_found_liable_of_sexual_abuse_defamation_in/jjit9h6/,t2_p0ym0qsp,Ed_Durr,50.0
i would expect desantis to hop in within the next few days while this story is hot.,r/Conservative,2023-05-09T22:12:47.000Z,comment,t1_jjj1iam,,,1.0,t1_jjit9h6,,jjj1iam,2024-03-31T20:04:09.014Z,,,,36,https://www.reddit.com/r/Conservative/comments/13d2zn7/trump_found_liable_of_sexual_abuse_defamation_in/jjj1iam/,t2_1eyjarcq,conceiv3d-in-lib3rty,50.0
"That will change in the next 10-50 days.

And when he announces, all the heavily upvoted/heavily awarded comments from “fellow conservatives” insisting we need to vote for Trump or Biden over him are going to be hilariously stupid.",r/Conservative,2023-05-09T21:18:03.000Z,comment,t1_jjitn9z,,,1.0,t1_jjil28m,,jjitn9z,2024-03-31T20:04:09.014Z,,,,15,https://www.reddit.com/r/Conservative/comments/13d2zn7/trump_found_liable_of_sexual_abuse_defamation_in/jjitn9z/,t2_91wa3,superduperm1,70.0
DeSantis isn’t running for President as of right this moment.  Therefore he would have to be a write in,r/Conservative,2023-05-09T20:38:23.000Z,comment,t1_jjini3w,,,1.0,t1_jjihebr,,jjini3w,2024-03-31T20:04:09.014Z,,,,75,https://www.reddit.com/r/Conservative/comments/13d2zn7/trump_found_liable_of_sexual_abuse_defamation_in/jjini3w/,t2_tix0blny,Common-Reporter2846,15.0
He's polling phenomenally well for a guy that isn't even in the running.,r/Conservative,2023-05-10T00:06:42.000Z,comment,t1_jjjgodz,,,1.0,t1_jjini3w,,jjjgodz,2024-03-31T20:04:09.014Z,,,,-20,https://www.reddit.com/r/Conservative/comments/13d2zn7/trump_found_liable_of_sexual_abuse_defamation_in/jjjgodz/,t2_ipr43msd,Mountain_Man_88,50.0
"Ok.

So is governor Abbott and kemp.",r/Conservative,2023-05-10T00:07:12.000Z,comment,t1_jjjgqrw,,,1.0,t1_jjjgodz,,jjjgqrw,2024-03-31T20:04:09.014Z,,,,14,https://www.reddit.com/r/Conservative/comments/13d2zn7/trump_found_liable_of_sexual_abuse_defamation_in/jjjgqrw/,t2_tix0blny,Common-Reporter2846,50.0
