body,communityName,createdAt,dataType,id,isVideo,numberOfComments,numberOfreplies,parentId,parsedCommunityName,parsedId,scrapedAt,thumbnailUrl,title,upVoteRatio,upVotes,url,userId,username,sentiment_score
"Yea Pence and Biden both had an “Ope my bad” moment 

Trump was deliberately trying to hide stuff",r/moderatepolitics,2023-06-09T17:58:21.000Z,comment,t1_jnk49tt,,,0.0,t1_jnjqcx8,,jnk49tt,2024-03-31T20:29:35.898Z,,,,21,https://www.reddit.com/r/moderatepolitics/comments/14549mc/exclusive_donald_trump_admits_on_tape_he_didnt/jnk49tt/,t2_1o5cx7r,mdtopp111,45.0
"Exactly. It's not good that Biden had some documents but he cooperated with the investigations and turned them over. Not to mention the different levels of classification potentially involved. Trump obstructed investigations (a crime in and of itself), had multiple opportunities to turn them over, and didn’t.",r/moderatepolitics,2023-06-09T17:55:27.000Z,comment,t1_jnk3tid,,,0.0,t1_jnjdzbs,,jnk3tid,2024-03-31T20:29:35.898Z,,,,3,https://www.reddit.com/r/moderatepolitics/comments/14549mc/exclusive_donald_trump_admits_on_tape_he_didnt/jnk3tid/,t2_foap5,Di0nysus,85.0
"I mean a big difference is Biden’s we’re personal schedules and memos and when asked to give them back he was like “Ope my bad, here ya go”

The Oompa Loompa on the other hand had CIA documents and military intelligence and when asked to return them he was like “don’t have em, nuh-uh.” He was then given multiple chances to return them and when he continued to refuse to they executed the warrant.. found them unsecured, found footage of the Oompa Loompa personally inviting foreign agents into the room where they were unsecured, and then he twisted his story to being “i declassified them so it doesn’t matter”

Now I’m not one for conspiracy theories butttt Kushner received $2b in cash from Saudis and we had a record number of lost CIA agents during the time he had those records…. Seems very likely the angry man sold out his fellow Americans",r/moderatepolitics,2023-06-09T17:56:33.000Z,comment,t1_jnk3zxf,,,1.0,t1_jnjdzbs,,jnk3zxf,2024-03-31T20:29:35.898Z,,,,7,https://www.reddit.com/r/moderatepolitics/comments/14549mc/exclusive_donald_trump_admits_on_tape_he_didnt/jnk3zxf/,t2_1o5cx7r,mdtopp111,85.0
"Personally, I think it's worse than incompetence but perhaps better than malice/treason.  We know that Trump subscribes to the idea that no press is bad press.  He wants to be in the public eye and at the center of attention at all times.  How better to do so, when out of office, than to leave tantalizing little tweets / truthsocials / whatever about how he knows what the deep state is up to and he's seen the classified documents, etc., and have people know he still has access to those classified documents?

I don't think he took them to distribute them.  I think he took them because he doesn't care about the law at all, and as long as he has the documents, he can continue to be the person who brags about all the secrets he knows without any intent to divulge them.",r/moderatepolitics,2023-06-09T15:02:14.000Z,comment,t1_jnjd0yc,,,4.0,t1_jnj7tub,,jnjd0yc,2024-03-31T20:29:35.898Z,,,,6,https://www.reddit.com/r/moderatepolitics/comments/14549mc/exclusive_donald_trump_admits_on_tape_he_didnt/jnjd0yc/,t2_24fh1yrr,ThenaCykez,35.0
"Wouldn’t that alone disqualify him though?   Even if he had no interest in selling or sharing them and all he had was no respect for the law or security of the country. One could say this alone is bad enough.  He was president. No one can take that from him.  If he is convicted or not, he occupied the White House for a term.  History done.  We all know that comes with access to all the secrets.  So why do you need them in your drawer?  It shows blatant narcissism and blatant disregard for the rule of law.  That ought to be a disqualification.  Reasonable",r/moderatepolitics,2023-06-09T15:27:09.000Z,comment,t1_jnjgwdj,,,3.0,t1_jnjd0yc,,jnjgwdj,2024-03-31T20:29:35.898Z,,,,10,https://www.reddit.com/r/moderatepolitics/comments/14549mc/exclusive_donald_trump_admits_on_tape_he_didnt/jnjgwdj/,t2_3sag8va0,New_Membership_2937,90.0
"A former president putting our national security at risk for some ""likes"" on social media...

We really are living in the dumbest timeline, aren't we?",r/moderatepolitics,2023-06-09T16:52:03.000Z,comment,t1_jnju735,,,0.0,t1_jnjgwdj,,jnju735,2024-03-31T20:29:35.898Z,,,,12,https://www.reddit.com/r/moderatepolitics/comments/14549mc/exclusive_donald_trump_admits_on_tape_he_didnt/jnju735/,t2_g2217,MarkNutt25,10.0
"Oh, absolutely, I'm not voting for the man.

I'm just saying I don't think he's Satan incarnate or a Russian agent.  Just a common criminal who is unworthy of office.",r/moderatepolitics,2023-06-09T15:32:07.000Z,comment,t1_jnjhofg,,,0.0,t1_jnjgwdj,,jnjhofg,2024-03-31T20:29:35.898Z,,,,10,https://www.reddit.com/r/moderatepolitics/comments/14549mc/exclusive_donald_trump_admits_on_tape_he_didnt/jnjhofg/,t2_24fh1yrr,ThenaCykez,40.0
"There is a section of the US code (18 US code subsection 1924) that states if any member of government mishandles government documents, it will disqualify them from ever holding office again. He’s fucked. Even if he wins the election he will need to be removed from office if this goes past the election. It’s best for this to culminate before the election. But if he is found guilty after winning the election, he will be removed from office and his vice President will take over (and likely pardon him to prevent him from serving time).",r/moderatepolitics,2023-06-09T19:13:28.000Z,comment,t1_jnkfi9r,,,0.0,t1_jnjgwdj,,jnkfi9r,2024-03-31T20:29:35.898Z,,,,4,https://www.reddit.com/r/moderatepolitics/comments/14549mc/exclusive_donald_trump_admits_on_tape_he_didnt/jnkfi9r/,t2_hsgps,vgraz2k,20.0
"The whole ""doesn't care about the law"" angle might be more likely. I think that Trump has gone through his whole life without facing much consequences and has been able to get away with a lot. This stems from the illusion of him being a billionaire back then and fueled this image of ""Teflon Don"". When he became the most powerful man in the world, that sense of ""I could do anything I want"" was just cranked up to 12 and followed him back to Florida.",r/moderatepolitics,2023-06-09T18:00:04.000Z,comment,t1_jnk4j7g,,,0.0,t1_jnjd0yc,,jnk4j7g,2024-03-31T20:29:35.898Z,,,,5,https://www.reddit.com/r/moderatepolitics/comments/14549mc/exclusive_donald_trump_admits_on_tape_he_didnt/jnk4j7g/,t2_kn6rb,soysaucepapi,75.0
"&gt; Personally, I think it's worse than incompetence but perhaps better than malice/treason

I agree, though I don't know how to charge him appropriately for that. Like, I don't think he was committing espionage in the sense that all of us define that word - I don't think he was selling secrets or trading them for favors etc. I do think he *intentionally* withheld those documents because his narcissism told him that he could (and should) and that nothing would happen to him. I think he intentionally shared some secrets because he can't help but brag and boast and once again, figured himself immune to consequences. 

Is an espionage charge truly appropriate here? I mean, it technically fits. Do I think he really thought he was risking national security by doing so? I honestly doubt it. So I think you could charge him with espionage, but I don't know if you should. That said, I don't know what else you really stick him with if not espionage",r/moderatepolitics,2023-06-09T15:45:41.000Z,comment,t1_jnjju6z,,,0.0,t1_jnjd0yc,,jnjju6z,2024-03-31T20:29:35.898Z,,,,5,https://www.reddit.com/r/moderatepolitics/comments/14549mc/exclusive_donald_trump_admits_on_tape_he_didnt/jnjju6z/,t2_6uhcx,julius_sphincter,85.0
"I mean foreign agents were caught on camera being personally invited by Trump into the room where the records were insecurely stored, Kushner received $2b in cash from Saudi Arabia, and we had a record number of CIA agents lost, alllll during the time trump had those records…

It’s seems like it was pretty intentional and he sold out America.",r/moderatepolitics,2023-06-09T18:01:29.000Z,comment,t1_jnk4qzd,,,0.0,t1_jnjd0yc,,jnk4qzd,2024-03-31T20:29:35.898Z,,,,1,https://www.reddit.com/r/moderatepolitics/comments/14549mc/exclusive_donald_trump_admits_on_tape_he_didnt/jnk4qzd/,t2_1o5cx7r,mdtopp111,90.0
"100%. I can understand someone being conservative, I can understand reluctantly voting for Trump over Hillary...but I can't understand choosing Trump from amongst a set of like-minded Republican candidates. Trump's big accomplishments in office were the corporate tax cut, the Supreme Court nominations, and some executive orders around stricter border policies. Literally, every Republican in the field would have accomplished all those things without the additional drama.",r/moderatepolitics,2023-06-09T14:14:26.000Z,comment,t1_jnj5tq6,,,3.0,t1_jniy8gd,,jnj5tq6,2024-03-31T20:29:35.898Z,,,,127,https://www.reddit.com/r/moderatepolitics/comments/14549mc/exclusive_donald_trump_admits_on_tape_he_didnt/jnj5tq6/,t2_15o5ty,moonfox1000,90.0
"The SCOTUS nominations were more McConnell's win than Trump's anyway. I honestly can not wrap my head around his popularity. The way his base continually dismisses, ignores, or minimizes his neverending slew of controversies is baffling.",r/moderatepolitics,2023-06-09T14:22:47.000Z,comment,t1_jnj72gg,,,4.0,t1_jnj5tq6,,jnj72gg,2024-03-31T20:29:35.898Z,,,,102,https://www.reddit.com/r/moderatepolitics/comments/14549mc/exclusive_donald_trump_admits_on_tape_he_didnt/jnj72gg/,t2_8f7uafow,NativeMasshole,80.0
"My family still puts all the ""hate"" against him down to his mean tweets and nothing else. It's bizarre.",r/moderatepolitics,2023-06-09T14:40:45.000Z,comment,t1_jnj9qog,,,1.0,t1_jnj72gg,,jnj9qog,2024-03-31T20:29:35.898Z,,,,53,https://www.reddit.com/r/moderatepolitics/comments/14549mc/exclusive_donald_trump_admits_on_tape_he_didnt/jnj9qog/,t2_32p7wg4b,AFlockOfTySegalls,70.0
"&gt;I honestly can not wrap my head around his popularity.

When people talk about hyper-partisanship, this is what it looks like. ""My team"" can do nothing wrong, ""your team"" can do nothing right.

Which, ironically, means independents who oppose partisanship are less likely to vote for them, least they feed further partisanship.",r/moderatepolitics,2023-06-09T15:06:20.000Z,comment,t1_jnjdn0k,,,1.0,t1_jnj72gg,,jnjdn0k,2024-03-31T20:29:35.898Z,,,,16,https://www.reddit.com/r/moderatepolitics/comments/14549mc/exclusive_donald_trump_admits_on_tape_he_didnt/jnjdn0k/,t2_je77v,Bakkster,20.0
"I think it's more partly because he feels real to them. Most politicians are clearly politicians. They speak in a particular way and belong to the system.

Trump is mistaken by people as being successful and self-made. They love the idea of someone like that coming in, bucking the system, and reshaping America.",r/moderatepolitics,2023-06-09T15:23:07.000Z,comment,t1_jnjg9ef,,,2.0,t1_jnjdn0k,,jnjg9ef,2024-03-31T20:29:35.898Z,,,,12,https://www.reddit.com/r/moderatepolitics/comments/14549mc/exclusive_donald_trump_admits_on_tape_he_didnt/jnjg9ef/,t2_urd9et46,ObeyCoffeeDrinkSatan,75.0
"Belonging to the system is part of politics. It's the reason why it is a craft that is made by statesmen with years of experience and knowledge often in bistory or law, but some from other educated background.

Stalin for all his terror was still an educated communist revolutionary that hung around western educated fellows like Lenin and Trotsky.",r/moderatepolitics,2023-06-09T16:46:08.000Z,comment,t1_jnjtapt,,,0.0,t1_jnjg9ef,,jnjtapt,2024-03-31T20:29:35.898Z,,,,5,https://www.reddit.com/r/moderatepolitics/comments/14549mc/exclusive_donald_trump_admits_on_tape_he_didnt/jnjtapt/,t2_gd7r9qze,Individual_Lion_7606,20.0
"But if you want somebody who is successful and *actually* self-made, Tim Scott is right there on the ballot...",r/moderatepolitics,2023-06-09T16:43:06.000Z,comment,t1_jnjsu58,,,1.0,t1_jnjg9ef,,jnjsu58,2024-03-31T20:29:35.898Z,,,,4,https://www.reddit.com/r/moderatepolitics/comments/14549mc/exclusive_donald_trump_admits_on_tape_he_didnt/jnjsu58/,t2_g2217,MarkNutt25,70.0
