body,communityName,createdAt,dataType,id,isVideo,numberOfComments,numberOfreplies,parentId,parsedCommunityName,parsedId,scrapedAt,thumbnailUrl,title,upVoteRatio,upVotes,url,userId,username,sentiment_score
This is covered in the article. Specifically.,r/moderatepolitics,2023-06-07T22:21:57.000Z,comment,t1_jnbfxoc,,,0.0,t1_jnb86g8,,jnbfxoc,2024-03-31T20:27:59.302Z,,,,21,https://www.reddit.com/r/moderatepolitics/comments/143n58m/prosecutors_ready_to_ask_for_trump_indictment_on/jnbfxoc/,t2_d2ilm,Darth_Ra,50.0
How will it affect the primary? Somehow DeSantis will fall even farther behind in the polls as Donald uses a criminal indictment to rally more support.,r/moderatepolitics,2023-06-07T21:19:09.000Z,comment,t1_jnb6bjo,,,1.0,t1_jnat7tx,,jnb6bjo,2024-03-31T20:27:59.302Z,,,,8,https://www.reddit.com/r/moderatepolitics/comments/143n58m/prosecutors_ready_to_ask_for_trump_indictment_on/jnb6bjo/,t2_6gkogbeq,GrayBox1313,70.0
"His fundraising will go nuts, if past performance is any indication.",r/moderatepolitics,2023-06-07T21:48:56.000Z,comment,t1_jnbazpx,,,0.0,t1_jnb6bjo,,jnbazpx,2024-03-31T20:27:59.302Z,,,,9,https://www.reddit.com/r/moderatepolitics/comments/143n58m/prosecutors_ready_to_ask_for_trump_indictment_on/jnbazpx/,t2_je77v,Bakkster,70.0
Has anyone heard of a person named Biden?,r/moderatepolitics,2023-06-08T18:29:45.000Z,comment,t1_jnfexo6,,,1.0,t1_jnat7tx,,jnfexo6,2024-03-31T20:27:59.302Z,,,,1,https://www.reddit.com/r/moderatepolitics/comments/143n58m/prosecutors_ready_to_ask_for_trump_indictment_on/jnfexo6/,t2_itdymc0a,Defiant-Gain3345,50.0
"My guess is, Trump will find a way delay and/or weasel out of this. Plus this will, unfortunately, only strengthen him with his base. The politics of persecution and aggrievement are his go to methods. Look for him to talk about how corrupt the FBI, DOJ, etc are, and associated bogus claims. He'll campaign on it for the primary.",r/moderatepolitics,2023-06-07T20:40:33.000Z,comment,t1_jnazz5i,,,5.0,t3_143n58m,,jnazz5i,2024-03-31T20:27:59.302Z,,,,83,https://www.reddit.com/r/moderatepolitics/comments/143n58m/prosecutors_ready_to_ask_for_trump_indictment_on/jnazz5i/,t2_4w7rpbr7,jarena009,80.0
"Trump can’t be any stronger with his base. He can do no wrong in their eyes, so it’s ultimately irrelevant. If he wants to win the primary (and the Presidency), he needs to make inroads with moderate republicans and independent voters which he has been hemorrhaging support on since Jan 6.",r/moderatepolitics,2023-06-07T20:55:42.000Z,comment,t1_jnb2huw,,,3.0,t1_jnazz5i,,jnb2huw,2024-03-31T20:27:59.302Z,,,,95,https://www.reddit.com/r/moderatepolitics/comments/143n58m/prosecutors_ready_to_ask_for_trump_indictment_on/jnb2huw/,t2_543xr,drock4vu,25.0
"&gt; If he wants to win the primary (and the Presidency), he needs to make inroads with moderate republicans and independent voters which he has been hemorrhaging support on since Jan 6.

I'm going to disagree, as of this moment, according to 538, he's at 53% in the primary:
https://projects.fivethirtyeight.com/polls/president-primary-r/2024/national/

53% should be more than enough to win in a primary with 2 people, let alone the 10+ that are currently in the Republican primary.",r/moderatepolitics,2023-06-07T21:22:26.000Z,comment,t1_jnb6ujs,,,1.0,t1_jnb2huw,,jnb6ujs,2024-03-31T20:27:59.302Z,,,,41,https://www.reddit.com/r/moderatepolitics/comments/143n58m/prosecutors_ready_to_ask_for_trump_indictment_on/jnb6ujs/,t2_42pqe,random3223,25.0
"&gt;53% should be more than enough to win in a primary with 2 people, let alone the 10+ that are currently in the Republican primary.

Not to mention that Trump is also polling \~25% ahead of DeSantis head to head",r/moderatepolitics,2023-06-08T00:08:47.000Z,comment,t1_jnbuwfu,,,0.0,t1_jnb6ujs,,jnbuwfu,2024-03-31T20:27:59.302Z,,,,18,https://www.reddit.com/r/moderatepolitics/comments/143n58m/prosecutors_ready_to_ask_for_trump_indictment_on/jnbuwfu/,t2_dvkrz,BernankesBeard,60.0
"The problem is there are a bunch of ""independents"" or moderate Republicans that are ""done with Trump"" that have come back into his camp since his NY indictment. These individuals don't really like Trump but they do believe there's a nationwide conspiracy against him and his legal woes are validating to that perspective. His approval has risen considerably since his indictment.",r/moderatepolitics,2023-06-07T21:02:47.000Z,comment,t1_jnb3nqc,,,6.0,t1_jnb2huw,,jnb3nqc,2024-03-31T20:27:59.302Z,,,,25,https://www.reddit.com/r/moderatepolitics/comments/143n58m/prosecutors_ready_to_ask_for_trump_indictment_on/jnb3nqc/,t2_awk7m,EmergencyTaco,70.0
"Without some very substantial evidence, I can’t believe that someone who believes in a “conspiracy against Trump” was ever not going to vote for him in the first place.",r/moderatepolitics,2023-06-07T21:07:25.000Z,comment,t1_jnb4fex,,,3.0,t1_jnb3nqc,,jnb4fex,2024-03-31T20:27:59.302Z,,,,90,https://www.reddit.com/r/moderatepolitics/comments/143n58m/prosecutors_ready_to_ask_for_trump_indictment_on/jnb4fex/,t2_543xr,drock4vu,20.0
"Speaking for my brother, he’s a fairly low information voter because he has a lot of other priorities in his life. He skims headlines every couple weeks and maybe reads a full article once in a blue moon. He just isn’t all that invested to begin with but from what he’s seen here and there with absolutely zero deep analysis, he believes the constant bad press can’t possibly be true, especially because he mostly sees the most ridiculous headlines. It’s the low info voters who may be swayed by this argument.",r/moderatepolitics,2023-06-07T22:14:53.000Z,comment,t1_jnbewvy,,,3.0,t1_jnb4fex,,jnbewvy,2024-03-31T20:27:59.302Z,,,,25,https://www.reddit.com/r/moderatepolitics/comments/143n58m/prosecutors_ready_to_ask_for_trump_indictment_on/jnbewvy/,t2_15kjgz,polchiki,40.0
"&gt; he believes the constant bad press can’t possibly be true

This is typical conspiracy theory thinking: evidence against is *actually* evidence for it.",r/moderatepolitics,2023-06-07T22:35:37.000Z,comment,t1_jnbhwsx,,,0.0,t1_jnbewvy,,jnbhwsx,2024-03-31T20:27:59.302Z,,,,42,https://www.reddit.com/r/moderatepolitics/comments/143n58m/prosecutors_ready_to_ask_for_trump_indictment_on/jnbhwsx/,t2_32jc4,cranktheguy,25.0
Does he feel the same way about Hillary?,r/moderatepolitics,2023-06-07T22:37:20.000Z,comment,t1_jnbi5q2,,,2.0,t1_jnbewvy,,jnbi5q2,2024-03-31T20:27:59.302Z,,,,21,https://www.reddit.com/r/moderatepolitics/comments/143n58m/prosecutors_ready_to_ask_for_trump_indictment_on/jnbi5q2/,t2_a1cfv,Sapphyrre,50.0
"Great point because absolutely not. Nor does he feel the same about George Soros, AOC, or others among the nation’s most hated individuals.",r/moderatepolitics,2023-06-08T01:51:29.000Z,comment,t1_jnc93r3,,,1.0,t1_jnbi5q2,,jnc93r3,2024-03-31T20:27:59.302Z,,,,14,https://www.reddit.com/r/moderatepolitics/comments/143n58m/prosecutors_ready_to_ask_for_trump_indictment_on/jnc93r3/,t2_15kjgz,polchiki,10.0
"It doesn't really seem like he's low info, just poor info.",r/moderatepolitics,2023-06-08T03:55:41.000Z,comment,t1_jncop8z,,,1.0,t1_jnc93r3,,jncop8z,2024-03-31T20:27:59.302Z,,,,13,https://www.reddit.com/r/moderatepolitics/comments/143n58m/prosecutors_ready_to_ask_for_trump_indictment_on/jncop8z/,t2_g0xhv,ass_pineapples,40.0
"Well he does live and work traveling around the Midwest and South US so the social element has an impact on what he’s exposed to.

Again, in my opinion, this comes from not being even remotely invested in politics. He doesn’t give enough of a shit to do the work it’d take to make his own informed opinion. So he’s susceptible to things that sound right at the time. He could be convinced to vote any which way by a skilled orator in proximity to the election. I think there are many Americans like him. 

I actually remember the moment in my second important voting cycle as an adult, 2012, being so overwhelmed with making an informed decision because I didn’t understand enough about how our government worked, historical precedent, etc to understand the most in depth articles written at the time. It made me realize I need to basically study well outside the election cycle if I wanted to follow along while in it.",r/moderatepolitics,2023-06-08T13:00:04.000Z,comment,t1_jne0fc7,,,0.0,t1_jncop8z,,jne0fc7,2024-03-31T20:27:59.302Z,,,,5,https://www.reddit.com/r/moderatepolitics/comments/143n58m/prosecutors_ready_to_ask_for_trump_indictment_on/jne0fc7/,t2_15kjgz,polchiki,70.0
"Agreed. If they were actually turned off from him about January 6th, why would they somehow now believe he was above reproach on other matters? Nope, the people who ""went back"" to him never left.",r/moderatepolitics,2023-06-07T21:18:07.000Z,comment,t1_jnb65jx,,,0.0,t1_jnb4fex,,jnb65jx,2024-03-31T20:27:59.302Z,,,,48,https://www.reddit.com/r/moderatepolitics/comments/143n58m/prosecutors_ready_to_ask_for_trump_indictment_on/jnb65jx/,t2_yv05k,jbcmh81,85.0
This. I find it hard to believe that the guy who has been adjacent to crime his entire life has millions of people who were against him but will now vote for him simply because the bill is due.,r/moderatepolitics,2023-06-08T00:42:01.000Z,comment,t1_jnbzg26,,,0.0,t1_jnb4fex,,jnbzg26,2024-03-31T20:27:59.302Z,,,,4,https://www.reddit.com/r/moderatepolitics/comments/143n58m/prosecutors_ready_to_ask_for_trump_indictment_on/jnbzg26/,t2_32p7wg4b,AFlockOfTySegalls,80.0
"I think those moderate Republicans are having a knee-jerk reaction to Trump being ""attacked,"" but when they hear the specific charges read out and the evidence to support them is published, they might reconsider.",r/moderatepolitics,2023-06-07T21:25:20.000Z,comment,t1_jnb7b43,,,1.0,t1_jnb3nqc,,jnb7b43,2024-03-31T20:27:59.302Z,,,,26,https://www.reddit.com/r/moderatepolitics/comments/143n58m/prosecutors_ready_to_ask_for_trump_indictment_on/jnb7b43/,t2_41kgk,FunkyPete,70.0
"I can at least understand how someone would reach the conclusion that the NY false business expenses had a political influence and a weaker case.

If even half the recent reports for the documents case are true, it'll be a much stronger case. Between breaking the PRA, obstructing the official attempts to enforce it using less confrontational means, and the potential national security damage of the classified documents. It's more serious crimes, and potentially a really strong case.",r/moderatepolitics,2023-06-07T21:43:02.000Z,comment,t1_jnba2yl,,,1.0,t1_jnb7b43,,jnba2yl,2024-03-31T20:27:59.302Z,,,,27,https://www.reddit.com/r/moderatepolitics/comments/143n58m/prosecutors_ready_to_ask_for_trump_indictment_on/jnba2yl/,t2_je77v,Bakkster,70.0
"&gt;I can at least understand how someone would reach the conclusion that the NY false business expenses had a political influence and a weaker case.

This one truly seemed about as weak as an indictment could get, and being politically motivated is not a stretch.  So, I'm not surprised it ended up helping him.

The GA case to me could change things, and the docs case might.

That being said, I find the approach here pretty interesting.  I read through it a bit, and up until the point where they mention ""and fails to deliver it on demand"" it seems like they could level the same charges against Pence and Biden along with probably countless other elected officials who have mishandled sensitive documents.

That is the difference, they handed them over and he did not, it just seems like a strange bar to set.  To me it kind of reads like ""you can mishandle docs however you want, but when we ask for them back you better give them to us"".  When, to me, mishandling to docs should be the bar, not ones willingness to return them.

All that being said, will have to see what the espionage charges are, no clue on that and it could negate my thoughts on the matter.",r/moderatepolitics,2023-06-07T22:52:28.000Z,comment,t1_jnbkbsz,,,3.0,t1_jnba2yl,,jnbkbsz,2024-03-31T20:27:59.302Z,,,,2,https://www.reddit.com/r/moderatepolitics/comments/143n58m/prosecutors_ready_to_ask_for_trump_indictment_on/jnbkbsz/,t2_9s5im,rwk81,30.0
"I am not an attorney but returning them when asked might possibly speak to intent? It could be (and almost certainly is) a legitimate oversight when Biden or Pence takes documents, one of many, to their homes but then when the documents are discovered to be in their possession, they return them immediately, further confirming the oversight. When someone like Trump, otoh, refuses to return them, it might make it look less like an oversight and more of an intentional attempt to take the document(s).",r/moderatepolitics,2023-06-07T23:39:42.000Z,comment,t1_jnbqxbe,,,1.0,t1_jnbkbsz,,jnbqxbe,2024-03-31T20:27:59.302Z,,,,14,https://www.reddit.com/r/moderatepolitics/comments/143n58m/prosecutors_ready_to_ask_for_trump_indictment_on/jnbqxbe/,t2_15nhfs,camergen,60.0
"All good points.

My beef with all this is, when I was in the military, if I mishandled classified docs I'd have the book thrown at me no matter what my intent was.

Here we are with these guys seemingly having documents everywhere they've been.... And they're going out of their way to not drop the hammer on them if they have them back when asked.",r/moderatepolitics,2023-06-07T23:48:56.000Z,comment,t1_jnbs76j,,,2.0,t1_jnbqxbe,,jnbs76j,2024-03-31T20:27:59.302Z,,,,1,https://www.reddit.com/r/moderatepolitics/comments/143n58m/prosecutors_ready_to_ask_for_trump_indictment_on/jnbs76j/,t2_9s5im,rwk81,25.0
"&gt;My beef with all this is, when I was in the military, if I mishandled classified docs I'd have the book thrown at me no matter what my intent was.

Might the difference be UCMJ? 

For civilians, self reported accidents seems to not get prosecuted. I've never found an incident like that.

The example that really bugs me is Patraeus, who leaked information intentionally and got away with an insanely light sentence, that then got pardoned.",r/moderatepolitics,2023-06-08T01:59:50.000Z,comment,t1_jnca8ns,,,1.0,t1_jnbs76j,,jnca8ns,2024-03-31T20:27:59.302Z,,,,10,https://www.reddit.com/r/moderatepolitics/comments/143n58m/prosecutors_ready_to_ask_for_trump_indictment_on/jnca8ns/,t2_je77v,Bakkster,40.0
"Yeah, UCMJ probably governs that in the military, and maybe the civilian laws are significantly more lenient.

I just don't like how these guys can just have all these docs spread all over the country side and it's fine as long as they give them back when asked.",r/moderatepolitics,2023-06-08T02:27:50.000Z,comment,t1_jnce1it,,,1.0,t1_jnca8ns,,jnce1it,2024-03-31T20:27:59.302Z,,,,2,https://www.reddit.com/r/moderatepolitics/comments/143n58m/prosecutors_ready_to_ask_for_trump_indictment_on/jnce1it/,t2_9s5im,rwk81,20.0
"As we recently saw with the Discord leaks, even military members get several warnings

https://www.cbsnews.com/boston/news/jack-teixeira-pentagon-documents-leak-warning-classified-information/",r/moderatepolitics,2023-06-08T02:33:50.000Z,comment,t1_jnceu64,,,1.0,t1_jnbs76j,,jnceu64,2024-03-31T20:27:59.302Z,,,,7,https://www.reddit.com/r/moderatepolitics/comments/143n58m/prosecutors_ready_to_ask_for_trump_indictment_on/jnceu64/,t2_8jhc5qnu,AbbreviationsDue7794,30.0
"The bar is *intent*. If you accidently mishandled documents and fessed up and returned them as soon as you found out, that's completely different from knowingly mishandling them, defying subpoenas for them, and obstructing actions to retrieve them. One is bad depending on how badly you mishandled them, the other is magnitudes worse.",r/moderatepolitics,2023-06-08T02:29:55.000Z,comment,t1_jnceb8j,,,1.0,t1_jnbkbsz,,jnceb8j,2024-03-31T20:27:59.302Z,,,,7,https://www.reddit.com/r/moderatepolitics/comments/143n58m/prosecutors_ready_to_ask_for_trump_indictment_on/jnceb8j/,t2_8jhc5qnu,AbbreviationsDue7794,30.0
"Yeah, I get that, I'm really just thinking back to my military days where intent didn't matter, and honestly I'd much rather than be the standard for civilians as well.",r/moderatepolitics,2023-06-08T02:31:41.000Z,comment,t1_jncejpg,,,1.0,t1_jnceb8j,,jncejpg,2024-03-31T20:27:59.302Z,,,,2,https://www.reddit.com/r/moderatepolitics/comments/143n58m/prosecutors_ready_to_ask_for_trump_indictment_on/jncejpg/,t2_9s5im,rwk81,10.0
"I just responded with this elsewhere, but we recently saw from the Discord leaks that even military members get warnings before getting into trouble

https://www.cbsnews.com/boston/news/jack-teixeira-pentagon-documents-leak-warning-classified-information/",r/moderatepolitics,2023-06-08T02:35:39.000Z,comment,t1_jncf2zg,,,0.0,t1_jncejpg,,jncf2zg,2024-03-31T20:27:59.302Z,,,,4,https://www.reddit.com/r/moderatepolitics/comments/143n58m/prosecutors_ready_to_ask_for_trump_indictment_on/jncf2zg/,t2_8jhc5qnu,AbbreviationsDue7794,50.0
"&gt;This one truly seemed about as weak as an indictment could get, and being politically motivated is not a stretch.

And to be clear, I think the political motivation is more along the lines of ""politicians are not above the law, even former presidents"" rather than ""let's witch hunt republicans"".

&gt;That is the difference, they handed them over and he did not, it just seems like a strange bar to set. To me it kind of reads like ""you can mishandle docs however you want, but when we ask for them back you better give them to us"". When, to me, mishandling to docs should be the bar, not ones willingness to return them.

A few things on this.

One is that Biden was not asked to give documents back. He discovered the documents had been taken on accident and immediately *self reported and cooperated with the investigation*. NARA knew Trump knew that he had documents, including ones with classification markings. By the time they asked for them to be returned, it was was already worse.

From there, DOJ got a subpoena for the documents they knew he had, and knew he didn't return them all (needing a search warrant for the remainder). This is where the potential obstruction charges start.

But mostly it's the self reporting *when it was an accident and no disclosure happened*, that's pretty much the standard for classified documents. If you self report, you get administrative sanctions (escalating write-ups until they revoke your clearance, which Trump is reported to have already had revoked as one of Biden's first acts in office). Criminal charges are reserved for people who hide their mistakes or intentionally leak. Whether someone's FPOTUS or a lowly clerk.",r/moderatepolitics,2023-06-07T23:51:02.000Z,comment,t1_jnbshkt,,,0.0,t1_jnbkbsz,,jnbshkt,2024-03-31T20:27:59.302Z,,,,8,https://www.reddit.com/r/moderatepolitics/comments/143n58m/prosecutors_ready_to_ask_for_trump_indictment_on/jnbshkt/,t2_je77v,Bakkster,15.0
"The thing I find interesting is you’re saying this is happening for independents. I’m in a red state, and I’m not conservative, but a lot of people around me are. And I’ve heard so many say the party needs to find someone with less drama and chaos around them so they can actually spend their time making changes.

So while maybe some independents are going back to trump, I’ve heard of conservatives and libertarians who are ripe for a person who has less mess, and more ready to make actual change. (That part is scary for me because the kind of change they want I find destructive, and is more of a DeSantis vibe.)",r/moderatepolitics,2023-06-08T12:50:05.000Z,comment,t1_jndz5i6,,,0.0,t1_jnb3nqc,,jndz5i6,2024-03-31T20:27:59.302Z,,,,3,https://www.reddit.com/r/moderatepolitics/comments/143n58m/prosecutors_ready_to_ask_for_trump_indictment_on/jndz5i6/,t2_12zd8q,QuesoChef,65.0
These are not serious people.,r/moderatepolitics,2023-06-07T22:15:23.000Z,comment,t1_jnbezea,,,1.0,t1_jnb3nqc,,jnbezea,2024-03-31T20:27:59.302Z,,,,4,https://www.reddit.com/r/moderatepolitics/comments/143n58m/prosecutors_ready_to_ask_for_trump_indictment_on/jnbezea/,t2_833rsacz,politehornyposter,10.0
But they are voters.,r/moderatepolitics,2023-06-07T22:36:38.000Z,comment,t1_jnbi23o,,,0.0,t1_jnbezea,,jnbi23o,2024-03-31T20:27:59.302Z,,,,7,https://www.reddit.com/r/moderatepolitics/comments/143n58m/prosecutors_ready_to_ask_for_trump_indictment_on/jnbi23o/,t2_32jc4,cranktheguy,50.0
"I guess I'm in that group.  But isn't that factual that there is a nationwide conspiracy against him.  (granted you could make that statement about any politician since Biden has the other side nationwide conspiring against him).

The key question has Trump faced opposition that violated prior political norms?  I think that is clearly yes.  

Has Trump broken norms?  yes

All the NY court cases seem like cases they would never bring against anyone.  The first impeachment and Russia seemed made up to me and outside of norms.  

The classified files though do seem like something Trump is bringing on himself.  He could have just followed norms and not created the situation.",r/moderatepolitics,2023-06-08T00:54:07.000Z,comment,t1_jnc14ag,,,1.0,t1_jnb3nqc,,jnc14ag,2024-03-31T20:27:59.302Z,,,,-4,https://www.reddit.com/r/moderatepolitics/comments/143n58m/prosecutors_ready_to_ask_for_trump_indictment_on/jnc14ag/,t2_8bw2v8v,chitraders,75.0
"&gt;But isn't that factual that there is a nationwide conspiracy against him

I mean that really depends how you define conspiracy. Is there a broad effort spread across multiple federal and state agencies to investigate Donald Trump? Yes. However, it's not a conspiracy if there's legitimate reason to suspect illegal activity. Prior to running for president, Trump spent 45 years operating in the gray area between legality and illegality and has been found civilly liable on dozens of occasions for millions of dollars in damages. It's not like he was a straight arrow that immediately started being scrutinized when he was elected. The guy has been under some kind of investigation perpetually for almost five decades. It's possible that the world is out to get him, but it's also possible that his comfortable legal gray area is a lot more narrow when he's the president and every word/action he takes is logged.

&gt;The key question has Trump faced opposition that violated prior political norms? I think that is clearly yes.

Oh absolutely he has, and I will definitely agree that a decent chunk of the liberal outrage was completely overblown or based on an outright misrepresentation of facts by the media. But, as you identified, Trump broke basically every precedent and norm in the book. I truly don't think you can effectively compare him to any other president.

&gt;All the NY court cases seem like cases they would never bring against anyone. The first impeachment and Russia seemed made up to me and outside of norms.

The charges Trump was indicted on in NY are pretty standard charges for Bragg's office. Whether those charges have merit is something on which I haven't made up my mind, I'll wait to hear the prosecution's arguments in court.

Regarding the impeachment, though, that one seemed pretty cut-and-dry deserved to me. Whether Trump tried to use congressionally-approved aid to pressure Zelensky into making statements that would help Trump politically wasn't even contested by the Senate Republicans who sat through his first impeachment trial. Their main argument was that since the funds were released by the deadline and Zelensky never made the speech Trump demanded it wasn't a big deal. I personally feel that that conduct is completely disqualifying for the presidency but I know millions disagree with me or think it's par for the course.

As far as the Russia thing goes, I think Trump's 2018 comments in Helsinki, combined with the multiple congressional and independent reports confirming Russia's meddling in the 2016 to help Trump win, justify any and all  suspicion surrounding Trump's relationship to Russia. Those suspicions were inaccurate, but they were not unjustified.

&gt;The classified files though do seem like something Trump is bringing on himself. He could have just followed norms and not created the situation.

I would argue that most of the investigations and legal woes Trump faces were brought on by himself and could have be avoided had he just followed norms. Honestly my biggest issue with Trump is his inability to follow norms. I don't think he was a virulent racist nazi, I just believe that decorum and predictability are extremely important attributes for the most powerful person in the world to have. I also think that the documents investigation and Georgia investigations are examples of him pushing that ""gray area"" a bit too far and landing firmly in the realm of illegality. Trump may be the most slippery person alive but I think he'll have a hard time getting away from these two. I might be wrong though. We shall see.",r/moderatepolitics,2023-06-08T01:47:07.000Z,comment,t1_jnc8i57,,,1.0,t1_jnc14ag,,jnc8i57,2024-03-31T20:27:59.302Z,,,,6,https://www.reddit.com/r/moderatepolitics/comments/143n58m/prosecutors_ready_to_ask_for_trump_indictment_on/jnc8i57/,t2_awk7m,EmergencyTaco,65.0
"To win the primary, relying on his base could very be enough if the other votes are split over too many candidates.",r/moderatepolitics,2023-06-07T21:28:43.000Z,comment,t1_jnb7u7s,,,0.0,t1_jnb2huw,,jnb7u7s,2024-03-31T20:27:59.302Z,,,,4,https://www.reddit.com/r/moderatepolitics/comments/143n58m/prosecutors_ready_to_ask_for_trump_indictment_on/jnb7u7s/,t2_efeh7,Stockholm-Syndrom,60.0
