body,communityName,createdAt,dataType,id,isVideo,numberOfComments,numberOfreplies,parentId,parsedCommunityName,parsedId,scrapedAt,thumbnailUrl,title,upVoteRatio,upVotes,url,userId,username,sentiment_score
"URL: https://www.cnn.com/2023/06/09/politics/trump-tape-didnt-declassify-secret-information/index.html
Thumbnail: https://b.thumbs.redditmedia.com/IGSKgA3I-pp10_iENmwfmIoTkLum9Snyyf2PP8zl5Es.jpg
Images:
	https://external-preview.redd.it/r4_6r8qhMIWHzRhHOPXwwkxqEEiOHF5Qzr49WMGNq48.jpg?auto=webp&amp;s=5e86538f755e5e1891996b7ffae45ddcd67fa82b
",r/moderatepolitics,2023-06-09T12:44:27.000Z,post,t3_14549mc,False,299.0,,,moderatepolitics,14549mc,2024-03-31T20:29:35.863Z,https://b.thumbs.redditmedia.com/IGSKgA3I-pp10_iENmwfmIoTkLum9Snyyf2PP8zl5Es.jpg,Exclusive: Donald Trump admits on tape he didn’t declassify ‘secret information’,0.89,696,https://www.reddit.com/r/moderatepolitics/comments/14549mc/exclusive_donald_trump_admits_on_tape_he_didnt/,t2_2kx83lal,greg-stiemsma,55.0
"The four elements of a willful retention case ([18 USC793(e)](https://www.law.cornell.edu/uscode/text/18/793)) are:

1. Defendant had unauthorized possession of; access to; control over

&gt; As president, I could have declassified but now I can't. Secret. This is Secret information. 

2. A Document relating to National Defense Information (NDI)

&gt; This was done by the military and given to me.

3. Willfully retained the document

1,2 and 4 are all objective questions. 3 is where intent enters. 

Willfully retained, or ""simple willfulness"", means Trump knew his conduct was illegal. 

Retention can not be due to mistake or inadvertence. It does not require Trump to know exactly how he was breaking the law.  It does not require Trump to believe that the document could harm the US or aide a foreign power (this is only required for retaining or communicating non-physical information.)

Proving the document in question is classified isnt necessary, but can be used as circumstantial evidence, especially when someone is reasonably familiar with the classification system and then handles the documents in an unauthorized way (eg, knowing he has classified information that cant be declassified and is handling them outside a proper storage area.)

Acts of deception to evade detection are also treated as evidence of willfulness.

4. Failed to Deliver the document to an officer of the United States Government entitled to receive it.

The Recording is from a July 2021 Bedminster meeting.
Trump was subpoenaed May 11, 2022. But for someone reasonably familiar with classified documents, knowing you have classified documents held outside a proper storage area, and then not returning them, is enough to fail to deliver the documents.

Just Security has an excellent [Model Prosecution Memo](https://www.scribd.com/document/650130579/Just-Security-Model-Prosecution-Memo-Trump-Classified-Documents-Second-Edition-June-2023#) that gets deep into the legal weeds of the offenses -- eg what the elements and precedents and known facts and potential defenses are.",r/moderatepolitics,2023-06-09T14:24:58.000Z,comment,t1_jnj7e5r,,,1.0,t3_14549mc,,jnj7e5r,2024-03-31T20:29:35.898Z,,,,105,https://www.reddit.com/r/moderatepolitics/comments/14549mc/exclusive_donald_trump_admits_on_tape_he_didnt/jnj7e5r/,t2_3hs8ujul,pluralofjackinthebox,20.0
"Donald Trump admitted on an audio recording that that he had retained “secret” military information that he had not declassified, according to a transcript obtained by CNN. 

As president, I could have declassified, but now I can’t,” Trump says, according to the transcript.

“Secret. This is secret information. Look, look at this,” Trump says at one point, referring to a military document about a potential attack on Iran. “This was done by the military and given to me.”

“All sorts of stuff – pages long, look. Wait a minute, let’s see here. I just found, isn’t that amazing? This totally wins my case, you know. Except it is like, highly confidential. Secret. This is secret information. Look, look at this.”

What will an audio recording of Donald Trump admitting to retaining ""secret"" and ""confidential"" information mean for his criminal case? 

Will Trump basically admitting to the crime on audio tape convince any of his supporters he is guilty?",r/moderatepolitics,2023-06-09T12:48:52.000Z,comment,t1_jniumvl,,,13.0,t3_14549mc,,jniumvl,2024-03-31T20:29:35.898Z,,,,190,https://www.reddit.com/r/moderatepolitics/comments/14549mc/exclusive_donald_trump_admits_on_tape_he_didnt/jniumvl/,t2_2kx83lal,greg-stiemsma,90.0
"Eh. People really, really don't like to change their minds. 

So much of this really isn't about Trump, the person, but about US vs THEM. The IN GROUP and the OUT GROUP. People's identities and world view have become overly entangled in US being 'good' and THEM being 'bad'... that I don't think much could change either side's view about the other.",r/moderatepolitics,2023-06-09T13:05:58.000Z,comment,t1_jniwjzq,,,8.0,t1_jniumvl,,jniwjzq,2024-03-31T20:29:35.898Z,,,,139,https://www.reddit.com/r/moderatepolitics/comments/14549mc/exclusive_donald_trump_admits_on_tape_he_didnt/jniwjzq/,t2_rw0hn,Waitin4Godot,40.0
The only good to come from this alleged audio in that respect is that Trump's supporters can no longer say that the documents recovered from MAL were already declassified. Trump on tape saying he could have declassified them but didn't *should* put that particular narrative to rest.,r/moderatepolitics,2023-06-09T13:26:36.000Z,comment,t1_jniz4hd,,,4.0,t1_jniwjzq,,jniz4hd,2024-03-31T20:29:35.898Z,,,,100,https://www.reddit.com/r/moderatepolitics/comments/14549mc/exclusive_donald_trump_admits_on_tape_he_didnt/jniz4hd/,t2_qvdxbkaq,Suchrino,60.0
"Trump supporters will claim the tape is fake or say that he can do whatever he wants, and that this is a totally unfair witch hunt the likes of which the world has never seen. They'll say this because that's what Trump is saying. 

At this point, they're all in and no amount of evidence will convince them he isn't some sort of messiah.",r/moderatepolitics,2023-06-09T13:38:36.000Z,comment,t1_jnj0plu,,,2.0,t1_jniz4hd,,jnj0plu,2024-03-31T20:29:35.898Z,,,,77,https://www.reddit.com/r/moderatepolitics/comments/14549mc/exclusive_donald_trump_admits_on_tape_he_didnt/jnj0plu/,t2_yv05k,jbcmh81,85.0
"It's a personality cult, pure and simple.  Trying to change the mind of a cultist is an exercise in futility.",r/moderatepolitics,2023-06-09T13:48:01.000Z,comment,t1_jnj20f2,,,2.0,t1_jnj0plu,,jnj20f2,2024-03-31T20:29:35.898Z,,,,46,https://www.reddit.com/r/moderatepolitics/comments/14549mc/exclusive_donald_trump_admits_on_tape_he_didnt/jnj20f2/,t2_6uwzs,hatersaurusrex,10.0
"Why was this in violation? Cults exist. The definition of exactly what qualifies a group as a cult is fluid. It is a fairly reasonable statment to say trying to change cultists' minds is futile. My cousin was in the Moonies and forfeited her entire inheritance to them, and married a total stranger in a 4000-person ceremony. Most people consider that cultish behavior. Will saying so get me banned?",r/moderatepolitics,2023-06-10T12:13:22.000Z,comment,t1_jnnek9q,,,0.0,t1_jnj20f2,,jnnek9q,2024-03-31T20:29:35.898Z,,,,6,https://www.reddit.com/r/moderatepolitics/comments/14549mc/exclusive_donald_trump_admits_on_tape_he_didnt/jnnek9q/,t2_2qmf4so7,maridda,75.0
You can't use reason to convince someone out of a position they didn't arrive to via reason in the first place.,r/moderatepolitics,2023-06-09T15:19:33.000Z,comment,t1_jnjfp1o,,,2.0,t1_jnj0plu,,jnjfp1o,2024-03-31T20:29:35.898Z,,,,32,https://www.reddit.com/r/moderatepolitics/comments/14549mc/exclusive_donald_trump_admits_on_tape_he_didnt/jnjfp1o/,t2_je77v,Bakkster,30.0
"You can, but the person must first come to appreciate reason as a concept. Using reason I unconvinced myself of plenty of positions I held without reason, it just takes a little honest examination.",r/moderatepolitics,2023-06-09T17:35:58.000Z,comment,t1_jnk0uv6,,,1.0,t1_jnjfp1o,,jnk0uv6,2024-03-31T20:29:35.898Z,,,,7,https://www.reddit.com/r/moderatepolitics/comments/14549mc/exclusive_donald_trump_admits_on_tape_he_didnt/jnk0uv6/,t2_yp1c3,MySprinkler,25.0
"That's the distinction. People can become more reasonable by themselves, but not through other people showing them their unreasonableness.",r/moderatepolitics,2023-06-09T17:38:44.000Z,comment,t1_jnk1a0h,,,0.0,t1_jnk0uv6,,jnk1a0h,2024-03-31T20:29:35.898Z,,,,7,https://www.reddit.com/r/moderatepolitics/comments/14549mc/exclusive_donald_trump_admits_on_tape_he_didnt/jnk1a0h/,t2_je77v,Bakkster,60.0
"A good reminder, but it can be difficult when some of those people are those you care about.",r/moderatepolitics,2023-06-09T16:42:16.000Z,comment,t1_jnjspjs,,,1.0,t1_jnjfp1o,,jnjspjs,2024-03-31T20:29:35.898Z,,,,10,https://www.reddit.com/r/moderatepolitics/comments/14549mc/exclusive_donald_trump_admits_on_tape_he_didnt/jnjspjs/,t2_yv05k,jbcmh81,50.0
"For sure, I've had my share of issues over the last 8-ish years as a result. It's why I try to remember this part, and from there decide if it's worth it to me or not.",r/moderatepolitics,2023-06-09T16:43:40.000Z,comment,t1_jnjsxbj,,,0.0,t1_jnjspjs,,jnjsxbj,2024-03-31T20:29:35.898Z,,,,9,https://www.reddit.com/r/moderatepolitics/comments/14549mc/exclusive_donald_trump_admits_on_tape_he_didnt/jnjsxbj/,t2_je77v,Bakkster,50.0
"&gt;The only good to come from this alleged audio in that respect is that Trump's supporters can no longer say that the documents recovered from MAL were already declassified.

For a rational person this would be the case but we're talking about the MAGA cult. Logic doesn't apply.",r/moderatepolitics,2023-06-09T15:02:13.000Z,comment,t1_jnjd0w9,,,2.0,t1_jniz4hd,,jnjd0w9,2024-03-31T20:29:35.898Z,,,,23,https://www.reddit.com/r/moderatepolitics/comments/14549mc/exclusive_donald_trump_admits_on_tape_he_didnt/jnjd0w9/,t2_4dor4fqm,tjschroeder87,90.0
"They at least need to think of some (bound to be impressive) mental gymnastics in order to get around that audio. But it does have to get released, because they're currently just denying that it exists because it's coming from CNN.",r/moderatepolitics,2023-06-09T15:04:43.000Z,comment,t1_jnjdedm,,,0.0,t1_jnjd0w9,,jnjdedm,2024-03-31T20:29:35.898Z,,,,4,https://www.reddit.com/r/moderatepolitics/comments/14549mc/exclusive_donald_trump_admits_on_tape_he_didnt/jnjdedm/,t2_qvdxbkaq,Suchrino,55.0
"They’ll just adopt the Fox News- adjusted goalposts.  It’s a witch hunt, the FBI is corrupt, Russia, Hillary emails, Hunter Biden has the launch codes. They honestly don’t care whether what he did was wrong or illegal or impactful.",r/moderatepolitics,2023-06-09T18:33:33.000Z,comment,t1_jnk9inr,,,0.0,t1_jniz4hd,,jnk9inr,2024-03-31T20:29:35.898Z,,,,7,https://www.reddit.com/r/moderatepolitics/comments/14549mc/exclusive_donald_trump_admits_on_tape_he_didnt/jnk9inr/,t2_7sme7f4,uconnboston,80.0
"&gt; Trump on tape saying he could have declassified them but didn't should put that particular narrative to rest.

So A) My 2 cents as a lawyer who hasn't dug too deep into any of this, you can't really take what he says at face value. Trump isn't really qualified to say what he legally did or did not do nor whether or not he possesses the power to do something. The only thing it really effects is what his intent was. That's why any competent attorney would tell their client to shut the fuck up when being asked technical questions. It's either for their attorney or a qualified expert to opine on that stuff. 

Which goes to B) Holy shit I think I developed an aneurysm reading his quotes in this article. I'm tired with the flu, but man, that was painful to read. I'm honestly astounded he managed to make it through his presidency without screwing up catastrophically and not providing prosecutors more red meat than he already has.",r/moderatepolitics,2023-06-09T20:56:59.000Z,comment,t1_jnkuty6,,,1.0,t1_jniz4hd,,jnkuty6,2024-03-31T20:29:35.898Z,,,,2,https://www.reddit.com/r/moderatepolitics/comments/14549mc/exclusive_donald_trump_admits_on_tape_he_didnt/jnkuty6/,t2_27uqvsuv,Monster-1776,35.0
"Yes, obviously we don't know what was physically happening there when the audio was recorded. But Trump readily admits that he *had* the power to declassified information, as in past tense, and that he was aware that ""this"", whatever he was referencing, remained classified. It's really just an awareness that he knew the difference and no longer could declassified anything. I think it just shows he can't argue ignorance.",r/moderatepolitics,2023-06-09T21:36:17.000Z,comment,t1_jnl0hah,,,0.0,t1_jnkuty6,,jnl0hah,2024-03-31T20:29:35.898Z,,,,4,https://www.reddit.com/r/moderatepolitics/comments/14549mc/exclusive_donald_trump_admits_on_tape_he_didnt/jnl0hah/,t2_qvdxbkaq,Suchrino,35.0
"I'm a big believer that people need offramps to change their beliefs, because it allows them to do so without having to admit defeat. Libertarianism was one of the great offramps for conservatives over the last 15 years or so, because it allowed them to walk away from major culture war issues of the 2000s like gay marriage and Iraq without having to admit they were wrong. All you have to do is admit you're more libertarian now and suddenly the policies of George W Bush no longer stick to you. This is how we got Clint Eastwood yelling at a chair in 2012 referring to Iraq and Afghanistan as ""Obama's War"" only 4 years after the Iraq war was the biggest culture war issue on conservative media. We have a Republican primary going on right now, a perfect time to jump on someone else's bandwagon and start framing Trump as a RINO and former Democrat. It's going to happen one day, I don't see why the Republican party doesn't make that happen sooner than later.",r/moderatepolitics,2023-06-09T14:21:01.000Z,comment,t1_jnj6sw6,,,6.0,t1_jniwjzq,,jnj6sw6,2024-03-31T20:29:35.898Z,,,,74,https://www.reddit.com/r/moderatepolitics/comments/14549mc/exclusive_donald_trump_admits_on_tape_he_didnt/jnj6sw6/,t2_15o5ty,moonfox1000,60.0
Trump has given them so many off-ramps and they have failed that test over and over and over again.,r/moderatepolitics,2023-06-09T14:40:03.000Z,comment,t1_jnj9mtb,,,0.0,t1_jnj6sw6,,jnj9mtb,2024-03-31T20:29:35.898Z,,,,45,https://www.reddit.com/r/moderatepolitics/comments/14549mc/exclusive_donald_trump_admits_on_tape_he_didnt/jnj9mtb/,t2_302ja,build319,10.0
"I agree that people need off ramps, a way to save face, to change such a big change.

I'm not sure this will be it since all the government investigations against him have been positioned as politically motivated. I've seen many comments like ""every President has mishandled sensitive/ secret documents.""

The narrative is already there that this is just more of the same political hit job.  So becomes less about what is real and more about THEM just screwing US unfairly.",r/moderatepolitics,2023-06-09T14:26:49.000Z,comment,t1_jnj7o1j,,,0.0,t1_jnj6sw6,,jnj7o1j,2024-03-31T20:29:35.898Z,,,,22,https://www.reddit.com/r/moderatepolitics/comments/14549mc/exclusive_donald_trump_admits_on_tape_he_didnt/jnj7o1j/,t2_rw0hn,Waitin4Godot,40.0
"In my experience, the libertarian label was less of an offramp from Republican populism/authoritarianism, and more of their attempt to save face in polite company to explain why they continue to vote straight Republican.",r/moderatepolitics,2023-06-09T15:18:15.000Z,comment,t1_jnjfht8,,,0.0,t1_jnj6sw6,,jnjfht8,2024-03-31T20:29:35.898Z,,,,47,https://www.reddit.com/r/moderatepolitics/comments/14549mc/exclusive_donald_trump_admits_on_tape_he_didnt/jnjfht8/,t2_je77v,Bakkster,75.0
"&gt;Libertarianism was one of the great offramps for conservatives over the last 15 years or so, because it allowed them to walk away from major culture war issues of the 2000s like gay marriage and Iraq without having to admit they were wrong. All you have to do is admit you're more libertarian now and suddenly the policies of George W Bush no longer stick to you.

Too bad all those conservatives never actually changed most of their opinions on anything when they started calling themselves libertarian. Look at the LP and the support that openly anti LGBT or openly racist candidates are getting. Look at how their pushing Dave Smith for the next pres candidate despite him saying that Libertarians should not ""split the vote"" and instead should just vote Republican. 

They just liked the name. They never actually changed their beliefs.",r/moderatepolitics,2023-06-09T14:53:24.000Z,comment,t1_jnjbnxp,,,1.0,t1_jnj6sw6,,jnjbnxp,2024-03-31T20:29:35.898Z,,,,32,https://www.reddit.com/r/moderatepolitics/comments/14549mc/exclusive_donald_trump_admits_on_tape_he_didnt/jnjbnxp/,t2_5e75p,vankorgan,70.0
"That's because the Mises Caucus (basically, Ron Paul's camp) has genuinely hijacked the LP. That's been well-documented. 

https://www.thedailybeast.com/libertarian-party-is-fighting-a-civil-war-over-its-right-wing-mises-caucus?source=twitter&amp;via=desktop

https://www.splcenter.org/hatewatch/2022/05/25/mises-caucus-could-it-sway-libertarian-party-hard-right",r/moderatepolitics,2023-06-10T07:48:13.000Z,comment,t1_jnmu6ev,,,1.0,t1_jnjbnxp,,jnmu6ev,2024-03-31T20:29:35.898Z,,,,5,https://www.reddit.com/r/moderatepolitics/comments/14549mc/exclusive_donald_trump_admits_on_tape_he_didnt/jnmu6ev/,t2_vri8o,TheNerdWonder,80.0
"That's true but there is also the countervailing problem: the more egregious the behavior the more wedded to the individual they become, because the consequences of admitting you were wrong (at least to their own ego) are so huge.  At this point if you get off the Trump train you are basically saying to yourself that you were willing to be a rube for 8 years.  That is a hard pill to swallow.",r/moderatepolitics,2023-06-09T20:44:18.000Z,comment,t1_jnksyzd,,,0.0,t1_jnj6sw6,,jnksyzd,2024-03-31T20:29:35.898Z,,,,2,https://www.reddit.com/r/moderatepolitics/comments/14549mc/exclusive_donald_trump_admits_on_tape_he_didnt/jnksyzd/,t2_ckc2m,amiablegent,70.0
"What’s sad is so many people thinking Trump considers them part of an “us”.  There is a long and ever growing list of people he has stiffed, lied to, didn’t pay what he owed, or otherwise betrayed.  Somehow, his voters think it’s different with them.",r/moderatepolitics,2023-06-09T13:32:31.000Z,comment,t1_jnizwbn,,,1.0,t1_jniwjzq,,jnizwbn,2024-03-31T20:29:35.898Z,,,,32,https://www.reddit.com/r/moderatepolitics/comments/14549mc/exclusive_donald_trump_admits_on_tape_he_didnt/jnizwbn/,t2_3ntt2y58,jimbo_kun,85.0
Didn’t he pardon Steve Bannon after Bannon was convicted of scamming Trump’s supporters?,r/moderatepolitics,2023-06-09T19:58:12.000Z,comment,t1_jnkm6nm,,,0.0,t1_jnj4u71,,jnkm6nm,2024-03-31T20:29:35.898Z,,,,4,https://www.reddit.com/r/moderatepolitics/comments/14549mc/exclusive_donald_trump_admits_on_tape_he_didnt/jnkm6nm/,t2_5zqrucjx,IHerebyDemandtoPost,60.0
"Someone upthread said, “why don’t Republicans just vote for another candidate with the same policies?” It’s mostly because they love how Trump owns the libs. If people that they hate, hate Trump, that’s enough reason for them to support Trump - regardless of what he does or says.",r/moderatepolitics,2023-06-09T15:17:13.000Z,comment,t1_jnjfbwl,,,0.0,t1_jniwjzq,,jnjfbwl,2024-03-31T20:29:35.898Z,,,,12,https://www.reddit.com/r/moderatepolitics/comments/14549mc/exclusive_donald_trump_admits_on_tape_he_didnt/jnjfbwl/,t2_9q922zej,joeshoe70,90.0
"Bothsides-ism. It’s definitely not about Trumps law-breaking, nat-sec compromising actions. Nope, “everyone” is in the wrong…",r/moderatepolitics,2023-06-09T19:30:39.000Z,comment,t1_jnki3rg,,,0.0,t1_jniwjzq,,jnki3rg,2024-03-31T20:29:35.898Z,,,,4,https://www.reddit.com/r/moderatepolitics/comments/14549mc/exclusive_donald_trump_admits_on_tape_he_didnt/jnki3rg/,t2_4z0wq,samudrin,80.0
"&gt;People's identities and world view have become overly entangled in US being 'good' and THEM being 'bad'

I thought politics in terms of actual major policy was normal for the most part until Roe v Wade was overturned. There is something just so extreme about removing basic human rights (in my opinion of course) that I now view politics as a binary choice, good vs evil in many cases.",r/moderatepolitics,2023-06-09T13:19:41.000Z,comment,t1_jniy87e,,,4.0,t1_jniwjzq,,jniy87e,2024-03-31T20:29:35.898Z,,,,21,https://www.reddit.com/r/moderatepolitics/comments/14549mc/exclusive_donald_trump_admits_on_tape_he_didnt/jniy87e/,t2_2olgrra5,NoAWP,85.0
"Overturning Roe v Wade has been ""normal"" conservative policy for many years now tho. Like, the whole thing is that many of them openly disagree with the idea that these ""basic human rights"" (I also agree that they *are* basic human rights btw) are actually rights at all",r/moderatepolitics,2023-06-09T14:19:20.000Z,comment,t1_jnj6jv3,,,1.0,t1_jniy87e,,jnj6jv3,2024-03-31T20:29:35.898Z,,,,12,https://www.reddit.com/r/moderatepolitics/comments/14549mc/exclusive_donald_trump_admits_on_tape_he_didnt/jnj6jv3/,t2_mnvq0fuw,Okbuddyliberals,90.0
"The thing is that, before the Dobbs decision, it was very easy for far away (or even sometimes close up) people to see the abortion positions as empty pandering, or as salad dressing, or as some far off hypothetical thing that's never *actually* going to happen. The difference between somebody slinging around a gun by the trigger on their finger being some scary performance, but something you can ignore or convince yourself is safe, and somebody doing such *and then having it discharge*. 

Now it's so much more evident that yes, they can and will *do* these things. It's why Biden getting gay marriage formally recognized legally, and not just through the supreme court, was such a win. As subtle a win as it was given how it felt like a formality, because republicans have focused their spite of lgbt people specifically on the ""T"" segment.",r/moderatepolitics,2023-06-09T17:58:06.000Z,comment,t1_jnk48gk,,,0.0,t1_jnj6jv3,,jnk48gk,2024-03-31T20:29:35.898Z,,,,7,https://www.reddit.com/r/moderatepolitics/comments/14549mc/exclusive_donald_trump_admits_on_tape_he_didnt/jnk48gk/,t2_gtoj93,RocketRelm,
"The thing about ""good"" vs ""evil"" is that they are both, more often than not, subjective. In the eyes of people who are anti-abortion, they are doing the 'good' thing.",r/moderatepolitics,2023-06-09T13:25:45.000Z,comment,t1_jniz0h6,,,1.0,t1_jniy87e,,jniz0h6,2024-03-31T20:29:35.898Z,,,,11,https://www.reddit.com/r/moderatepolitics/comments/14549mc/exclusive_donald_trump_admits_on_tape_he_didnt/jniz0h6/,t2_rw0hn,Waitin4Godot,50.0
"That is why I wrote ""in my opinion of course"".",r/moderatepolitics,2023-06-09T13:39:51.000Z,comment,t1_jnj0vtz,,,0.0,t1_jniz0h6,,jnj0vtz,2024-03-31T20:29:35.898Z,,,,12,https://www.reddit.com/r/moderatepolitics/comments/14549mc/exclusive_donald_trump_admits_on_tape_he_didnt/jnj0vtz/,t2_2olgrra5,NoAWP,50.0
Pro life people sincerely believe they are defending the most basic human rights of the unborn.,r/moderatepolitics,2023-06-09T13:33:25.000Z,comment,t1_jnj00kc,,,4.0,t1_jniy87e,,jnj00kc,2024-03-31T20:29:35.898Z,,,,8,https://www.reddit.com/r/moderatepolitics/comments/14549mc/exclusive_donald_trump_admits_on_tape_he_didnt/jnj00kc/,t2_3ntt2y58,jimbo_kun,30.0
"Yet they typically oppose giving out birth control and sex education, the two most effective ways of preventing abortions.",r/moderatepolitics,2023-06-09T13:44:55.000Z,comment,t1_jnj1kuo,,,1.0,t1_jnj00kc,,jnj1kuo,2024-03-31T20:29:35.898Z,,,,46,https://www.reddit.com/r/moderatepolitics/comments/14549mc/exclusive_donald_trump_admits_on_tape_he_didnt/jnj1kuo/,t2_zvroo,pfmiller0,90.0
I guess they probably think promiscuous sex is wrong too.,r/moderatepolitics,2023-06-09T14:37:15.000Z,comment,t1_jnj97nj,,,2.0,t1_jnj1kuo,,jnj97nj,2024-03-31T20:29:35.898Z,,,,5,https://www.reddit.com/r/moderatepolitics/comments/14549mc/exclusive_donald_trump_admits_on_tape_he_didnt/jnj97nj/,t2_urd9et46,ObeyCoffeeDrinkSatan,10.0
"This is it. It has nothing to do with the unborn, eventually they always circle back to ""if you don't want to get pregnant close your legs."" They don't want women having, and especially enjoying, sex unless it's with their husband and for making babies. They want to control women.",r/moderatepolitics,2023-06-09T15:21:26.000Z,comment,t1_jnjfzwt,,,0.0,t1_jnj97nj,,jnjfzwt,2024-03-31T20:29:35.898Z,,,,25,https://www.reddit.com/r/moderatepolitics/comments/14549mc/exclusive_donald_trump_admits_on_tape_he_didnt/jnjfzwt/,t2_2fwezehq,Haywoodjablowme1029,90.0
"And same sex marriage, both opposed by the Republican party platform.

You don't have to go that far back to find them arguing this kind of state involvement in the bedroom was the evil thing.",r/moderatepolitics,2023-06-09T15:22:21.000Z,comment,t1_jnjg51y,,,0.0,t1_jnj97nj,,jnjg51y,2024-03-31T20:29:35.898Z,,,,11,https://www.reddit.com/r/moderatepolitics/comments/14549mc/exclusive_donald_trump_admits_on_tape_he_didnt/jnjg51y/,t2_je77v,Bakkster,70.0
And look at the harm that has caused.,r/moderatepolitics,2023-06-09T13:44:17.000Z,comment,t1_jnj1hoi,,,0.0,t1_jnj00kc,,jnj1hoi,2024-03-31T20:29:35.898Z,,,,14,https://www.reddit.com/r/moderatepolitics/comments/14549mc/exclusive_donald_trump_admits_on_tape_he_didnt/jnj1hoi/,t2_8631yez3,Elegant_Body_2153,50.0
"I find that hard to believe when the anti-choice crowd:

1. Refuses to pick up any other measures that could reduce abortions, like sex ed and contraception accessibility. What a coincidence, those are also wrong for totally different reasons.

2. Is happy to accept rape and incest exceptions, as if that suddenly makes baby-murder (as they see it) acceptable.",r/moderatepolitics,2023-06-09T20:33:43.000Z,comment,t1_jnkrf7q,,,0.0,t1_jnj00kc,,jnkrf7q,2024-03-31T20:29:35.898Z,,,,3,https://www.reddit.com/r/moderatepolitics/comments/14549mc/exclusive_donald_trump_admits_on_tape_he_didnt/jnkrf7q/,t2_4a6a1,TrainOfThought6,75.0
