body,communityName,createdAt,dataType,id,isVideo,numberOfComments,numberOfreplies,parentId,parsedCommunityName,parsedId,scrapedAt,thumbnailUrl,title,upVoteRatio,upVotes,url,userId,username,sentiment_score
"So the other day I was moving and my former neighbor came over to talk to me. He is white, in his 30s with a child. He proceeds to start ranting about how the other neighbor(also white, 30s) who lives in my building, had sent him a link to an article about how America is following certain rules and guidelines to turn into Communist China. Apparently there are 32(?) ""Rules""..and the manifesto lists things from migrants to sex trafficking, gays, transgender, schools, Covid and all the other hits of the far right tinfoil hat universe..both of my former neighbors are massive drug addicts living in squalor and both are Trump supporters. I moved to my new place in a different state and town and down the street from me is what looks like a junkyard but apparently is someone's house and there are MAGA flags, stickers and a "" Trump Won"" flag..around the corner is a trailer with overgrown grass and junk everywhere with a massive ""Trump 2024"" banner hanging off their deck ..I don't understand how these people think that a supposed ""billionaire"" who flies on private jets, is married to a former model, owns golf clubs, and  hotels and properties all over the world, that rich elite, he somehow relates to your plight and understands what you are going through? Is it plain stupidity or cult following or ignorance on purpose?",r/Liberal,2023-08-13T19:06:49.000Z,post,t3_15q79ev,False,141.0,,,Liberal,15q79ev,2024-03-31T20:37:57.399Z,self,What is happening to America.,0.94,323,https://www.reddit.com/r/Liberal/comments/15q79ev/what_is_happening_to_america/,t2_576d419q,ethakidd,70.0
"They relate because he plays the victim and makes THEM feel like victims too. You're poor? Well it's immigrants taking the good jobs. You're rich? Nobody wants to work. You're straight? Guys are taking your rights. You're white? PoC are mooching off the system.

Republicans, and predominantly Trump, has started a culture war with white people and made them think *they* deserve more rights too..... as if it's a fucking pie and the more someone gets the less they get.

They use hate and weak minded people to oush their agendas. Aka, tax cuts for the rich and more Christian power",r/Liberal,2023-08-13T19:19:23.000Z,comment,t1_jw1gzcn,,,2.0,t3_15q79ev,,jw1gzcn,2024-03-31T20:37:57.437Z,,,,220,https://www.reddit.com/r/Liberal/comments/15q79ev/what_is_happening_to_america/jw1gzcn/,t2_2m3jk8tr,Stonecutter_12-83,85.0
Immigrants taking our job and nobody wants to work!,r/Liberal,2023-08-14T01:03:58.000Z,comment,t1_jw2vh65,,,2.0,t1_jw1gzcn,,jw2vh65,2024-03-31T20:37:57.437Z,,,,30,https://www.reddit.com/r/Liberal/comments/15q79ev/what_is_happening_to_america/jw2vh65/,t2_e8hl2,Pickle_ninja,10.0
"I keep telling mine to let they immigrants in since no one wants to work, and it breaks their brains. Also I found out this week some people still think COVID stimulus checks are going out.",r/Liberal,2023-08-14T11:23:14.000Z,comment,t1_jw4j8q6,,,2.0,t1_jw2vh65,,jw4j8q6,2024-03-31T20:37:57.437Z,,,,16,https://www.reddit.com/r/Liberal/comments/15q79ev/what_is_happening_to_america/jw4j8q6/,t2_69bnp,Abrushing,70.0
Yep. My 85-year-old mother is constantly complaining about illegal immigrants &amp; migrant workers while simultaneously complaining about the cost of vegetables that no American will go to the fields to pick.,r/Liberal,2023-08-14T11:41:36.000Z,comment,t1_jw4l4o9,,,1.0,t1_jw4j8q6,,jw4l4o9,2024-03-31T20:37:57.437Z,,,,12,https://www.reddit.com/r/Liberal/comments/15q79ev/what_is_happening_to_america/jw4l4o9/,t2_ijruug17,J701PR4,60.0
Alabama found that out the hard way,r/Liberal,2023-08-15T01:50:36.000Z,comment,t1_jw87kef,,,0.0,t1_jw4l4o9,,jw87kef,2024-03-31T20:37:57.437Z,,,,1,https://www.reddit.com/r/Liberal/comments/15q79ev/what_is_happening_to_america/jw87kef/,t2_jc3rd1gl,mrzu2,50.0
"I tried to explain to my dad this concept at the grocery store.

Trump was tough on immigration. That mixed with covid saw the flow of immigrants drop.

These people worked low tier jobs like McDonalds and farms, etc...

This created demand for those jobs and thus increased wages.

These increases in wages then lead to higher prices because lord knows the shareholders aren't going to lose money.

It is what it is dad!",r/Liberal,2023-08-18T15:54:54.000Z,comment,t1_jwqiaw4,,,0.0,t1_jw4j8q6,,jwqiaw4,2024-03-31T20:37:57.437Z,,,,1,https://www.reddit.com/r/Liberal/comments/15q79ev/what_is_happening_to_america/jwqiaw4/,t2_e8hl2,Pickle_ninja,70.0
And both while unemployment is at a record low.,r/Liberal,2023-08-14T12:51:25.000Z,comment,t1_jw4t83w,,,0.0,t1_jw2vh65,,jw4t83w,2024-03-31T20:37:57.437Z,,,,5,https://www.reddit.com/r/Liberal/comments/15q79ev/what_is_happening_to_america/jw4t83w/,t2_6hhdf,captmonkey,50.0
They relate because liberals hate Trump which means he’s doing something right.,r/Liberal,2023-08-13T23:18:59.000Z,comment,t1_jw2h7pc,,,1.0,t1_jw1gzcn,,jw2h7pc,2024-03-31T20:37:57.437Z,,,,14,https://www.reddit.com/r/Liberal/comments/15q79ev/what_is_happening_to_america/jw2h7pc/,t2_o0ssf,PaulClarkLoadletter,80.0
"With this idea, all republicans hate Biden, so he must doing something right.",r/Liberal,2023-08-14T00:38:07.000Z,comment,t1_jw2s13q,,,1.0,t1_jw2h7pc,,jw2s13q,2024-03-31T20:37:57.437Z,,,,35,https://www.reddit.com/r/Liberal/comments/15q79ev/what_is_happening_to_america/jw2s13q/,t2_bjgv5,MisterMaryJane,90.0
"Not necessarily. They feel like they are an oppressed group fighting against a cabal of anti-American forces. 

You gotta remember, these people live like they’re the main character in a video game. There’s no self reflection or seeing things from others’ perspectives 

Everyone hates Biden because he’s bad, everyone hates trump because he’s the best.",r/Liberal,2023-08-14T02:56:21.000Z,comment,t1_jw39ydt,,,0.0,t1_jw2s13q,,jw39ydt,2024-03-31T20:37:57.437Z,,,,20,https://www.reddit.com/r/Liberal/comments/15q79ev/what_is_happening_to_america/jw39ydt/,t2_6xqhgdq8,_aPOSTERIORI,75.0
Anti intellectualism?,r/Liberal,2023-08-13T19:17:31.000Z,comment,t1_jw1gox9,,,1.0,t3_15q79ev,,jw1gox9,2024-03-31T20:37:57.437Z,,,,85,https://www.reddit.com/r/Liberal/comments/15q79ev/what_is_happening_to_america/jw1gox9/,t2_7nd1h,twistedh8,50.0
Almost always the answer,r/Liberal,2023-08-14T01:23:28.000Z,comment,t1_jw2y26n,,,0.0,t1_jw1gox9,,jw2y26n,2024-03-31T20:37:57.437Z,,,,15,https://www.reddit.com/r/Liberal/comments/15q79ev/what_is_happening_to_america/jw2y26n/,t2_159ud3,Tremor_Sense,50.0
I really hate that all the poor rural people are trump people. It amazes me how wrong they are.,r/Liberal,2023-08-13T20:51:29.000Z,comment,t1_jw1veks,,,5.0,t3_15q79ev,,jw1veks,2024-03-31T20:37:57.437Z,,,,123,https://www.reddit.com/r/Liberal/comments/15q79ev/what_is_happening_to_america/jw1veks/,t2_p780u,mrsmushroom,90.0
Yeah that in fact they are voting for the very party most oppressing them.,r/Liberal,2023-08-14T03:26:52.000Z,comment,t1_jw3dko7,,,0.0,t1_jw1veks,,jw3dko7,2024-03-31T20:37:57.437Z,,,,54,https://www.reddit.com/r/Liberal/comments/15q79ev/what_is_happening_to_america/jw3dko7/,t2_eneisnd,Oscarcharliezulu,30.0
Or the religious zealots thinking he’s a Christian,r/Liberal,2023-08-14T05:23:41.000Z,comment,t1_jw3poli,,,0.0,t1_jw1veks,,jw3poli,2024-03-31T20:37:57.437Z,,,,26,https://www.reddit.com/r/Liberal/comments/15q79ev/what_is_happening_to_america/jw3poli/,t2_6ym5pfrxp,Hiwhatsup666,20.0
"Because all people need is to feel better than someone else. Trump let’s them feel better than trans, poc, libs, whoever. They’re “true Americans.”",r/Liberal,2023-08-14T04:43:54.000Z,comment,t1_jw3lw87,,,0.0,t1_jw1veks,,jw3lw87,2024-03-31T20:37:57.437Z,,,,36,https://www.reddit.com/r/Liberal/comments/15q79ev/what_is_happening_to_america/jw3lw87/,t2_1jtp5g1i,snarky_spice,85.0
"There’s a certain thing that can happen psychologically to people that live in a small town and that paired with limited resources for education, it makes sense",r/Liberal,2023-08-14T13:00:25.000Z,comment,t1_jw4udl9,,,0.0,t1_jw1veks,,jw4udl9,2024-03-31T20:37:57.437Z,,,,9,https://www.reddit.com/r/Liberal/comments/15q79ev/what_is_happening_to_america/jw4udl9/,t2_arm8u,jabroni156,20.0
"Like all the poor Southerners who fought for the Confederacy. Plantation owners didn’t care a shit about them, but white trash wanted someone to be worse off than them so they fought for slavery during the War of Northern Aggression.",r/Liberal,2023-08-19T18:07:49.000Z,comment,t1_jww0el0,,,0.0,t1_jw1veks,,jww0el0,2024-03-31T20:37:57.437Z,,,,1,https://www.reddit.com/r/Liberal/comments/15q79ev/what_is_happening_to_america/jww0el0/,t2_9ybqqa68,Own_Entertainment847,85.0
They don't care about what he is they care about who he is and how terrible of a person he is and encourages others to be so as well.  He gives them permission to be their real selves aka their worst selves.,r/Liberal,2023-08-13T20:27:25.000Z,comment,t1_jw1rmot,,,1.0,t3_15q79ev,,jw1rmot,2024-03-31T20:37:57.437Z,,,,30,https://www.reddit.com/r/Liberal/comments/15q79ev/what_is_happening_to_america/jw1rmot/,t2_3hk7i0ea,NaitoSenshin889055,80.0
"Yes! This is what I finally figured out about MAGA people. They want the most cruel, racist, sexist, violent, homophobic candidate they can vote for and that candidate is Trump. Desantis tries to go farther to the right of Trump, but there isn't anything farther right than Trump. Trump represents their most basic, cave man like tendencies and they love him for it",r/Liberal,2023-08-13T21:57:37.000Z,comment,t1_jw25flf,,,2.0,t1_jw1rmot,,jw25flf,2024-03-31T20:37:57.437Z,,,,28,https://www.reddit.com/r/Liberal/comments/15q79ev/what_is_happening_to_america/jw25flf/,t2_576d419q,ethakidd,80.0
And if he's in power that means their views are right,r/Liberal,2023-08-14T15:24:11.000Z,comment,t1_jw5fg6n,,,0.0,t1_jw25flf,,jw5fg6n,2024-03-31T20:37:57.437Z,,,,3,https://www.reddit.com/r/Liberal/comments/15q79ev/what_is_happening_to_america/jw5fg6n/,t2_5cnx0,BenAfleckIsAnOkActor,80.0
"Why do they want that?
 It's called map theory the map is the fake world we live in. And their words are changing",r/Liberal,2023-08-15T01:53:31.000Z,comment,t1_jw87zay,,,0.0,t1_jw25flf,,jw87zay,2024-03-31T20:37:57.437Z,,,,1,https://www.reddit.com/r/Liberal/comments/15q79ev/what_is_happening_to_america/jw87zay/,t2_jc3rd1gl,mrzu2,15.0
"Same thing as ever, but more overtly fascist; wealthy people turning average working class folk against each other to cover for their own crimes and the massive inequality that’s resulted",r/Liberal,2023-08-13T19:32:37.000Z,comment,t1_jw1j0qs,,,2.0,t3_15q79ev,,jw1j0qs,2024-03-31T20:37:57.437Z,,,,50,https://www.reddit.com/r/Liberal/comments/15q79ev/what_is_happening_to_america/jw1j0qs/,t2_72fdsmpl,Temporary_Target4156,85.0
"It's not 2023 it's really 1927!!!

That's the last  time the wealth gap was this bad",r/Liberal,2023-08-15T01:55:33.000Z,comment,t1_jw889k5,,,0.0,t1_jw1j0qs,,jw889k5,2024-03-31T20:37:57.437Z,,,,3,https://www.reddit.com/r/Liberal/comments/15q79ev/what_is_happening_to_america/jw889k5/,t2_jc3rd1gl,mrzu2,90.0
This is a big factor.,r/Liberal,2023-08-14T16:57:53.000Z,comment,t1_jw5uxlc,,,0.0,t1_jw1j0qs,,jw5uxlc,2024-03-31T20:37:57.437Z,,,,1,https://www.reddit.com/r/Liberal/comments/15q79ev/what_is_happening_to_america/jw5uxlc/,t2_3hbxj429,Imaginary_Medium,50.0
I know it seems like these people are the majority sometimes but they most definitely are a small minority compared to the rest of the USA.  They are just the loudest is all.,r/Liberal,2023-08-13T19:59:39.000Z,comment,t1_jw1n9fz,,,1.0,t3_15q79ev,,jw1n9fz,2024-03-31T20:37:57.437Z,,,,19,https://www.reddit.com/r/Liberal/comments/15q79ev/what_is_happening_to_america/jw1n9fz/,t2_3ebd4wtx,evers12,30.0
The vocal minority.,r/Liberal,2023-08-13T22:49:48.000Z,comment,t1_jw2d22w,,,0.0,t1_jw1n9fz,,jw2d22w,2024-03-31T20:37:57.437Z,,,,7,https://www.reddit.com/r/Liberal/comments/15q79ev/what_is_happening_to_america/jw2d22w/,t2_6n5xjiy6,Gandalftron,50.0
"I think one to think about that’s both scary yet hopeful is to remember that the internet did not come into the real main stream until smart phones came out. Yes there was AOL in the late 90’s but this older generation who really had no exposure to internet culture prior to the age of smartphones basically jumped right into the social media eco system without any training on what to believe and not believe on the internet.

I I was about 15 when the internet really took off in the AOL days so I had the luxury of learning stuff like Nigerian prince’s aren’t actually going to leave millions of dollars and that Melissa Joan Heart wasn’t actually nude in that picture my friend sent me, but this older generation is basically still in the learning phase, and because of their age, they are much slower to learn. 

The good news is that millennials and Gen Z are for the most part online savvy and can smell bullshit a mile away. The bad news is that until the boomer generation dies out, we are going to have to put up with this bullshit which will likely be another 10-20 years,  but at least there is a light at the end of the tunnel.",r/Liberal,2023-08-13T20:54:03.000Z,comment,t1_jw1vsyv,,,3.0,t3_15q79ev,,jw1vsyv,2024-03-31T20:37:57.437Z,,,,20,https://www.reddit.com/r/Liberal/comments/15q79ev/what_is_happening_to_america/jw1vsyv/,t2_aqo0lhr,Mr-Mantiz,30.0
The people coming of voting age are the ones to make the difference in the future. The only thing that I worry about are the future Trumps and Desantis who will be much smoother talking and will hide their true intentions behind a facade of inclusion and acceptance,r/Liberal,2023-08-13T21:48:34.000Z,comment,t1_jw2431h,,,1.0,t1_jw1vsyv,,jw2431h,2024-03-31T20:37:57.437Z,,,,12,https://www.reddit.com/r/Liberal/comments/15q79ev/what_is_happening_to_america/jw2431h/,t2_576d419q,ethakidd,80.0
Not sure how that facade would work.  You can say all day you are inclusive and accepting but as soon as you aren't even a lot of dumb people will catch on.,r/Liberal,2023-08-13T22:09:14.000Z,comment,t1_jw275pw,,,0.0,t1_jw2431h,,jw275pw,2024-03-31T20:37:57.437Z,,,,6,https://www.reddit.com/r/Liberal/comments/15q79ev/what_is_happening_to_america/jw275pw/,t2_w6f4h,tikifire1,20.0
Aren't a lot of young people Andrew Tate fans???,r/Liberal,2023-08-14T00:15:03.000Z,comment,t1_jw2owqs,,,1.0,t1_jw1vsyv,,jw2owqs,2024-03-31T20:37:57.437Z,,,,3,https://www.reddit.com/r/Liberal/comments/15q79ev/what_is_happening_to_america/jw2owqs/,t2_8krx7ds,valis010,50.0
"Not the overwhelming majority, and the young people who are into meme stars like Andrew Tate arent going to be a reliable voting block. Boomers are always going to vote, Andrew Tate fans arent out there organizing and making sure to vote in every election.",r/Liberal,2023-08-14T00:21:33.000Z,comment,t1_jw2psn6,,,0.0,t1_jw2owqs,,jw2psn6,2024-03-31T20:37:57.437Z,,,,4,https://www.reddit.com/r/Liberal/comments/15q79ev/what_is_happening_to_america/jw2psn6/,t2_aqo0lhr,Mr-Mantiz,20.0
I don't know how to explain those 30 and 40 y/o Freedom F-er tshirt wearers at our gym with the shaved heads an facial hair who think they are some kind of Bro-Army and have little M-16 tattoos.,r/Liberal,2023-08-14T10:40:08.000Z,comment,t1_jw4f59r,,,0.0,t1_jw1vsyv,,jw4f59r,2024-03-31T20:37:57.437Z,,,,0,https://www.reddit.com/r/Liberal/comments/15q79ev/what_is_happening_to_america/jw4f59r/,t2_13r1zz,rowsella,70.0
"The world is on a precipice of a strange time. We are approaching a world where (maybe) half of all jobs will no longer be needed, yet governments are doing nothing to plan for it. Towns are becoming junkyards, investment in people are declining, and people are searching for any strong person that claims the system is broken. Trump does it, and people latch on. I’m convinced we need another New Deal. Rebuild America and provide construction jobs to every small town.",r/Liberal,2023-08-13T19:36:54.000Z,comment,t1_jw1joua,,,2.0,t3_15q79ev,,jw1joua,2024-03-31T20:37:57.437Z,,,,40,https://www.reddit.com/r/Liberal/comments/15q79ev/what_is_happening_to_america/jw1joua/,t2_ehy2i,simplethingsoflife,85.0
"I agree with the new new deal, but we tried that a few years back. Won't happen until the republican problem is solved",r/Liberal,2023-08-13T20:21:17.000Z,comment,t1_jw1qo7s,,,1.0,t1_jw1joua,,jw1qo7s,2024-03-31T20:37:57.437Z,,,,23,https://www.reddit.com/r/Liberal/comments/15q79ev/what_is_happening_to_america/jw1qo7s/,t2_aowtp,turp119,75.0
Please see comment above. I am glad that part of the new Infrastructure Deal involves placing billboards along most major highways that explain that the construction and growth you see in areas is a direct result of Biden's bi-partisan legislation. We obviously need to do a way better job of getting the word out.,r/Liberal,2023-08-14T16:35:02.000Z,comment,t1_jw5r2nz,,,0.0,t1_jw1qo7s,,jw5r2nz,2024-03-31T20:37:57.437Z,,,,2,https://www.reddit.com/r/Liberal/comments/15q79ev/what_is_happening_to_america/jw5r2nz/,t2_yh41n,Lennymud,70.0
"Please google Infrastructure Deal to read about how Biden has managed to bring more jobs/growth/development and rebuilding since the New Deal. If you are convinced we need another New Deal you are going to be thrilled. We obviously need to get the word out. I fear people who are not aware of how much is being accomplished (follow up on your Infrastructure reading with the Chips and Science act) are more likely to fall for the ""both parties are the same"" rhetoric that is one of the reasons we got Trump in the first place.",r/Liberal,2023-08-14T16:33:31.000Z,comment,t1_jw5qtig,,,0.0,t1_jw1joua,,jw5qtig,2024-03-31T20:37:57.437Z,,,,3,https://www.reddit.com/r/Liberal/comments/15q79ev/what_is_happening_to_america/jw5qtig/,t2_yh41n,Lennymud,75.0
There are two Americas--two different narratives and media.  We aren't even hearing the same info.,r/Liberal,2023-08-14T03:24:35.000Z,comment,t1_jw3db5q,,,0.0,t1_jw1g8w0,,jw3db5q,2024-03-31T20:37:57.437Z,,,,1,https://www.reddit.com/r/Liberal/comments/15q79ev/what_is_happening_to_america/jw3db5q/,t2_168p0qkj,CrunchyCookie3,50.0
"&gt; Is it plain stupidity or cult following or ignorance on purpose?

All three at once, I suppose.",r/Liberal,2023-08-13T20:57:47.000Z,comment,t1_jw1weax,,,0.0,t3_15q79ev,,jw1weax,2024-03-31T20:37:57.437Z,,,,7,https://www.reddit.com/r/Liberal/comments/15q79ev/what_is_happening_to_america/jw1weax/,t2_46npe,Reagalan,90.0
"It's a mixture of mental health issues, low intelligence, emotional immaturity, contrarianism, and successful right-wing media brainwashing.

These people have made MAGA their identity and they can't turn back now, can't entertain the idea they're wrong, because it would risk ego collapse. So instead they double down; it's cost/sunk fallacy in action, for a significant chunk of the nation.",r/Liberal,2023-08-13T20:57:12.000Z,comment,t1_jw1waxd,,,0.0,t3_15q79ev,,jw1waxd,2024-03-31T20:37:57.437Z,,,,17,https://www.reddit.com/r/Liberal/comments/15q79ev/what_is_happening_to_america/jw1waxd/,t2_14jcz3,Vyzantinist,80.0
Conservatives are destroying America because of money and religion.,r/Liberal,2023-08-14T00:13:39.000Z,comment,t1_jw2opw6,,,1.0,t3_15q79ev,,jw2opw6,2024-03-31T20:37:57.437Z,,,,9,https://www.reddit.com/r/Liberal/comments/15q79ev/what_is_happening_to_america/jw2opw6/,t2_1upxkgo9,Silly_Pace,100.0
He is their religion. They basically boo Pastors that quote Jesus now.,r/Liberal,2023-08-14T10:51:33.000Z,comment,t1_jw4g6gq,,,0.0,t1_jw2opw6,,jw4g6gq,2024-03-31T20:37:57.437Z,,,,1,https://www.reddit.com/r/Liberal/comments/15q79ev/what_is_happening_to_america/jw4g6gq/,t2_13r1zz,rowsella,85.0
"They are dumb,  and he plays to dumb people because he's dumb.  He surrounds himself with liars and victims so he can relate to them.  He harnesses the hatred and racism of his base of clowns

Idioacracy was a documentary


Trump supporters are ignorant and have broke morals.  If you're a Trump supporter reading this,  you're garbage.",r/Liberal,2023-08-13T21:02:07.000Z,comment,t1_jw1x2rh,,,0.0,t3_15q79ev,,jw1x2rh,2024-03-31T20:37:57.437Z,,,,13,https://www.reddit.com/r/Liberal/comments/15q79ev/what_is_happening_to_america/jw1x2rh/,t2_f240jc2tn,TwitchTheMeow,85.0
Hillbilly and trailer trash watching Fox Hate News and Qanon,r/Liberal,2023-08-14T05:22:24.000Z,comment,t1_jw3pk8a,,,0.0,t3_15q79ev,,jw3pk8a,2024-03-31T20:37:57.437Z,,,,6,https://www.reddit.com/r/Liberal/comments/15q79ev/what_is_happening_to_america/jw3pk8a/,t2_6ym5pfrxp,Hiwhatsup666,90.0
Stupid disease,r/Liberal,2023-08-13T22:03:56.000Z,comment,t1_jw26d57,,,0.0,t3_15q79ev,,jw26d57,2024-03-31T20:37:57.437Z,,,,6,https://www.reddit.com/r/Liberal/comments/15q79ev/what_is_happening_to_america/jw26d57/,t2_44qvtkey,roundearthervaxxer,50.0
"I don't understand what's happening, but this makes me grateful that I don't even know what my neighbors look like considering I live in Florida.",r/Liberal,2023-08-13T22:15:34.000Z,comment,t1_jw283go,,,1.0,t3_15q79ev,,jw283go,2024-03-31T20:37:57.437Z,,,,3,https://www.reddit.com/r/Liberal/comments/15q79ev/what_is_happening_to_america/jw283go/,t2_8vvph2mm,nothingleft2burn,25.0
You need to get the hell out of there or get organized to vote the Republicans out of your state. It’s a session pool of backwards thinking people there!,r/Liberal,2023-08-14T04:24:34.000Z,comment,t1_jw3jxf3,,,1.0,t1_jw283go,,jw3jxf3,2024-03-31T20:37:57.437Z,,,,3,https://www.reddit.com/r/Liberal/comments/15q79ev/what_is_happening_to_america/jw3jxf3/,t2_6a3ii3jn5,Powerful-Pick-8416,85.0
"Sorry for the late reply, but I'm not on here super often. Anyways, I'm disabled so my options are extremely limited right now. Believe me, I would love to get the hell out of here. I'm literally trying to just survive. I do vote in every single election (been doing so since I turned 18!). Considering some of the people I've overheard around here politically, I actually feel physically in danger from people in my neighborhood, so I try to keep a low profile. I will say, it wasn't always this nuts in Florida. I'm originally from the Northeast, but I've been in Florida...too long frankly.",r/Liberal,2023-08-16T00:16:04.000Z,comment,t1_jwd2awr,,,1.0,t1_jw3jxf3,,jwd2awr,2024-03-31T20:37:57.437Z,,,,2,https://www.reddit.com/r/Liberal/comments/15q79ev/what_is_happening_to_america/jwd2awr/,t2_8vvph2mm,nothingleft2burn,65.0
"I feel for you! I understand, because I am a Native Texan. I am ashamed of Ted Cruz, Gregg Abbott etc. I would live to see Texas turn Blue!",r/Liberal,2023-08-16T00:19:37.000Z,comment,t1_jwd2tgk,,,0.0,t1_jwd2awr,,jwd2tgk,2024-03-31T20:37:57.437Z,,,,2,https://www.reddit.com/r/Liberal/comments/15q79ev/what_is_happening_to_america/jwd2tgk/,t2_6a3ii3jn5,Powerful-Pick-8416,85.0
He makes them feel ok about their hate and bigotry. That's it in a nutshell. The cruelty is and remains the point.,r/Liberal,2023-08-13T22:25:51.000Z,comment,t1_jw29md0,,,0.0,t3_15q79ev,,jw29md0,2024-03-31T20:37:57.438Z,,,,11,https://www.reddit.com/r/Liberal/comments/15q79ev/what_is_happening_to_america/jw29md0/,t2_9wzfkjem,Melodic-Translator45,85.0
"The closest I’ve gotten to understand why some people are drawn to Trump is seeing how white nationalism not only coincides with overt racism (what many people get hung up on), but also economic protectionism. When the world economy globalized, and trade deals like NAFTA were negotiated, many blue collar jobs got outsourced to foreign nations with cheap labor (most notoriously China). Immigrants also compete for blue collar jobs, which explains some of the harsh anti-immigrant sentiments. Many towns in the Rust Belt that were built around manufacturing jobs have been hollowed out and left behind. While Republicans (even under Trump) are driven by evangelical fundamentalists and union-busting corporate interests that believe in and act upon trickle down economics, Trump has shown an ability to speak to this populist rage similarly to how Ross Perot did back in the 90’s.

It’s really funny to me to hear people talk about Biden as if he’s Bill Clinton, because they are very different on the issue of protectionism. Where Clinton outsourced jobs with NAFTA, Biden signed into law the Infrastructure and Jobs Investment Act, the CHIPS and Science Act, and the Inflation Reduction Act, which are designed to create and onshore thousands of construction and manufacturing jobs for the purposes of renovating the nation’s infrastructure and pushing for green initiatives. Whether or not Biden gets credit for these accomplishments remains to be seen (I hope he does)",r/Liberal,2023-08-14T02:14:55.000Z,comment,t1_jw34spw,,,1.0,t3_15q79ev,,jw34spw,2024-03-31T20:37:57.438Z,,,,9,https://www.reddit.com/r/Liberal/comments/15q79ev/what_is_happening_to_america/jw34spw/,t2_bzcz0,msbmteam,60.0
"I don't understand the polling numbers for Biden. He is accomplishing so many great things: the economy is doing better, inflation is down, jobs are up..but his poll numbers are in the toilet.",r/Liberal,2023-08-14T13:13:45.000Z,comment,t1_jw4w3km,,,1.0,t1_jw34spw,,jw4w3km,2024-03-31T20:37:57.438Z,,,,3,https://www.reddit.com/r/Liberal/comments/15q79ev/what_is_happening_to_america/jw4w3km/,t2_576d419q,ethakidd,25.0
"It's much easier to promote a message of hate-- ANTI anything, than it is to get the message out that shit is actually getting done and that good things have happened. Our hungry 24 hr news cycle is more interested in a Truth social posting than in actual news about job growth and development.",r/Liberal,2023-08-14T16:37:56.000Z,comment,t1_jw5rkdb,,,1.0,t1_jw4w3km,,jw5rkdb,2024-03-31T20:37:57.438Z,,,,1,https://www.reddit.com/r/Liberal/comments/15q79ev/what_is_happening_to_america/jw5rkdb/,t2_yh41n,Lennymud,30.0
